,post
559," Plugga grna, men inte fr mycket. Se till att plugga smart och effektivt och inte hrt, annars sliter du ut dig sjlv och ineffektiviserar din studietid.

Jag har klasskompisar som brnner ut sig sjlva fr att ka sina betyg ngotlunda.

Detta betyder inte att du inte ska lata dig. Ligg alltid enligt plan och plugga extra p det du inte kan.

Var alltid frberedd. Jag br alltid runt p min ryggsck, och dri finns alltid materiel. S nr ett prov kommer, s finns inte ens chansen att jag glmmer penna, sudd, stift, dator, laddare etc.

Slutligen r att ta hand om dig sjlv ocks. Tillgna inte all din tid t skolan. G ut, trffa kompisar, slappna av p exempelvis fredagar, och framfrallt, gympa, sporta och idrotta. G ut ngon eller ngra dar i veckan och jogga lite, gr ett par armhvningar.

Sport r perfekt fr att rensa dina tankar och ta hand om kroppen din. "
560," Dels ocks p innehllet p sidan. r/har du varit inne p en sida fr elektronik, kanske du ser extra reklam fr datorer. Om en video p youtube r taggad med bilar, kanske du ser en volvoreklam innan etc. "
561," Beror lite p var du bor, men t.ex. SL har ju app dr det str vilken linje, vilket hll, och hllplats.

Bussarna r alltid skyltade med minst en linje, nstan alltid slutstation ocks (beror var man bor). Vl p bussen str det nsta hllplats.

Nr jag brjade gymnasiet fljde jag bara de 50 andra p bussen, s om du har tur, lr du hitta fler som ska till samma stlle.

Gr bara inte som jag gjorde en gng, att frst inte kolla busslinjen, och ifrgastta varfr mina klasskompisar inte gick p, och sen stta sig p ett stlle dr jag inte ser nsta hllplats. kte p motorvg nstan hela vgen in till tullarna, och lyckades bara komma 30 minuter sent. "
562," About the winrate. Sometimes, you're carrying your team more than you think. 

By placing a small, seemingly insignificant shot in the beginning, you may have just tipped the scales in your favour by forcing some guy to use their repairkit etc.

Hypothetical scenario:

You're playing redshire and you're team completely ignores the eastern flank, so you decide to go there. There you face 5 heavies and manage to hold them back 4 minutes, and take 3 of them down with the help of arty, and some TD far back. But you lose in the end. Yes, you did carry your flank, but in the end your team lost because they got surrounded.

Instead you might've placed yourself between your teams western flank, your 'basecampers' and the enemy push to the east. This might not give you the highest wn8, the highest damage, or most blocked by armour, but it may carry your team to victory.

I'm not telling you to camp, you'll learn this gradually by playing the game, by reading the map and adapting to the situation.

That's one thing I've learned. What's best for the team might not always be what's best for your stats. "
563, About three fiddy. You might get $4.20 if you're lucky. 
564," If you angle it, most tanks, excluding TD:s,  still won't. At least quick enough "
565, I get warthunder ads on Wotlabs 
566," I may not be the right guy to speak (1500wn8/2000recent). But I started playing quicker tanks, and try to stare at the minimap as much as I stare at my aim, just to make sure I'm doing what's best for the team, so either I'm usually in a good position to win, or I go down swinging, claiming extra wn8.

I never touch a tank tier 4 or below either, because those tanks are too unpredictable. And being a T-28 vs a cromwell or KV-2 isn't fun either. "
567," The IS-3 definitely. It's one of the best of it's tier IMO, even with all the new premium tanks.  "
568, I suspect some people are latching on purely for karma too. 
569, Reminds me of the nuzzle Pachirisu of doom from one Pokemon championship 
570," People here have already described clans pretty good, so I'll describe my experience instead. Once we were up tilm 3 am singing soviet national anthem, eating potatoes and playing kv-2 running some ridiculous streak. 

And some other time half the team ragequit the clan.

If you're good, and find an active and serious clan, you may have the time of your life and getting alot of prems and rewards, or you just do like I did and said ""Never again"" "
571," I've already deleted the game, and am currently proceeding moving a siege machine 300 meters away from their hq, so they can expect a 90kg projectile "
572,  
573," Jag minns under en hemkunskapslektion nr min kompis ropar efter lraren ganska panikartat. Lraren sger ""Du behver inte skrika eller stressa, jag hr, men hjlper nn annan just nu"". 

Min kompis sger d i helt vanlig, lugn samtalston d, ""Lrarn, det brinner"". Nu kanske inte ni tycker att det r s jttekonstigt, frutom att vi lagade soppa. "
574, But haven't you noticed obj. 140 spamming apcr AND heat? (Implying they have one as standard)? 
575," The new AMX 13 90, is a blast. Same mm but with better characteristics "
576," I remember from my childhood, when we made crustini with pesto (crackers with spread essentially). I asked my dad if I should do with basil or tomato spread, and he replied: ""Mix them"".

So I put them together in a bowl and mixed them.  "
577," It's the same with TD. There should be heavy TD, and light TD, because Strv 103b and T110E3 do not have the same roles "
578,  
579," For that price, shipping is the least of your worries. Unless you're that guy who found that cheap. "
580,  
581," Reminds me of this team me and some friends stayed up one night playing team battles. We picked an all soviet team with IS-3s, and me in the KV-2 (someone had to). 

I rush the hill on tundra, and lo and behold, a Blackdog tries rushing me. I put one HE in to him, he didn't manage to kill me in my reload, and I break his encircling and killed him.

That night we stayed up till 5 am, singing the soviet anthem, eating plain potatoes untill we lost, (took some time) "
582," I had a game today, where someone toon hits for me when I was tracked, and I tried to repay the favour later, you know, if the opportunity would arise "
583, There is no such thing as fish! 
584," Our church has both wifi, AND a pokstop. Imma tell ya, we're real popular with them kids! "
585," You're no mate, pal! "
586, Still pretty thin and would do decent splash at least 
587," But I have to play tier 1, so still hell "
588," Is it Pain, or Pein? I've seen both been used on several occasions each. "
589, I feel as that would definitely worked on r/floridaman 
590, I won't! 
591, A prank is at its best when the other part can appreciate it too 
592," Happens once a mobth that someone from our class (often me) has to help the teacher checking cables, input source etc. "
593, Reminds me of that guy playing overwatch with bananas 
594," It was back in ninth grade. By that time I was pretty bored by math as elementary school maths was easy to understand, thus not very challenging, and we moved at a slow pace.

Later that year I found out my school was giving out extended mathcourses. I thought to myself that I was pretty decent at math and was up for the challenge. So I took it.

During this course I fell in love with math as I learned alot of new stuff, and interesting applications that I'd never even imagined maths could be used for. "
595," The 13 90. Because I was shit then, and it constantly met majority of tier tens, I relied on spotting and assistance anyway. The top gub wasn't really all that different since alot of the shits never connectef anyway.

The T-10 wasn't all that bad either. That grind was actually pretty painless, since the IS-3s gun carry iver, and you don't need to unlock the turret for the gun. "
596," IS-3, amx 13-90, strv m42/57 and perhaps the FV4202 are my favourite tanks.

IS-3: It's russian, it's got armour, and that gun is absolutely killing it, slaughtering T34s who think they are safe properly hull down.

Amx 13-90: Get that crew leveled up and increase that camo+viewrange. It's now better than ever with improved mm, it's no longer always facing 13 tier Xs. The new gunhandling+pen is angelic too.

Strv m42/57: The autoloader is great for picking off same tier opponents. The small turret and great viewrange makes it surprisingly good at working ridges at ranges.

FV4202: It's versatile and the gun hits often, and inflicts damage too with that high pen.

Edit: Grammar "
597," I try to think, how much standard will I need to take to do a decent amount of damage without having to fire gold.

That's why my t-54 almost has 45/45/10 % loadut, because of the ammo capacity. I almost NEVER use the gold though, but if I am forced to, I have already fired 20+ rounds and probably am in a situation where I need to make my shots count to win the game. "
598," Or you could get Temair to blowbit all away, along with half the interior "
599," Kv-13, t-43, t-44, were all wo derful tanks to play, and pretty much no gold fired either. "
600," See: ""Cold War"" and ""nukes"" "
601, How about creating a new account using the same mail? 
602," You should try logging in on their website and resend verification email if possible.

 "
603," It's all about getting the knowledge (weakspots, angling, map awareness erc).

By tier 5 the game gets more standardised. Lowtiers are unpredictable with all the beginners who don't follow the map meta, as well as the countless sealclubbers.

I've returned to low tiers a few times, and they were essentially hell, so I draw the line at tier 5, (6 before mm change). I haven't dared ti touch tier 4 or below for half a year maybe. "
604," Because you chew it, and then it's just a moist lump of dough. How does one even manage to cram a whole donut into your throat anyway? "
605," I'd love to imagine Sasuke just dropping off some gifts by the door, knocking, then immediately leave xD

Edit: (Wow! That's a misspelling of sasuke I've never seem before) "
606," That tutorial was super realistic. I got teams that did either fuck-all, suicide rushed. I got blocked several times and took tons of team damage. Super realistic! "
607, Especially since they would otherwise have pretty low. 5-6 is bigger than 10-11 
608, That might be some graphical setting? 
609, Haha sorry. I hadn't read/seen since 2010 
610," That seems fair enough, especially because how easy it is to cast (even a dunce like Naruto learned how to use it) "
611," Aren't they the same, except you're creating several clones? "
612," I can see why some jutsus are, like don't mess with time-space or the dead, but shadow clone jutsu? I can understand that it's not commonly taught, but why forbidden?

Edit: Grammar "
613," The Jagdtiger is pretty fun to play now, more fun than since before the mm revamp "
614," I don't think it would be as abused as the report function.

""Oh no that premium tank camped and sniped all my HP without being spotted; REPORTED for everything!"" "
615," Jag minns nr jag var mindre (5?). Jag och min syster hade alltid gillat att kolla mellan trappstegen hemma, och en dag fr jag idn att stoppa igenom huvudet. Detta resulterar i att jag fastnar och inte kommer loss och drfr mste pappa komma och hjlpa mig.

En vecka senare r jag ldre, visare, och mitt huvud strre n ngonsin. Jag tnkte d att ""Hur kunde jag vara s korkad att jag fastnade?"" S jag gr om det fr att DEN HR gngen skulle jag inte gra fel!

Och jag fastnade igen.

Som tur r blev mitt huvud fr stort sedan fr att verhuvudtaget f plats i mellanrummet, som tur r. "
616," I'm not a unicum whatsoever, but my Mutz makes a decent amount of credits. Same applies for the FV4202.

For a tier VI, the Strv m42-57 makes decent credits "
617, Oh yeah! I'd definitley marry Toon Link! 
618," Adoption Wanted

Playername: Infernova (EU)

Stats: Overall: 1520 WN8, 52.67%
           Recent: 2020 WN8, 52.44%

Area of improvement: Tier 10 meta, especially meds. I have 2 meds (Bc25t and T62a sigh) and I just can't bring myself to have a positive WR in them, (40-40%).

http://wotlabs.net/eu/player/Infernova

Edit: Grammar and layout "
619, Maybe OP listens on other channels? 
620," Reminds me of a game I had in the Jgdpnzr E100. I was bust angling towards a whole bunch of enemies pounding away on my armour, and I thought I just had to accept it.

He ended up ramming, and then shotguning me, thus splashing himself to death "
621," Those aren't really seperated and are in the end combined under assistance damage, and my friend made sure to track tanks when he was three marking.

I also remember QB saying that tracking tanks is a commant tactic when going for MoE:s. "
622," There are hotkeys available, if you hover over a icon to the right, it will list the hotkey. Right clicks is used to quickly move and attack if I remember right. ""S"" is for sleep and spacebar for skip, etc.

The latter problem you specified can be fixed in the settings, and what you want to toggle off, is a setting which autocycles through your units.

This means you'll have to select every unit everytime you move, but the game won't change your camera to some faraway worker when you need your artillery to bombard someone asap. "
623, Took me too long to realise that it wasn't Majoras Mask 
624, There is one in Battlefield 4 though  
625, The worst part is that my friend actually bought one... 
626," How tough am I? I took down a lvl 5 raid alone...








...with my CP 10 Magikarp! "
627," I managed to be blindfired by a deathstar on Prohkorovka once in my 13 90, had 13 hp leftover, but I wasn't even mad "
628," The 13 90 post-buff is one my favourite tanks ever. It was ok before, with goldspam, but now it's an absolute beast, even though they nerfed it's viewrange.

I can't say the same about the replacement bc-12t. I played 5 games then sold it immediately "
629," Hey, if you wait long enough, the next update will roll out, with the raid battles, I believe every now and then, a raid will come out, resetting all the gyms. "
630," As far as I know, I hold all lf the gyms around Amsterdam central. "
631, Screenshot 
632,  
633, Would someone mind translating the numbers for non-russian speakers? 
634," Jag skulle tipsa om att kolla runt dr du bor p t.ex. anslagstavlor eller internet efter mten eller andra typer av trffar.

T.ex. hller jag p med scouting och karat dr jag drigenom ftt jttefina vnner. Och har du tur kanske du hittar en ny, kul hobby p kpet.

Tips! Inga hrlurar eller mobil nr du ska socialisera, det blir s ltt att en person tar upp mobilen, s gr den andra det och sen sotter bda och r osociala. "
635," Jag brukade se dem dr i Tumba lite hr och var, men har inte sett dem p ett tag "
636," ""As we all can see, the first roundabout stems from 1020 AD. Although highly impractical, it served as the foundation for centuries of engineering which lasts even today."" "
637, 100 duck sized horses. Easily 
638," I'm pretty sure it has to with sealclubbers. Since it is a lowtier tank, alot of players will have access to it, especially inexperienced players. Thus they drag the average xp down.

But since so many sealclubbers probably play it, they get great results, thus making it harder to ace. 

In oractice that means, 95% of players don't get above 650 xp, but the percentiles between 95-99 get between 650 and 954.

Edit: Right numbers "
639, Something something sealclubbers 
640," I always use Ballograaf mechanical pencils, it's a dream to write with.

The reason I don't use pens is because the lack of friction makes my handwriting faster, but more sloppy, thus harder to read and therefore I make less errors.

Whenever I make a small typographical mistake I can also erase and rewrite it, rather than writing harder over, or just rewritinh everything again, wasting space. They're also cheaper in the long run. "
641, Baserat p ditt anvndarnamn tror jag du ljuger. 
642, After actually reading I realised it's not a palindrome at any definition. Let's just call it an anagram xD 
643, I think you're allowed to rearrange spacing 
644, Palindromes at their finest 
645, Svar: Nej! 
646," Jag har fru, men inga barn "
647," Kv13  T-43  T-44  T-54  T62a
This was one of the most enjoyable grinds that I've done. And I pretty much never fired gold. The awesome mobility and gun handling never let me down (let alone russian bias).

Sure enough I can't get the obj 430, but I thought I'd go down the lightline anyway. (This was before the lightank update) "
648," I mean, my last few days of WoT, I got the T62a. And driving that tanks feels like ghostrider "
649, That is a result pretty much anyone would be happy with 
650," Reminds me of this time when I was trying the new Swedish tanks, the low tier ones. I was on Mittengaagd, and for whatever reasons he tracked me before going down, as in several shots. 

Eventually he got bored and stopped so we both drived down, but he, going real fast drove into me, causing damage, thus turning blue and getting banned. "
651," I found what was holding me back in my first games was knowledge. I had no knowledge of maps or tanks. 

The easiest way to solve this is just by playing the game and gathering experience. 

You might want to try watching youtubevideos. I find such as Jingles, Qb:s usersubmitted videos efucative and they usually feature several gamemechanics that are useful to know.

As people here have pointed parts of the community can be pretty toxic, so learn to ignore them. But still, don't be afraid to ask for help.

Last words of advice: Stay away from XVM. XVM and WN8 has never brought me anything good. You will see ""statistically good"" players and bad ones do extremely stupid stuff. The RNG gives worse players a chance to beat the statpadders and sealclubbers.

Lemme tell you something. Just play the game because it's fun. If it isn't fun, don't play it. I have a friend who cares about his stats. He is the one most likely to spam gold, check up a players stats afterwards and rage. And he hates the game the most and rages every game.

(Tbf he rages at every game, even in coop-minecraft) "
652, Well you clearly don't need any of them except one xD 
653, r/theydidthemaths ;) 
654," Well, the Ghandi one is an old meme which stems from an old civ-game where Ghandi:s peacefulnes caused a bug where he was the most aggresive one of all.

On a scale 1-10 I think he was a solid 10. Higher levels of aggresivness means they are more likely to nuke you. Civs never went that high pretty much, except Ghandi "
655," I like to think of World of Tanks as chess. All tanks are like the pieces, they move differently and have different weaknesses and strengths.

When you play, make sure to read the minimap and pay in unison with ypur team in a way that benefits the team and not your stats (i.e. WN8). "
656," Yeah. It's a bit situational, but those kinda tanks like being hull down behind a ridge or something, so with a little bit of rng and positioning, once every second/third shot you will hit under ideal circumstances. "
657," Maus got an armour AND hp buff. Type 4 and type 5 heavy both got derpguns, the latter does 1400 dmg with prem HE.

Arty is more accurate and annoying than ever with their stun, BUT they no lpnger have AP/HEAT rounds and will almost never one-shot you

This update also brought multiuse consumables that will be consumed by the end of the battle. Oh, medkits removes stun.

LT:s had a major update and their mm are the same as all other tanks and therefor alot of them have been tweaked.

MM is now in three forced formats with tiering. You will either have 3/5/7 ; 5/10 or pure tiered battle. (Hightier/Midtier/lowtier)

Quite some amount of tanks got tweaked. Too many OP tier 8 premiumtanks have been released. E25 was again.

Swedish tanks have been released. Heavy tanks have ridiculous frontal turret armour, but turret side can be overmatched. The heavies also have autoloader similar to the french heavies.

The swedish td:s (IKEA tables) have paper armour and rely on heavy sloping to survive. They have good camo and high speed, 50 forward and 45 backwards.

The IKEA tables use siege mode to tilt the whole tank to be sloped over a ridge to expose minimal of the tank. The gun itself is special. It gets about 300-310 base pen with APCR and prem rounds is APCR with a shit ton of pen. It's accurate af and gets a ludicrous dpm.

The german techtree got a new heavytank line. The vk 45.02B  now leads to Vk. 7 (something) and to take it down, just shoot whatever that's flat.

New tier 8-9 tanks, Vk100.01P and Muschen have been added and they lead to the Maus. These are very similar to Maus itself, but with cupolas.

Edit: WG had a fuckup and lost 3 community contributors, Jingles PointyhairedJedi and SirFoch. And pissed off the others ontop of that. (It was about youtube, copyrightstrikes and censorships) "
658," Not that often considering it's excellent gun-handling.

My first reaction was that it's gunhandling was comparable with that of tier 9-10 vehicles. Just let the circle shrink before you poke and you will be hitting whatever you want "
659," Yeah. Against a knowledgable player in the right tank, few of the american turrets are always good. 

What I mean is high calibers pen them all the time (IS-7) by overmatching the turret top, which you therefor have to hude with gun dep.

But it's seldom I see people utilising this "
660," Frra sommaren skrev dem bara ""xxxxxx"" "
661," Kommunen skickade i slutet av Mars ut brev till dem ungdomar i kommunen som skt sommarjobb, och detta med Postnord. Frn kommunhuset till mitt hus r det cirka 2km.

April r ver och jag utgr ifrn att jag inte blev erbjuden ngonting, men NEJ! 2:a Maj dimper ett brev ned i brevldan. Frn kommunen till mig, leverantr: Postnord... "
662," People say that the T-54 has shite pen. Maybe it does. But I'd like to cliam that it's peb is very workable as it gets tremendous gunhandling.

It's super accurate even on the move, and combine that with it's decent mobility, and you can comfortably outflank your enemy and put ahots into their weakspots. "
663," Actually the cinemas in Sweden offer 3d-glasses, which are built so they could either be worn by normal people, or they could be clipped ontop you're regular glasses "
664," People have already solved it mathematically, but I'm just curious if there is someone who wants to resolve the problem, and taking in other factors, such as baby-booms in November (or 9 months after valentines day hint hint).

Some cultures also have bias towards certain birthdayes, such as early in the year etc "
665, Have you build the prefollowing buildings? 
666," But with the new matchmaking you won't constantly be shat on by tier 10 tanks. If you're alone you will benefit the most from the new mm.

If you're in a platoon, well you're in a platoon, good for you.

Yes, Amx 30 is a sniper, but an aggressive one. I found that it's speed, hp/t, gun flexibility and viewrange allow you to find nice spots where you can outflank the enemy and spot and support your team "
667," Once you get away from the stockparts and get a crew which doesn't suck (which you probably will have, because amx 30 is the first medium tank in the tree), the amx 30 is pretty fun to play "
668," Never look at someone's statistics and don't even let XVM come near your harddrive.

As some people here said, someones super unicum stats says nothing about them until you see them play. They may just have sealclubbed at lowertiers and is then camping to max damage without being of use to the team.

Assume, that if you're not contributing to the team right from the start, that they'll collapse. I always make sure that I am in some way always helping my team win.

IF you get enraged anyway, DON'T chat with someone or rage somewhere, you will only fuel it. Try to stop the madness, otherwise you will make mistakes and do stupid things, die and get more mad.

I have a friend who more often than not gets real mad and starts spamming gold and curses at his opponents. And because he spams gold he thinks he's invincible and die because he lost his situational awareness and calm, logical thinking. "
669," That's the point. The keyword are ""HEAT can be"". More often than not, you will at least make up for all the tracks and space absorptionswith the extra pen "
670," You can still get a two-tier battle, i.e. 10 t7s and five T8s per team. But yeah I see your point. Tbf I feel tanks with preferential has alway been like that (At least for the two with pref. I have; the IS-6 and E25) "
671," I don't know how much of the camping experience you're going after, but something you MUST consider is fire. Some parts of Sweden are extremely dry right now (and will continue to be), as such I adivce being extremely cautious woth fire, and check with your region if there is a ban on fires.

We just recently had a forestfire "
672, Aaah. Thanks (y) 
673, Source: [r/Showerthoughts](https://www.reddit.com/r/Showerthoughts/comments/6ei2wq/if_bees_earned_minimum_wage_a_jar_of_honey_would/?st=J3E5DEXF sh=4f653c97) 
674," I have a friend, his old expired Norton attempted to remove his other free antivirus program (which he has had for years) "
675," He did answer the question. You can't just accelerate matter to the speed of light. It would requiring breaking the laws of physics.

(Fair enough he threw in fancy words, but still) "
676," The IS-7 was my first tier ten, and the entire line is great, (except maybe for the kv-1s).

I have a friend who grinded the Leopard 1 and he loved every single significant tank on the line (except for the tier 7)

I'm currently grinding the brittish meds, and I've only gotten to the Centurion I, but I've played the AX plenty ol test servers and enjoyed it all

Soviet meds line is a bit trocky, but I always ended up doing good and got exceptional personal results "
677, My favourite score 
