,post
0, ooh always wanted to take part in one of these. have to wait a few hours though 
1," hi, seconding the other person. I use social media for all 4 (regarding the last question) "
2," ""the truth about birds"" so dramatic hahaha "
3, tell us about some good songs here. I'm looking for more new music. 
4," I'll start: it's been pretty slow, I've hung out with my dog and I'll be doing chores later. I'm practising guitar too, my grade 6 exam is in 25 days. wish me luck! I'm hoping for a Distinction, but it's not looking so hot rn. "
5, hope everyone's having a good day. how's yours going so far? 
6, reverse image search confuses me 
7, 4chan stuf 
8, hi could I get the link too? 
9, that's one good father son relationship 
10, more context? then we could give our opinions more informatively 
11, happy cake day 
12, can you mark this as completed? makes it easier for users looking through the sub for challenges 
13, would be nice if you have the estimated time for the survey in the text. I always like being able to gauge how long it'll take me before clicking on it 
14, why is email mandatory? 
15," could you add something like ""option 1/2/3""? I was waiting for it to load for a bit, before realising that it was meant to be blank. might confuse a few people "
16, will you be able to post the results? 
17, no permission. can you reply with link so I can remember to take it when you've granted permission? :) thanks 
18," I wouldn't be too offended by anyone calling me these things (whether the slur was applicable or not), but I wouldn't say that they all should be freely used. I don't mind the n word in joking contexts at all, but when used seriously as a race-based insult it's **extremely** offensive imo. needs more detail, or a short explanation on what ""offensive"" means. "
19," I think you worded it in the best way possible. Reddit definitely doesn't seem to fall into the same category because you can use it ""intellectually"" (?) unlike the others. 

but I feel like Reddit still has a place in making people feel insecure like other social media, but it's just more subtle and avoidable. I'm not sure if it's worth changing the survey, depends on what kind of results you're looking for. I thought it could be applicable feedback, maybe for another project or when analysing the results. "
20," depends on the flavour of the specific cake I guess, pumpkin spice would be Thanksgiving. for the shape though, weird that it wouldn't be year-round "
21," I think you would get more responses if you made a survey where the question described how one part of the Filipino healthcare system worked, and there would be a section to give our thoughts. I don't know anything about the Filipino healthcare system as an ASEAN resident, so I don't think Westerners will know much either. "
22, is there a mailing list or something to find out when this app/product is released? I'd be interested 
23," hi, we need permission to access the survey (don't want to request it and put in my email) "
24, was the choice of social media deliberate? I don't use anything regularly besides WhatsApp and Reddit so I put 0 for everything. however that doesn't feel *fully* accurate since it makes me seem like I don't use social media. just something to consider I guess 
25," done! I liked the way you did the survey, it felt really fun to take "
26, damn. might give it a watch then 
27, nice! how was the movie? 
28, googles 
29, link doesn't work 
30," Thank you for participating! People like you make the world a better place :)

bless you "
31," sorry I can't help bc I live in Asia: my definition of cheap is CHEAP and I don't really understand US pricing. but, I just want to tell you those crochet creatures are adorable! "
32," there are multiple kinds of berries, i think you need to be more specific "
33, strawberry 
34, looks like we need permission to take the survey 
35, the basketball diaries 
36, BUY MY NUDES 
37, this bload up 
38, kdkdkd 
39, zero lol 
40," was the neutrogena lotion for the body or face? yeah, I might buy a big tub of decent drugstore moisturiser for my neck "
41, [removed] 
42," oh really?? I thought it was a high school skating team, something like Free! well then I'd better get started watching it then haha "
43," oooh thanks so much for all the links! I'm okay with dubcon/problematic fics if they're written well and it's not just violence for the sake of violence. flawed characters always have a certain charm, so I think I might enjoy the last one the most "
44," 1 upvote now, what would that mean "
45," can I wash my neck and chest with normal bar soap, and mosturise with cheap drugstore lotion? using my mosturiser and other products from my forehead to my nipples (as is recommended) seems I would go through stuff *quick*.

(no neck or chest acne, just a few bumps on my upper back) "
46, I'll check it out! thank you 
47," I've been meaning to watch YOI, but teenager love stories always make me feel a little odd. maybe I'll jump into the fanfiction side instead "
48," any specific ones to recommend, or authors? "
49," nope, I'm good with anything! "
50," okay but the ramen in the bottom right is amazing. you should fish it out and give it a try, it combines cheese and spiciness and perfection in just the right way for 3 bucks "
51, pewdiepie time 
52," same here, I remember there being three different incorrect spellings of ""disappointed"" in three separate chapters. really took me out of the mood, especially when editing a chapter shouldn't take more than 10 mins. I want to volunteer myself for it! "
53, I do it too 
54, same 
55, not if you wake up in the middle of a sleep cycle. then you just wake up groggy and worse than before. 
56, wtf is the original 
57, I'll check it out! 
58," I'll check it out, thanks "
59, hope this is a thing 
60," here are two fics that I love that have the trope, I'm looking for more. they're both Inception because I love Arthur x Eames dynamics. I would prefer if the fic was set in adulthood, teenage fics don't sit right with me.

[A Fake Handshake Don't Make No Man](https://archiveofourown.org/works/481393) by recrudescence

[Unkissed](https://archiveofourown.org/works/450454) by toomuchplor

also you should read these fics if you haven't yet! they're so great  "
61," avid ao3 reader for the last 3 years, have never thought about making an account. I probably should to show my appreciation for authors more, but I've never wanted to do more than leave a like (which I regularly do). if a fic is good, I save it to my iPads safari reading list and treat that as my bookmarks. "
62,  
63, [removed] 
64, MADE IN BRITAIN 
65," ""Hope you're doing well!"" is a bit more chill than ""I hope you are doing well!"" as an example, because it sounds like something a person would actually say in conversation to a good friend. I don't communicate much with email, so it's hard to give any more concrete translations. 

perhaps you can save those ""open sounding"" emails and reread them when having trouble crafting an email. try to ""absorb"" the feel and the looseness that those open emails contain. that's what I did with other people's essays when I was having trouble finding my ""writing voice"", and it helped. "
66," I see, things make a lot more sense now. thanks for the detailed explanation! "
67," well, you're not wrong for saying it because it's just instinctual politeness, and you're trying to soften the blow. it can also come off as sarcastic, yes. its also a way to acknowledge that you were listening to the other person, by first replying ""I'm sorry, but..."" to them, and then presenting your point.



any other alternatives are going to have the same vibe of ""I don't agree with your point, here's my point"". it would be weird to start taking about your points straight away without acknowledging the other person's points as valid or invalid.



however, if you do want those alternatives, here are my ideas:
thats a fair point but...
I agree with you but...
I respectfully disagree because.../I disagree because...
you make a valid point/statement but...
I don't think that point is relevant because...
while I agree/disagree, I think/believe that...



it's all kind of the same idea though. it's all just verbal filler, to make a conversation sound like a conversation, instead of two robots mechanically arguing. "
68, [removed] 
69," maybe you shouldn't carry it around so often it's just *too* easy to use. if buying sth is as easy as swiping and you can't physically see yourself ""losing money"" you're going to be impulsive "
70, doesn't bother me 
71," not a fetish, but killers in TV shows that kill bad guys are a big thumbs up (provided they already have a pretty face) "
72," yes. I prefer ""ah."" sounds less gormless "
73," I need something to fill the Matt Alexander hole in my heart. (in the ""two dudes talking"" genre, I already listen to Hello Internet, The Complete Guide to Everything and Dear Hank and John) "
74," I was listening to the Hello internet podcast when they said ""Squarespace's RSS feed only allows up to 100 items"" (regarding only their latest 100 podcasts being displayed in most apps).

I thought that an RSS feed was like a huge multi-website timeline where you got every single article from every website you subscribed to? why does Squarespace have an RSS feed, why's it being used for podcasts, I'm entirely confused. I think my earlier idea of an RSS feed is also incorrect. "
75," if anyone has any reasons for which word they use, share it here! I'm really curious. I call it autumn because it's a fun word to pronounce, autumnal is a great word over ""fall-y"" and it's clear that you mean the leaves season, not falling down. "
76," 
nice. looking forward to the results "
77, meirl maybe? not too well versed on the meme subs 
78, link broken 
79, make another survey seeing whether fall or autumn is the more popular word? 
80," I don't think this is an antimeme, but it's great "
81," not helpful, but same "
82, nope 
83, you can use a classical guitar to do acoustic stuff first (to practice). the strings are nylon and softer and it's quieter 
84," you could hold them or ask if they want you to leave (other than the typical comforting phrases, I'm not good at those) "
85, I believe that they were firing tons and tons of arrows and one just happened to strike there. the rest just bounced off 
86," I can't say whether you like women or not, but not liking looking at dicks doesn't mean that you don't like men. "
87," technically no, but fuck u a legend "
88," I hug a pillow, smaller and softer than my head pillow "
89," just hover over it, or hold it in "
90," hm, honestly yeah 5'2 is a little short for me. I like someone, man or woman, to be at least my height (5'4) or taller. it's shallow of me, but my honest answer is that he'd have to be quite the catch.

it wouldn't be a flat out no ofc, but I don't think I can be attracted someone physically ""smaller"" than me since I'm already kinda small. sorry for the downer answer "
91, ignore it 
92, hyperhidrosis perhaps? or finding a good antiperspirant? 
93, yeah 
94, oh shit I didn't realise other people could smell me. no wonder there are green tea scented pads. I thought that was just my paranoia being paranoia 
95," yes. for me, height is just a bonus if the guy is already hot. height itself will not play any part in attraction if he isn't hot in other ways (face, other features) already "
96, in my country schools start at 7:30am-8 usually. starting later is pretty strange. I think America is just being weird here 
97," attraction to danger and an attraction to guys who literally ""do whatever they want"". on the sweeter side, it's nice to believe that you might be the person special enough to change this bad guy into a good guy. or you might want him to stay ""bad"" but treat you like a princess, which makes you feel extra special. "
98," lately all the movies I've seen have been closer to 2 hours than 1.5 hours actually. but for your question, considering our decreasing attention spans shorter movies are better for good ratings. additionally between a ""tighter"" movie where every plot element matters, and a longer and ramblier movie, the tighter one is preferable. "
99," yeah I do it too, wouldn't want to explicitly say anything to 99% of my friends. but having them suspect it is always fun "
100," serious answer, I would tell you to write more like how you talk. but do you also talk very formally? if you could give some examples of what you would say in the post, we could try to ""correct"" them for you so you can get the idea better. hard to really give advice when we don't know what exactly you mean. "
101," let's say you're writing about a fire, something like *Dear Sir/Madam, I am writing to inform you of a fire that has broken out on the premises of 123 Cavendon Road.* is too formal.

*Fire! Fire! Help me! 123 Cavendon Road. Looking forward to hearing from you. Yours truly, SweetSweetEscapism.* is just perfect. "
102," I'm not american, but Easter is mostly celebrated by Christians and little kids (with Easter eggs). Christmas is like the ""default"" year end holiday/celebration. Christmas is more cultural than religious at this point, what with Santa Claus, Christmas music, trees, gift giving, none of which is really tied to Christianity much. I don't really think the question is a valid one, but if we accept the premise, Christmas fits far better than Easter. "
103, [original](http://imgur.com/gallery/35u1vDa) one with the [frame blank](http://imgur.com/gallery/comoHUv) 
104, [here](http://imgur.com/gallery/YOj242u) 
105, lmao @ the blurred over words from the original post. [here](https://imgur.com/gallery/KvU8HjC) 
106," not lost, the idea with ""spread it around"" memes is to post to all subs to spread it. although I can't say i'd be pleased to put my dick in xi jinping "
107, Scholastic classics 
108, oh god why 
109," and all the citizens have to watch, with the state mandated TVs in every room "
110, one of the best manga I've ever read. honestly life changing 
111, held hands 
112," his mother-in-law sees him, and her eyes widen. "
113, someone please stop him. 
114, thanks for the blessing! /s 
115, I really like this one lol 
116, I like your font. fancy 
117, honestly tho 
118," I don't think effort necessarily means something is cool, or interesting to watch. for me, neither video sounds interesting. but others and I would probably lean towards the aeroplane (something everyone is familiar with) vs super mario pancakes (something more niche). often the lack of popularity is because something is niche, not necessarily because people are thinking ""hitting the woah is cool, look at that nerd wasting their time shaping compenents"". 

I respect the artist showing off their talents, but frankly a dance is easier to understand  you don't need any context like knowing Super Mario. so that's probably why dances are more popular. "
119," isn't ""cool"" a subjective term, what's to say that a new dance isn't cool? it seems pretty simplistic to say that everything popular is stupid ""no matter what"". what makes the pancake mario guy cooler than the airplane guy exactly? "
120, [oh god oh fuck](https://garfield.com/comic/1982/04/12) 
121,  
122," I don't play soccer much, but the culture has always intrigued me. I want to understand where the fans are coming from, though I doubt I'll ever become a wild fanatic. I think anything that can make ""normal"" people so passionate is worth exploring a little. "
123," guess I'm throw myself in the deep end headfirst, no faffing around with rulebooks lol. thanks for the advice! "
124," should I start with iconic/game changing matches, or just see whatevers been posted lately on YouTube? "
125," I know next to nothing about football (soccer) of any kind, national or international. I have a friend that can explain terms to me, but he told me to do my own reading and just ask him when something comes up. Problem is, we both have no idea where I should start. "
126,  
127,"  I just had secondhand ick reading that lol. I took self defense classes with my younger brother for a while and hated that, even though he was in a different group and we couldn't even see each other during it. practising the steps with him at home was not any fun.

maybe it's a kind of cringe because we feel like it's ""too intimate to be allowed in this world"" or something like that? i got into my first relationship a few months ago and sometimes both our eager sincerity make me want to curl up and die. (even though I really like the guy and he makes me feel so warm inside with _feelings_)

it's just so painfully cheesy sometimes, even though I like romance and cheese. maybe an issue of self awareness?? idk man but I'm glad I'm not the only one feeling confused "
128, 6 
129," not in Asian countries, no one would let you waste food like that "
130, are you getting tired of the same songs and repetitive themes? try branching out? I like rock and recently I've been getting into rock sounding K-pop for something new 
131, rip attention spans 
132," oh my god ive been trying to put this into words but its been afflicting me for so long and i feel so bad about it. I get this way if family gatherings are going well, like i'm happy at first because I'd rather be having fun than being bored, then suddenly BAM that weird disgusted, run-away-now kinda feeling. i suddenly have the strong urge to move to the czech republic where I know nobody and start afresh.

I got it again recently when I was hanging out with my friend, his mum and his brother. they're a super tight knit family and the way they all warmly accepted me made me feel nice, then suddenly icky all over. it left after a few minutes, but not before I was considering bolting over a dumb excuse just to get out.

I'm introverted but pretty social outside of my recharging periods. I like intimacy, who wouldn't want to be close to their family, friends and partner? but sometimes that feeling makes me really want to move and leave everything I know behind.


 it's a weirdly powerful emotion, considering it comes out of almost nowhere? anyway hope you relate because I feel shitty for feeling this way and I'm hoping its a normal thing "
133," that stupid *""I wonder what people think of me"" ""they don't think of you""* is both discomforting and a lie. people do think of you and often about your negative qualities. and even if they didn't think of me at all, how's that any better? it's all just ridiculous "
134, yes. 
135," I see, good to know. don't think I'll be able to change them for a couple of months though. were you using butterfly clips before? "
136, thanks! 
137, thank you! 
138, how did the hoops help? 
139, [welcome to Jon's love shack](https://garfield.com/comic/2011/03/31) 
140,  
141, original? 
142, yes. 
143,  
144, HEYOOO! 
145,  
146, [it wasn't that good the first time round either](https://garfield.com/comic/2015/06/26) 
147,  
148, because nervous gas  
149," apologies on behalf of the lgbt community. we've been burned so many times by some cishet white guys that we treat all of them like shit sometimes and that's not how it should be. it's not everyone, but it's a loud minority.

it's generally seen as harmless because you guys have ""had your time"", but it's also unfair and super disrespectful at times. "
150,  
151, LMAO THIS PIC OF LIAM 
152, if anyone likes otome games Liar is really good! it's one of the few mystery games that actually needs you to really think 
153,  
154,  
155," if the question isn't too serious or it's been answered enough already, I think a light-hearted joke is okay if it's funnier than it is annoying. goes on a case by case basis though "
156, design porn? 
157," I got a double helix about a month ago. how long did it take you guys to heal yours enough to change it out comfortably? and any tips on speeding up the process?

my second lobes took about three weeks to look + feel the same as the lobes I've had since I was 7. I think that's faster than normal, might my helix take a shorter time than the average? (a year-ish from what I've seen) "
158," as background noise for maths subjects, yes. doesn't work for subjects focused on writing "
159, yeah why not 
160, I'm imagining walking by a Starbucks and seeing through the window some guy watching porn on his phone and just nodding along while sipping his latte 
161," I see people taking the piss out of perfectly respectful questions. sure they may not be intelligent, but they were asked politely and ona sub called No Stupid Questions. if you don't have anything to contribute go away. (jokes are allowed in some circumstances though imo) "
162," seconding this guy, but the sleep cycle tends to vary a lot person to person. if you wake up at the end of 2 sleep cycles, you'll be more refreshed than waking up in the middle of your 4th cycle. that's the general idea, but you have to personalise it for yourself. "
163, why are you watching porn in public? 
164," it's more about the sublimnal ways it gets into your head and the general capitalism maximalist societies we live in

I didn't have any problems with ads until I started having spending money, now I understand why everyone hates then more. they really do get into your head and you'll be craving a burger at 3am even though you don't even like mcd burgers. you just liked the glossy juicy ad they had on that billboard yknow "
165, I look the same a year ago and I'm still waiting on that glo up 
166," this is why I always check price first, then consider if I want it "
167, my friends have had some great moments that I think deserve an Oscar 
168," bro same, I look at my problems rn with the lens of ""you'll probably have cancer, heartbreak and crippling debt in the future so this seems kinda trivial"" "
169," that's why we have the squares, for little syrup pockets. otherwise I would eat pancakes "
170," because it's super personal and it's like offering a part of your soul to someone else. if they don't like the music, it feels like they're attacking you directly. "
171," I figured that people would still find their ways around it, and since I don't live in the US or European I wasn't too invested even at the beginning. then the hyped died down and I forgot it even existed until I look at old Reddit threads "
172, r/HelpMeFind 
173,  
174,  
175," I would've liked it if garfield stood up and asked Jon to ""prove it"" before pressing their lips together passionately "
176," I don't be on Snapchat but I'll check it out, thanks "
177, rocco was the best out of the original boyos 
178," do you want advice on how to stop, see whether others do it too, or both? "
179, [...ok](https://garfield.com/comic/2011/02/15) 
180,  
181,  
182, I have like -2 editing skills but I want to figure out how to make a cool profile pic huhu 
183,  
184, found my fursona 
185, this was from r/onejob and the guy posting it botched up his job by not cropping it 
186,  
187, i read this as 'the texture of the *lingerie* is off' and I was wondering when I gave her a lap dance?? 
188," 1) bobby, can't deal with Gary's Sharpie brows

2) Priya, gorgeous and all around lovely specimen

3) Blake, she was hot while Jo was a hot mess

4) Returning Hannah, slender redheads are so my type

5) Lucas

6) Noah, he's kinda hot but that ""intense gaze"" looks murderous

7) rocco, at least he had good hair

8) marisol

9) elisa  between the devil and the deep blue sea

10) CARL my favourite nerd and such a hottie

11) kassam, he's so beautiful and really sweet if you go after him

12) Jakub only because of his prom outfit

13) favourite girl, priya. she's just eye candy, had great outfits and was a great friend.

14) Carl  Talia just because we got better sex scenes and I've been feeling really straight lately hahaha. + looking back at S1, the character designs were so wonky that S2 wins out.

15) the narrator, probably because of Cody and Noel. WELCUM BAC TO LUV ILAN "
189, I was so sad when it turned out to be a massage. I was like damn Carl dominating me and ordering me around? yes please 
190, the only acceptable emoji is it seems 
191, I'm very impressed they only got one letter wrong. I speak English and I didn't realise what was wrong for a few seconds. not really engrish 
192," I doubt it, safe sex isn't a turn off. being unnecessarily lectured about it is, but stress free sex? nah "
193," no problem, I like the occasional emoji too and I have paid for it lmao "
194, check your bloody notifications 
195," passive aggressive stuff right? when people said insults I was imagining""you ugly whore"" or something like that lol "
196," what do they say? I wear the same 15 gem outfits daily, I get ""you wear that so often, you gotta post it online!"" and ""that look never gets old""

once I wore default I didn't really get insulted, it was like ""I like a girl who dresses casual"". what kind of insults do y'all get? "
197, should have stopped writing it halfw 
198, [Elizabeth Taylor](https://en.m.wikipedia.org/wiki/Elizabeth_Taylor) 
199," the waiter's suggesting that if the tip is large enough, he and jon can get it on "
200,  
201, what's the difference between linking and hashtagging a sub? 
202," not really, usually they're pretty helpful and lead me to a new sub "
203, Colorado definitely 
204, I had one working at a bookstore near me. closed down a while ago though 
205," the people that came to Reddit from Instagram meme pages tended to use emojis a lot. emojis became associated with annoying tryhard normies, and everyone that used them was heavily downvoted and attacked. use r/emojipolice as a reference. people are harsh about this sort of thing.

some chill obscure subs will let you use them, but any big subs or meme subs wont be as forgiving "
206, yes 
207," hey, don't talk to me before I've had my coffee "
