,post
398," First of all, an easy trick to make all your photos look better; be confident and dont be so nitpicky about how you look.

A genuine smile goes a long way (try thinking of a funny joke/memory and pop a small semi laugh just before to get into the smile). "
399, It happened my laptopt too. It kept going for 20 minutes on 0% 
400, Ours probably didnt carry any. 
401, Running in the 90s - Max Covery 
402, Running in the 90s - Max Coveri 
403, The great nordic memewar between r/sweden and r/denmark. 
404," Once, a moose was hit by a car close by. As a licensed local hunter, my father was called in by the police to end its misery.

Now we stood there by the road with a dead moose. So we butchered it and ate roadkill. "
405," The world is the problem, the atomic bomb is the answer - Mahatma Gandhi "
406, [removed] 
407," Ah. You see. Them doctors use their own unit system. Instead of referring to distances in metres, they would use legs.

In the same way they have another unit for temperature, Gastrichs. When they say 3rd degree, they mean 3 degrees Gastrich, (which is about 319 bne) they actually mean around the 634) degree Celcius mark. "
408," The director, God made 4 seasons initially. What the  happened was that a whole imperial shit tonne of drama appeared, factions were created, split, started crusading each other.

All this drama made the director filthy rich and famous, as such he decided to just kick back and enjoy his fame.

(Actually some local regions did get some spinoffs, seasons that dont really match what we others are getting) "
409," The point with dashcams is that they always are filming, so you always have evidence for instance when stupid shit happens that your are entitled to insurance.

Or you know, getting funny clips to upload to the internetz and get som virtual score. "
410," Reminds me of Fire Emblem (e.g. Awakening), where children are copies of their mothers, but they need some fenotype from their fathers. Solution? Give em the dads haircolour. "
411, The picture itself screams r/babushkadogs 
412, The intro from Running in the 90s 
413, Minesweeper. Easily 
414, I kissed a guy once. He smelled badly of alcohol 
415," *Points at it with a stick.
-Do something! "
416,  
417," Its the same with floppy disks. Ive never even seen one, but I will always associate them with save. "
418, Thats why theyre employed right? Ugh I hate those kind of people 
419," (  
No! "
420," I use a pair of speakers which are really good with bassboost and all. One day the bass broke so I got  sad. 

Solution? I hit it just ontop the bass booster. Theyve held for another 3 years since. "
421,  
422," Whole buncha hockeyplayers, both Elitserien and NHL "
423," Qi is a brittish tv-series, and they do a section called ""general ignorance"" which are full of these. They've also done books under the same name.

For instance;
Napoleon was never short
Goldfish do not have a 3 second memory
Krakatoa lies east of Java
Marie Antoinette never said ""Let them eat cake""
Henry the VIII had 2-4 wives depending on who you       asked
Mt Everest is probably not the tallest mountain on earth, depending on you define ""tallest""

And the list goes on. "
424," I like that OP hasn't specified which political system, american, worldwide, or the myriad of european ones. And yet everyone assumes America (I would've, I'm just saying many more political systems need betterments) "
425," Painting the picture:

I was a 16 year old guy, and had spent a larger portion of my life playing games, with a few geek friends.. Then I start [college equivalent] which means I have to meet new people, and my school partly did this with a party.

Only reason I went, was because my best friend, and my crush were going. Before I had even gotten there, a drunk guy in a blue morph suit came up and kissed me. Since then, I've never even been close to club. "
426," I read Manga on an app called Mangateader (iPhone, probably on android too). It's clean, and they update quick enough. And yeah, the manga is awesome and lately it has just been jawdropping. "
427, I haven't been following WoT news at all recently. What's compensation crew? 
428, Benpress is swedish for legpress ;) 
429, Apparently I don't even know words. I probably wrote benchpress thinking benpress.  
430,  
431, r/theydidthemath 
432," Depends on what language I've been using mostly lately. I had a period when I thought alot in english, but otherwise I default to swedish, because it's the one I use the most. "
433," I had by the end of 9th grade crush on someone, without having realised it before. It was school prom and I realised that after this night I'd probably never see her again unless I did something.

So I tried telling her. Sadly the music was too loud, and it was really the last moment, as she had to leave immediatly, so she left without knowing.

That night however, I woke up having recieved a text from her asking what I tried to say. So I just said it. "
434, Socialise. You know. With people. 
435, r/BamboozledButActuallyNot 
436, I didn't even need to click the link to know what it was. 
437," I actually managed to kind of do this once in Civ V.

Me and my friend were playing with some AI:s. Because my location and military was enough to keep me safe, and from being a threat, thus I was never fighting with someone.

I managed to befriend ALL the ai, and I gt 4/6 of them to declare war on my friend (that part was just for shits and giggles). "
438, Works better in swedish with Obi Wan Knubbi 
439," I have a favourite question I got in a maths competition here in Sweden.

""A school has three classes, all containing boys and girls, and are equal in size. Total, there are twice as many girls than boys.

Class A has 18 girls, Class  B 8 boys, and the last class has more boys thans girls. How big are the classes?""

Firsy I was really confused, but eventually, it all felt so simple. "
440,  
441, Something something Hisoka... 
442, r/dadjokes 
443," That the universe has an absolute velocity cap. Speed limit. You would think, that in space there is nothing to slow you down, so you *should* be able to keep acceleraring, but no. You will NEVER reach the speed of light. "
444," Stress seldom works. Instead of freaking out and stressing over the situation, calm down, accept the current state, and calmly deduce a way to solve it.

For instance: You've missed your bus and will be late. Well there is no point stressing. Well shit you're late, but there's nothing really you can do. Wait for the next bus or whatever, but don't stress over the fact that you will be late.

There's a slight difference between being stressed, and in a hurry. I mean, you might as well *hurry* to mimize your lateness, but there is absolutely no point *stressing* and getting anxious about it. "
445, First one that actually did the math and gave an answer 
446," Trying to go indoors whilst eating an apple. Yup. I got a ""behaviour warning"" for wanting to continue eating my apple indoors. "
447, More like r/dontdeadopeninside 
448," Ah yes. It reminds me of the infamous ""swedish busstop"", or finnish depending. There's an unspoken rule that you keep AT LEAST 1 meter distance from strangers. I had once been waiting, and we spaced such, that between me and the guy furthest away, there were like 10 meters. And there were 4 of us "
449, r/maliciouscompliance 
450,  
451," ""Now you've planted your last potato""

English translations of saying, ""you're fucked""

According to one QI-guest said; ""shagging the dog"" is something canadians say. (Why won't Alan eat Stephens noodles) "
452, Maybe ;) 
453," When people say ""Aluminum"". It seriously gets on my nerves. It's spelled ""aluminium"", and pronounced such!

Edit: I can't spell "
454," But why not just use colours? That would make it both easier to read, but still get across the point. "
455," It started really good, then it was just downhill from there "
456, Sauce: https://www.reddit.com/r/trebuchetmemes/comments/74g01j/heresy_in_our_high_school_textbooks/?st=J8FF92CN sh=818937e9 
457,  
458," What's your favourite civilisation to play as, and why? "
459," I had a serious crush on someone. First we talked at all, but then it suddenly changed as we seemed to be interacting more and more.

After summer holidays, we got back to school, and it turned out that me, my crush, and my best friends from the other class, all had some classes together. She sits next to me during those classes because it's mixed and I'm the one she knows best.

My friends later pointed out that I'd been choosing to spend time with her over my close friends. Shortly after it struck me that she seldom talked about something personal, and that it felt as if I was always chasing after her to keep up. There had been times when she literally disappeared without saying anything, or waiting etc.

The final piece to the puzzle unravelled just a few days ago, when an friend of mine, (whom I haven't really been with at all recently) sat beside me, my crush, and my crush's friends. Then some time through lunch everyone left, except my friend, because she wasn't done eating. My initial reaction was: ""I can't leave my friend, she ain't done eating"". So Whilst the others (crush inclusive) left without even noticing two of us were left behind.

 "
460," I mean, the biggest difference is the mm. The T-44 was buffed with armour as far as I remember, but the t-34 should be the same. T-43 was a great fun tank with decent overall stats. I seldom fired gold, and the alpha was decent.

Both were awesome toptier bullies, and worked okay as a support in MT wolfpacks. Overall they were decent tanks I wouldn't mind playing for fun again. "
461," I've never had too much trouble with people spamming gold, obviously an e4 or jgeroo are gonna shit through it.

Whatever you do, just make sure to hide your lowerplate. Your ass has more armour than it. If you angle heavily, most tanks are going yo bounce off your superstructure.

You pretty much need the top gun though, and tha gun works wonders. I always try to get as close as possible, but not being frontline because not having a turret makes you inflexible.  "
462," I've never three marked a tank, but the first I two marked was my 13 90 (whilst it still was T8), and I was hella surprised, and proud too. "
463," The t-43 was actually very fun as I remember it. It was the same with the T-44, but that was before they changed mm "
464," Short info about me first: My hair is incredibly fluffy. Frontally, my hair has a larger width than my face.

Now to the story: I was going somewhere, usual stuff, and as usual I bike. As I pass a busstop, a random girl maybe 10-13 yrs old reaches out and just touches my hair as I wizz by maybe 5 m/s. It's not terribly fast, but it isn't that slow either.  "
465," By the beginning of summer I had two tier tens, but I had been simultaneously grinding several tanks.

Now I've bought another three, have one unlocked, and am just about to wrap up the Jagdtiger "
466," My Assassins Creed Unity freezes/crashes everytime I click ""Quit to Desktop"" "
467, I started reading this and thought that it was a REALLY weird r/showerthoughts 
468," That word sounds like someone swedish tried to make up a spanish word for ""kast granat"" (swedish for hand grenade) "
469," ""Some babies were dropped on their heads. You were clearly thrown into a wall"" "
470, *Cough Da Vinci code cough 
471, r/theydidthemath 
472," I'd rather be able to sleep whenever I want for how long I want. I can't stand being awake 23h a day. I mean, competely controlling your sleep cycle is going to refresh you enough as it is. "
473," I hadn't gotten further than IS-3/T-10 when they removed it, and luckily never got to feel it's fury "
474," CrazyRussianHacker has all the gadgets and tools for general survival.

Colinfurze has slightly bigger and more specialised equipment such as a 600cc ARMED tuk tuk, or an underground bunker.

If there would be zombies and/or other survivors to rivale, Joerg Sprave has a literal arsenal or weapons. "
475," Grille15. Basically the same as Swedish td:s, except it hits harder but not as often, however often and accurately enough "
476, More like kill the assisstant 
477," Yes. I think the super heavy dilemma stems from this. It had been consensus almost that armourbwas going obsolete, due to ""gold spam"" and weakspots, and also new players who don't know how to use it properly.

So they buffed armour on some tanks and people grew mad "
478," S1, cdc and t54mod1. Albeit I haven't played the t54mod1 after it was buffed, but otherwise it's such a boring tank "
479, Ahahaha. You beat me to it 
480," I found a place where they simply had a codelock. Except the code was written right next to it. Not obviously, but you would see it if you just walked past the door. "
481, this is why i never visit self body improvement facilities! 
482, I like the dark southern spot of southern Sweden that is Gothenburg 
483, The entire Skyrim theme in dragon tongue. 
484," All places on a tank with viewport I think. For instance cupolas tend to have viewports, thus you are only required to put your cupola over the ridge.

That is also how someone can permatrack you by shooting rear-drivewheel e.g. without you spotting back because there is cover between yout viewports and opponent.

(There are usually viewports close to the gun too, above/below gun mantlet, I think the base of the gun even counts as one.) "
485, Jag hade ett krkort fr symaskin. Tog mig evigheter att skaffa 
486, T-54 
487, I ALSO FIND IT HARD FOR MY TEXT ANALYSING CIRCUIT TO REGISTER INFORMATION DUE TO OTHER FELLOW HUMAN UNITS CONSTANTLY DISPLAYING THEIR INFORMATION IN A WAY THAT IMPLIES HIGH OUTPUT OF DECIBELS. 
488, Fox really looks different in this HD-remake 
489," I am sad to inform, but I took the bait "
490, The armour could be trolly too. People try shooting just as you pull back and hit your turret at a really steep angle. I bounced a Jageroo and Grille15 all in the same ridge pullback 
491," I would say, no mods that are useful during the battle. Maybe last known HP, but things XVM. I started enjoying WoT again when I switched off XVM and decided to never more use it. My reasoning is, if a player is good, let them show that in combat.

I know some of these are bifunctions of xvm, but mods that lock gold and free xp are useful. There's also a mod which can show you after battle where and how tanks penetrated you. "
492, I've done both 
493," The fv4202p prior to all it's buffs. I loved mainly due to my friends hating it, so I thought I'd prove them proved them wrong and after all that investment, I fell in love with it. "
494," Same happened to me on Mtn Pass. I managed to flip my 13 90 closer to the end and a Grille 15 were so nice to flip me up. I don't remember it costing use the game, so really nice of him "
495, Have you done the missions as well? 
496, I didnt actually know it was possible to marry her. r/TIL 
497,  
498, Human idiocy 
499, That map shouldn't really be t6+ 
500," Now, let's see how long you'll have to wait before people call you reroll ;) "
501," Worst case scenario he would just have to get a mapping tool, right? "
502, Now I do.. 
503, Finland: The country of the thousand lakes. Looks more like a big one now imo 
504, I feel this is a pretty r/CrappyDesign 
505, Wish I'd seen this before buying my 30b 
506, I had a similar situation when I bought the 30b last week. I haven't been bothered grinding creds so I'm still running 11k creds 
507," IS-3, Strv m42-57 and amx 13 90 are the ones That I find myself carrying in.

IS-6 too, but that was some years ago. "
508," Manufacturies are more worth it earlier on, I think they offer more production yield than a mine "
509," I think thwre was a rumour going around that WG aren't too sure how treat the Grille 15, that they were considering some major remake, albeit it's recent nerfs. "
510, Very cool video indeed 
511, So you're telling me that that psycho ISN'T photoshopped? 
512," Reminds me of a story where a friend of mine where transporting garbage in a tv-carton, which they had secured on top their car. Then they went to an electronics store to pick up idk batteries or something.

When they return to their car they found out someone had stolen their box, filled with garbage, thinking they'd stolen a tv. "
513," The biggest supporting difference is that TD:s generally have larger guns, and thus more stopping power. You may have encountered some russian td:s su-85, su-100, su-152. These tanks can be equiped with rather large guns, or just rapid firing or high penetration. The 152 mm of the su-152 is enough to oneshot some tanks, so of course they're gonna be careful. "
514," What confused me the most in the beginning was the whole garage. There was really little about how crews worked. What the percentage mean, how they are transferable but with some loss. Skills/perks etc.

I also did!'t by my first piece of equipment until like tier VI because I had no idea which ones were good / worth the credits "
515, I really hope they recorded for swedish too! That would be epic 
516," ""What should I do about it  //  Why should I know? Solve the problem""

-An old scoutleader I had whener He was asked a stupid question or was complained to. "
517," I usually wait for some small/mid sized pacakge, like 1-2.5k gold to be discounted.

The I usually spend it on premium for a weekend when I feel like playing a lot. 

I seldom pay for camo, but sometimes I will on a tank I like.

Otherwise gold is primarily for demounting equipment, because the credits you lose otherwise add up quickly.

If I'm in a really bad mood, I might free experience to make stock grinds less painful. "
518," IMO:

My favourites are Malinovka, Redshire, Fiery Salient/ Prokhorvka, and lakeville.

Swamps, Westfield and Karelia are be fun too.

Kharkov, Fjords, Overlord and Westfield aren't too bad either. "
519, Maybe some of the mods have become outdated? 
520, Huh. The more you know 
521," My computer managed to work for 20 minutes once on 0%, and it was not idle either, I managed to get some work done. "
522," There are no proper differences. The only concrete fact is that EU 1 is almost always more populated, and this slightly faster mm, especially as people have pointed out, when there are few online.

One thing I've noticed, although it was months ago, is that there is a unwritten rule, that clan wars and team battles usually happens in EU-1, so the mm there will be way better.

Now I haven't done any of those properly at least since 2016, so I'm not 100% sure.

Edit: Auto usually puts me in EU-2, and I never notice any difference "
523," It's just a tank which oretty much 100% fits my playstyle. My friend has tried goldspamming in it, and yet he never got above 1st class, and he's a good player too.

I just feel bad for him that he can't enjoy the tank as much as I do "
524, I do it like once a year. I always forget why my harddrive is so cluttered xd 
525," The strv s1. I just hate playing it. It does not fit my playstyle at all and I can't even get good results in it even if I wanted.

The strv m42/57 on the other hand is an amazing machine. I ace it like every 4-8 battles and completely wreck the competition. It's also one of few tanks which I've gotten my second mark on too. (That's good for being me) "
526," I remember a time when IS-6 was still considered good, and they haven't even nerfed it since. "
527," They also use large(er) autoloaders too, so that will be acquired experience "
528," I mean they're better now, by a lot. I don't know how good you are, but I think it's educational to try every type of tank, to learn it's playstyle, strengths and weaknesses.

It might be hard not having any armour or hp, but it will be educational if you have patience, and an open mind, willing to learn and accept that you're not perfoming as good as you could.

What requires most patience (or money), is getting a good crew going, especially sixth sense, and some camo and viewrange.

You should definitely try light tanks some time though.

Edit: By the way, the elc was way better, and way more fun before 9.18 or 9.17. It was faster, and the gun was better. I did my first set of 15 LT missions in that one. "
529, But far more superior 
530," The greatest medieval siege weapon of all, which can launch 90kg projectiles over 300 meters. "
531," There is a term in swedish. Sambo, or samboende. You're essentially living together as a couple, maybe even having a family, but you haven't gone all the way to commit yourself to marriage. "
532, My use of alt tabbing went down with 95% 
533," I interpreted it as he meant that they need to be trained for the tank, for the perks to work "
534, Remove idiocy. Seriously. I hate stupidity. No more antivaxxing. No more stubborness. Nor more stupid accidents claiming lives because someone thought it'd be fun driving through a construction site. Etc. 
535, Strv 81 right? 
536, First I cried. The I went into denial. Then I cried some more. This lasted about half a year maybe \_()_/ 
537, Not a hard feat 
538," Are you a cigarette? Cus damn you got a hot butt!

Are you milk? Cos I'm lactose intolerant and you make my stomach funny. "
539," ""Look at me, I'm in a stable! Moo I'm a horse!"" "
540," Perks too. If they're 100%, they will apply. "
541," I'd say got average after 4k games maybe,. I really can't remember. But I do remember the time when I got the IS-3. Finally I was facing tanks of all tiers. Thus I was getting to know the last tanks, and took part of the high tier meta. 

Then I went against all my more experienced friends recommendations and grinded the french light tanks. After many painful games in the 13 90 I learned how to play in the flow of the battle.

Point I want to make, is that I learned a little for every new tank/playstyle I tried. I start bad, but grow more accostumed and never solely place the blame on my team. "
542," Sixth sense needs to be trained to 100% on your commander for it to work. If it's 99%, it won't work.

If you do convert your experience to crew experience after every battle (the tick box above your crew in elited tanks), the least trained will recieve an xp bonus.

That said, everyone get's xp, but the least trained gets a bonus, but at the cost of convertible xp.

For every percentile progress you get on a skill, the more xp is required. You can go from 0-30% in one battle, but 98-100 may take over ten battles.

Your crew must also have 100% efficiency in your tank in order to keep training your skills. (This is counted without bonuses you get from Vents, BiA, Your commander or premium consumable) "
543, No. Skills apply no matter the profficiency. 
544," A ricochet can still penetrate a tank if you're lucky, a bounce cannot then? "
545," This is only common knowledge to SOME, but some people genuinely believe that Vaccine is redundant, a hoax created by the state/medicinal industry and that it causes autism.

(I'm leaving flatearthers for another day, they are at least not putting people in harms way) "
546," There's a show/book for these kind of things, Qi - general ignorance.
 
For starters, Napoleon wasn't short. Goldfishes do not have a three second memory etc. "
547," Just a general rule of thumb. Aim at tracks for critical damage, maybe gun if you're lucky. Tbf you're right though, especially since superheavy is quite meta rn "
548," Precisely. However, if you have a large ammo capacity there's no harm in bringing some extra. "
549," There are three main cases:

When the enemy has thin armour. If you can penetrate HE, you will do alot of damage, for instance against Skorpion G.

When the enemy has thick armour, and you otherwise can't penetrate your silver/gold rounds. This is some guaranteed damage, but not as much as penetrating AP.

When you must do damage. This is a rarer case, but say the enemy is close to win by capping. Then doing 5 HE splash damage is enough to decap, and save the game. Also good for locking someone by tracking them for a teammate.

Usually, the larger the caliber, the more effective HE. (Compare Jgdpnzr E100 85mm with T-100LT 50mm) "
550," I got steel wall in Skorpion G once. Skorpion op, plz nerf armour "
551," I based this list upon a lix between how fun a tank is to play and how well it makes credits.

Strv m/42-57 -Really fun to play, and easy to perform well in.

M4A1 Ravioli - Comfortable to use, and makes good credits.

FV ""Prius"" 4202 - Ok at making credits. I personally get stable results. (I've got a good crew, probably why I like it).

Skorpion G - It's fast and got a big gun. Nail a few shots and you're having a good game.

T34-85m - Decent alround tank. I really need a crew trainer for all those russian meds

Tiger 131 (Heavy tank no 6?) - Really decent tier 6 heavy with an extraordinary gun. Really good in platoons.

Cromwell Blin - It's a good tank, but I prefer the Strv more.

T28 htc - Pretty steadfast tank, which can hold it's own surprisingly well.

SU-122-44 - Imagine the Skorpion G but at tier 7.

Pz 58 Mutz - It's mediocre. It's probably due to my lousy crew, but it's ok. "
552," I haven't watched the video yet, but suggestion: Make 30v30 optionsl (like encounter and assault), and don't have them count towards gun marks? "
553, But it looks just fine to me xd 
554, Looks alright to me on my phone \_()_/ 
555, You mean this one? \_()_/ 
556," German too, right? "
557," In swedish, the bishop is called ""lpare"", and the knight is named ""springare"", both of which literally mean ""runner"".  Although springare can imply ""stead"". "
558, Mathematics. At least most people around me hate it. 
