,post
0," I once saw a genius, eating chips with a fork. It changed my life. Never again have I had greasy fingers "
1, Why hello there 
2," Wait. I'm legitimately colourblind, and now I'm starting to question if they actually are green and blue "
3, People would greet someone they havent seen in a long time by bumping their feet against each others. 
4," A container full of old, alchenical items. Some are dried, some are rotten/mouldy "
5," Yes. I remember once when I was hanging out with a group of friends. A friend had to leave because she discovered I had a cold.

Her father had just had a surgery of some sort, and as a result he had little to no immune system. She literally could not hang out with me because the slight chance of transmitting the cold to him could have given him blood poisoning "
6," Small rant here:

Yes I understand that when a lot for people sat this, they mean it as a joke, but you should really be careful joking about this.

Let me explain. The reason we vaccinate is not just to protect ourselves from preventable deadly deseases, but also to protect those who can't vaccinate themselves, like children, elderly or other people with some medical condition that prevents them.

If an antivaxxer would stumble across arguments like this they would gladly agree with them, because if they get the option to not vaccinate, they would take it. But what they fail to see is that they're exposing other people to danger. Aka they're breaking the Herd Immunity.

As I said, I acknowledge that this is probably a joke, but it's a dangerous thing to joke about, because someone might be influenced to believe it's a good idea. And if the person saying the joke is one of them, well, then it's important to stress these points. "
7," Thats is a why I fancy this community. Its hard, but it also spurs thinking. You know, thinking of various way to word your thoughts. "
8," Right now Im actually watching a show from Japan, such as Toaru Kagaku no Railgun, whilst waiting for a 4th and final part of Attack on Titan "
9," Me, myself and Irene "
10," I have a feeling several games fit this category: 

God of War

Assassins Creed

Dishonored "
11, Borderlands? 
12, Aquamam 
13, JoJos Bizarre Adventure 
14," Exactly. I also encountered a situation recently where I realised just because I can interrupt the fight, doesnt mean I should.

I was on the train when I started to hear shouting. I checked and two people were keeping a third person on the floor. I prepared myself to jump in to break up the fight, taking off glasses etc. 

But as I got closer I realised that no one was in real danger. Yes, people were obviously hurt, but no seemed to have taken any serious damage. Also people around tried to calm both sides down and de-escalate the fight. So I stayed nearby, but made sure that cops were called and all that "
15," Wouldnt you normally want more directionality in your jammer, in order to reach your target without getting too close? E.g. using a directed antenna as opposed to an omnidirectional one "
16, I... uhhh... dont know? 
17, [removed] 
18, F 
19," I didnt realize that until I made a sacrcastic comment. I started getting downvited and I was really sure hy, then a guy replied that I forgot /s. "
20," My name is Infernova, just sent you a friend request "
21, Yes. 
22," Whenever I see one, thats my first thought "
23," Im still conflicted. Whenever I see the pattern I go, Oh fuck, not the spirals again "
24," Ah yes. Whenever Im changing things on my server, the classical NotInfernova logs in and gets his roles reassigned, and hes always clicking everything about "
25, Astral Chain 
26, Dayum. I just found it a few weeks ago 
27, Super Smash Brawl; Subspace emissary? 
28, Tbh I dont think you fucked up. Someone would have broken it to them at some point 
29," I love that this game has loads of small easter eggs. I cant remember any specific ones right now, but I do remember there was one about Falloutboy "
30," I actually started reading it recently, and I must say it has drawn me in "
31," As someone else mentioned in on this post. When voltages get really high, they tend to arc through the air, so he wouldve been unlikely to be able to fully grab the wire before the initial spark "
32," Notice how the camera is perfectly set up, and that thr cheetah seems to be wearing a collar. It seems like its staged in one way or another "
33, r/OneTrueBiriBiri 
34, XCOM 2? 
35," Thats true. When autoloaders first came out, they jammed alot. I guess as time went and technology improved tvey reached a point where theyre now reliable. "
36, G 
37, I 
38, R 
39, Its like wheres Waldo but a lot more infuriating 
40, Well now I need to know! 
41, FIFA? 
42," Yeah. I mean now hes pretty much the strongest guy alive, but it would be interesting to see an origin story about hime, like a prequel series "
43, This is giving me Borutos Dad vibes 
44, Im getting Borutos Dad vibes 
45, Rhythm thief! 
46, Solved 
47, Correct! 
48,  
49, Look. Im a guy on the internet. Just trust me. 
50," Guy with two eyes here! The two eyes each observe a picture which the brain merges togethe (which is how we percieve depth). 

Since her left eye is unobstructed, it will see just fine. But here right eye is obstructed in its top right and bottomleft corner, which means she will percieve her hair overall in those positions, not straight down the middle, like a cyclops "
51,  
52," I wanted to make a manga spoiler joke, but then realised that this is not r/TitanFolk.

I then read how to mark spoilers, realising that Im on phone and gave up on my joke "
53, I read that chapter just yesterday. The chills went throughout my body and I was goddamn this is so good 
54," The ones I know:

Caught plague
 This is 049, the Plague Doctor. He will attempt to operate on anyone carrying The pestience, which we believe is what he calls the plague. People that he operates on may then become zombies.

Seen 096
096 is a dangerous scp sometimes who will kill anyone who has at any point observerd him. This is evident by a cobtainment breach where he suddenly started to rampage and broke free and then proceeded to go kill a man. It was later discovered that this man had seen four pixels of 096 in the background of a photo. "
55," Actually, it seems this video is actually a few years old. "
56," Its tekkit classic. Its fun, but it still have its great deal of bugs "
57," I mean, as I was falling, I had already accepted my fate "
58,  
59, Sg is a cmmon accronym for Singapore right? 
60," Hi fellow strong boned brethren. Like you, I have never broken a bone, but also, I havent drink milk since I was a toddler.

I am curious to what opinion on milk is.

On one hand, its good for your bones, but on the other its supposedly not THAT good for you.

I mean, I havent drunk milk for many years, yet I have never broken a bone. "
61, Solved 
62, Correct! 
63,  
64," Star baby makes me wanna say Kirby, but I dont know any of the games "
65, Okami 
66," Playing hardcore and using smoke grenades, I see youre a man of culture as well "
67," It was these kinda clips that got me into the series. It all started with Chikas dance, and moments later I was listening to all the sounds of Chika "
68," Thats for sharper turns, when youre doing a really gradual turn, displacing the centre of mass is enough to induce a small amount of leaning.

When youre doing a sharp turn, you need to get the bike to lean more, and you do that by turning the opposite way, helping you getting the bike to lean more

Edit: Try getting on a bike, go and do something like a sharp 120 degree turn, that should stress the point "
69," Im dont know the exact details, but you would motice if youre ever riding a bike/MC.

When youre turning the front wheel one way, the bike starts falling towards the opposite way.

As your bike is falling, you turn the steering back and now its pointing the same way your bike is accelerating, making that direction the one youre going.

[Anyway, this video explains it better](https://youtu.be/llRkf1fnNDM) "
70, Looks like a skin that would appear in AoT wings of freedom 2 
71," [The imperial system is wonderfully consistent and easy to rememeber /s](https://youtu.be/r7x-RGfd0Yk)

Edit: /s "
72," Sorry, european here. Wtf is a freedom wall? "
73," People say that, and yeah I understand the joke, but the problem is those guys are going to bring many more people with them. The same people who legitimately cant get vaccinated (babies who are too young, sickly people etc.) and that we are protecting with the herd immunity. "
74," Who's your favourite Strawhat Pirate?

Who do you think will be the next? "
75,  
76, Kyoto Animations recently had a fire (arson) and right now over 30 people have been confirmed dead 
77, Its more like she was pushes and decided to bring him with her 
78, (Not so)funfact: Wasnt thid the guy that accidentally deleted hus entire youtube channel? 
79," Out of pure curiosity, when roughly was this period? "
80,  
81, Dreadful. Absolute shame. 
82, Whats the worst that could happen? 
83, Lettuce or any other type of sallad 
84," Literally whenever you can. So, daytime "
85, Its like the song Cats in the cradle 
86," I usually use them as standard, that is mostly because I play on lowlybpopulated servers, usually not more than 10v10.

But they are useful ol bigger stages too. I usually on switch to them if I play a very dense game (i.e. 64players on Metro and Im holding a chokepoint. "
87," I accept our Lord, the ever insatiable Garfield! "
88," Roses are red, violets are blue.
Theres always an asian, better than you "
89," Their rules section:
[https://www.reddit.com/r/ohitllbefine/about](https://www.reddit.com/r/ohitllbefine/about)

The subreddit seems to have removed all of its rules, and people are shitposting everything.

I tried searching but didnt get any good answers. Did something happen or was there just so much low effort that the mods gave up? "
90, [removed] 
91, [removed] 
92, [removed] 
93,  
94, I keep getting pleasently suprised with all the easter eggs which keep popping up in this game 
95, Monkey Island? 
96, What even is that? 
97, Rayman raving rabbids? 
98, Solved 
99, Correct! 
100, Solved 
101, Yes! 
102, Nope. 
103,  
104,  
105, Castlevania 2? 
106, One of the Fire Emblems? 
107, Ni no kuni? 
108, Nope 
109," To clarify, I was inspired by the orher post, but I didnt rip it off "
110, No 
111,  
112," This is literally a swedish series (it also got a movie mad later). 

Pojken med Guldbyxorna (The boy with the Golden Pants) "
113," ! I have seen some very good answers, but I try to give my take on this. Im no expert on celestial navigation, but assuming the MC is smart.

By using knowledge of the stars, its easy to find out what hemisphere youre on. Its also possible to find out true North / South.

Next step is to wait untill dawn. When the sun rises, you calculate its angle of rise compared to the compass youve previously made.

At dawn is also the time you make your call. Think of dawn as a vertical line which moves across the globe.   By calling and letting them know its dawn they will know where this line is. By also giving them the measurements youve taken, they should be able to calculate where on this line you are.! "
114, u/nwordcountbot u/infernova99 
115," It can be a great challenge, but the rest of the party can really appreciate a well played one "
116, Solved 
117, Hehe that was quick. 
118,  
119," Fear, and Loathing in Las Vegas, - Let Me Hear "
120, Solved 
121, Correct! 
122,  
123, Shiet. Didnt even notice that 
124, Solved! 
125, Correct! 
126, Nope 
127,  
128, I really enjoy the podcast No such thing as fish 
129," I didnt read what subreddit I was on, meaning I had no idea what to expect. I wasnt disappointed "
130," Haha. You solved it. Getting isekaid and turning up in another world, except you manage to bring a gun with you. "
131, Nope 
132," It actually fits, but its not the one Im thinking of "
133,  
134, I thought itd be Super Monkey Ball 
135, May I ask what the 45 minute rule is? 
136, Thanks for letting me off officer. Well I better bee on my way back then 
137, That wasp a very clever joke 
138, You guys should just hold your horses and stop horsing around. 
139, There should be an option on the map selection screen to switch to the custom map page 
140, Ive actually heard it play at several hockey matches here in Sweden 
141, This one 
142," Is that how gender reassignment is done, by cutting of a womans hair? "
143, What about short hair? Or if there are two? 
144," From a wrong readers perspective, the first two lines have a convenient space just above another that is also aligned with the space between the panels. "
145, And drink water too! You musnt forget to stay hydrated! 
146, How is it even a fad? Where/how are all these kids getting this stuff? 
147, Someone who doesnt vapes apparently 
148," What the fuck is a JUUL Pod?

Edit: TIL that times are changing and kids are adapting "
149, No! Crabs are people! 
150," r/subsithoughtifellfor

Seriously though, how is this even a thing? "
151," 1. A cleric had a wild night with a demon in disguise, got pregnant. Giving birth to a part demon baby, she could!t bring her self to raise it and left it with someone else.

2. Youre parents was killed by a passing by army, but you were lucky to be somewhere during the time of the incident. You were to young to remember this.

3. You were kidnapped as an infant and sold on the black market. The ones who bought you treated you very nicely however, and as far you recall, they are your parents, untill one day when [insert character background plotpoint] "
152, Dont forget that you could also play fetch with them! 
153," While we mention Best Girl
r/ChurchOfFroppy "
154," You dont have to engage in a fire exchange. Most MT have good mobility, flexibility, viewrange and often camo. 

Playing to your strengths, you could for instance pressure their flanks, forcing them to either take damage, or pushing them back into cover to help your team advance. "
155, Also places Ive been at have had a low ceiling forcing you to throw at a (really) flat angle 
156,  
157," Except for what people have mentioned, I recommend Aragami.

Also Ghost recon wildlands, even though its not a per say stealth game, it encourages and rewards stealth and tactical play (especially at higher difficulties) "
158," Im no expert either, but I think that the voltage slightly decreases as the batteries are being depleted.

At what rate I have no idea. Try swapping for a fresh pair and see the difference "
159, Its pretty easy once you try 
160," Basically all the numbers point toward ONE of the two being a mine, but none of them specify which one it actually is.

So OP has been playing legit only to have his game rely on a 50/50 guess. "
161,  
162, NANI?!? 
163, No! Crabs are people! 
164, Ive put my monitors on top of several dictionaries(lotr books too bcas they thicc) just to get them up to a perfect height (ergonomics). Ive hade them like that for years. 
165," I dont know man. I mean, dont we all got this burning desire to make puns? "
166," Has never happened to me on my experience, but, uhm... 

You know what. Ill just leave that to mr DM to decide "
167,  
168, Why thank you. Good bot 
169," !1st door.

Those animals are indeed hungry. Really hungry. In fact, since no one has been to the castle for years, we can presume theyre so hungry that they are probably dead. Therefor, that will be the safest door.! "
170," !1st door.

Those animals are indeed hungry. Really hungry. In fact, since no one has been to the castle for years, we can presume theyre so hungry that they are probably dead. Therefor, that will be the safest door.! "
171, Surely you meant seat-uation? 
172, I didnt even realise that. Guess I was destined to roll down this road of mine 
173, What a half-witted joke 
174, Dam good arrest if I could say so myself 
175, You gotta AMP up your game officer 
176, Drakar och demonerar 
177," I efterhand ja. Men nr man sitter dr, bilen framfr har stannat, och fraren ppnar sin bagagelucka. Sjlv r man fr svensk fr att a)sga emot (alt. Tuta) eller b) kra runt (eller backa/kra backt).

S dyker ett helt kk upp. Folk flockas, fotgngare, cyklister likvl som andra traffickanter, sen blir man gott vl tvungen att kpa ett par UTGNGNA semlor, fr att nr man rullar in p jobbet strax innan r du i princip tvungen att muta chefen.

O andra sidan var semlorna rtt goda nd. "
178, *spreddit 
179, ecSTATIC abput youre arrest? 
180," Tbf, I can already picture myself the end "
181, He is. That wasp a very well executed pun 
182," Mine has a few layers behind it. 

Young 10year old me loved pokemon, and by then I was playing pokemon diamond, thus I choose the original name of Infernape Lover

Some years later I started playing minecraft (the cracked variant because teenage me cant buy stuff on the internet). It had a feature of setting your own nickname. As I was playing I realised my name was too long to fit on a single row on the signs.

Then I misstyped my name infernapenover which surprisingly was a perfect fit. So when I bought minecraft, that was the name I went by.

However, as I started playing online years down, noone ever called me my full name, they nicked me infer instead. I concluded that my name was still too long. I started tinkering. I wanted to keep the infer part as that was what people called me anyway.

Being 14ish I realised I could portmanteu inferno with nova (infernova) and that was the coolest shit ever. Also relatively unique, havent had too many troubles getting that username. "
183, *Hz 
184, Hands off my brethren! 
185, Nothing like a good train pun to kick off some steam 
186, The best part is that Im not even afraid of those things. The thing is those pictures look really cool as long as you arent scared shitless 
187, While were at it r/thalassophobia 
188, Western countries do. For instance there is the SAS Killing House where they even invite [external guests to partake](https://youtu.be/qKHt4R7ByY0) 
189, Then Im stupid. My fault 
190,  
191," One session our party was exploring a dungeon. We got to a crossroad where our options was a small door to the left, and a big door to the right. Most characters were too big to fit through the smaller door, so we tried our luck at the bigger one.

I, playing a monk, asked the DM how tall the door was, and he answered I dunno. Big. Maybe like 200ft and the keyhole 100? I quickly realised I could easily dash up to the keyhole, walk throught it and continue.

Later in the dungeon I came upon a room with a lava pit (also som pillars sticking up, probably for jumping on). How far to the other side mr DM?
Oh, lemme look here. 100ft! You can guess what happened next.

Later on, in the semifinal room, in a big labyrinth, we stumble upon a LARGE lethal snake. We tried fighting it first, but it took me two turns before I was on deathsaves, so after the cleric had healed me, I picked them up and noped the fuck out of there. "
192, Its fucking Toddy! 
193, Gee man. Im running out puns. I dont any more to spare soon 
194, Does he have enough strikes for a turkey then? 
195," The question remains, was that his first strike? "
196, A ban on jokes is worse than a sub belt punch! 
197, Well that was a SHITty joke! 
198, I like youre take on the word 
199, But then you realise youre a monk! 
200, As I was reading to myself I thought I wasnt seeing it. Then the last line hit me like. 
201," I once had a situation were I slid down a 60 degree slope as I was trying to climb it. For the last few days it had been oscillating between freezing and melting temperature, as such everything was practically ice.

I almost got to the peak when I felt I was losing traction. I instinctively put down my knees and hands and troed clawing with all my might to not slide down the 10m I had managed to climb. Didnt work. Also carrying 15-20kg of equipment. "
202, D 
203, A 
204, Im surprised this isnt higher up 
205," 11/10!  ? Thats way lower than what I wouldve given them

r/unexpectedfactorial "
206," Det var lite lttare fr mig eftersom jag blev vrnpliktad. Det r nog lite fr sent 0 och ska nu, men annars blir det ett r med lite utgifter och en del inkomst, och s lite slipning person (och ven CV har jag hrt) "
207," I remember watching a video (by Veritasium) about survivors bias. Since that part already was ruined by that time in history, those are probably the more durable parts of the temple, and as such are more likely to last even longer.

By the same principle you dont see the less well built parts because they have already decayed long ago "
208, !Spoiler Clock/Time! 
209," Funny story. Once when me and my family where going to fly to London during the holidays. But the night we were flying our flight got cancelled and they put us on a flight to a nearby bigger airport where we would spend the night and continue flying first thing in the morning.

As we were lined up in another country for the check-in we stumble upon me and my sisters science teacher "
210," I accidentally swiped right viewing this post, and the next photo in line was a cats arse "
211," Oh, I misunderstood the criteria "
212," One piece unlimitrd cruise!
(Two versions, SP and SP2) "
213," That looks like Sdermalm, Stockholm! "
214, I didnt even know that was a thing. I find the radius to just be the perfect size xD 
215, Man it mustve been hard when you reached that day when you realised for the first time that your hands are never going down the tube again 
216," My hands are not even small, just slim, I use medium sized gloves "
217," Me too. I mean, whos going to pick up the individual crumbs? "
218," So I noticed yesterday when some Pringles related memes popped up how people struggle to get the last chip down the tube and how you had to form your hand etc.

In the comments people would say how they eventually give up and tilt the can.

I realised then that I never struggle to eat pringles and can effortlessly pick up the last one (19 years old average size male).

I asked a group of friends and out of us 8, three could fit our hands, (even though one of them was a bare fit). "
219, Desk 
220," This is a story which happened exactly one year ago. Background: Being the tech-savvy guy in my class people would usually contact me when their computer acted up.

Anyhow it is new years eve and Im  in the midst of eating dinner, when I get a text on my phone from a pal. This friend of mine is a really nice guy, but hes also a workaholic.

*Friend: Hi Infernova! I was writing this paper when suddenly my keyboard started to act up.

*Me: In what way? Are buttons still registering or are the wrong letters being input?

*Friend: The letters. Some of the keys input the wrong symbol, (I cant remember the exact letters, but it was something  and some shift+letters)

*Me: Sounds like your computer thinks youre using probably an english keyboard, check in your settings which keyboard youre using.

*Friend(after some minutes): Shit I found it! Thanks mate!

*Me: Btw, how come youre working on new years eve?

*Friend: Bro I just forgot that its new years eve 

Apparently he got so into his work that he forgot what day it was.

Anywell, happy new year to all you awesome dudes out there

 "
221,  
222, But have gotten the bookshelves to the towers? 
223," Im not a father, im not even close enough to be old to eith (19), but I love the switch for the exact reason. Due to work Im barely home, so its a luxury to bring something with me to whip out during brakes.

And when Im home I usually dont have that much time either, so being able to pick up, play is golden.

Its also why I love the DS and its many reincarnations. It was a must for me while I was traveling (still is tbh), because I could just have it in my pocket, and when I suddenly needed to wait 30mins at this one spot I could just whip it out and play some fire emblem. "
224," I had 2 friends who was in my karate group and scoutgroup. They were 2 girls one being 2 years older than the other. They always shiwed up together and left together. They shared surnane.

It took me a few years to realise they were sisters and not just really close friends. "
225," What are your thoughts and tips on social interactions between withing the gane (PCxNPC and/or NPCxNPC)

Within my group, and Im the next in line to DM, and I thought Id really like to give the world more colour. "
226, I remember awkwardly folding out my bipods only to embarassingly put my first salve into the rock Im lying on 
227, Was never risky 
228, EOD Bot 
229, Everyday mans on the blocc 
230, Wait how? 
231, Communism is the superior ideology! 
232, F 
233, Yes 
234, I had a teacher somehow write PORNCORN 
235," Act!
Right time, right time, right equipment!
Yeah thats a roger
Faster!
Drink water, change socks

Im in the army btw "
236, I still have troubles getting them to send different colour ripples. I keep getting the ripple that's on top of the layers be the only one appearing 
237, Just got a new Cynosa Chroma (loving it btw) and am trying to configure the Razer Synapse Hue. Is it possible to have different origin button presses trigger different colour ripples (e.g. 1 always triggering a blue wave and 2 trigger red)? 
238, Miley Cyrus... 
239," Once when I had gotten stuck in a train jam, I heard music. Apparently the guy to the left of me was blasting Wrecking Ball on his phone speakers "
240," Alot of practice and really using my knees to have my body follow the motion.

 "
241," Ive actively been playing with kendama for a year now. At first I quickly learned the cups and the easier tricks.

But today I reached a milestone, Ive done my first three downspikes. My friends didnt really pay attention but Im so chuffed! "
242, TOG! 
243,  
