,post
244," Sm bivacker r bra fr vrme. Men akta s den inte bli fr liten, fr d fr du inte plats och blir blt o kall nd.

Och man skulle tro att jag borde vetat bttre om pressen efter 8 rs erfarenhet av bivackbygge, men man gr dliga beslut nr man r trtt xd

Nej men, se till att jobba p medans du kan (nr det r ljust eller inte regnar "
245," Min tilldelade plats var p en mosstckt rullsenss. Det fanns f granar som erbjd ngot skydd alls. Efter lite orientering hittade jag en gles gran som hade ftt jorden under sina rtter bortgrpt. S dr krp jag ner och frstrkte tak, vggar golv och byggde en sjukt bra eldstad.

Problemet som upptod var att taket blev fr flakt och vatten brjade ansamlas p pressen, och s smningom tyngdes den ner det kalla taket mot mig, och brjade droppa igenom "
246," Nej fr fan! Det regnade mellan 1600-0330. All ved var vid det laget blt, ven den jag samlat ihop i bivacken "
247," Hehehe. Det hade nog kunnat g betydligt bttre. Platsen jag fick erbjd f alternativ s jag fick bli lite kreativ och bygga ngot okonventionellt.

Sen nr man r trtt, hungrig och inte s fylld av energi fattade jag ett felbeslut. Och sen s ett felbeslut p det felbeslutet.

Det slutade med att allt mitt materiel blev dyngsurt och iskallt, s jag fick varva med 15min vrmepromenad med 5-15min smn genom strre delen av natten. Men jag bet ihop och tog mig igenom det nd "
248," Jag har hrt lite olika. Men exempelvis fick vi 5-3h smn och 1 ml om dagen. Ganska oregelbundna rutiner. En dag fick vi lunch, och minuten efter grvde plutonen ett 100m lngt stskyttevrn.

Uppgifterna i sig fr oss iaf var varken svra eller komplicerade, det utmanande momentet var bristen av energi och smn. (Hungern vnjde man halft bort efter 2-3 dar)

Nj, men alla i vr pluton klarade det strlande. Det viktiga r att ni fortstter lsa uppgift och peppar varandra! "
249," Haha. Vi krde andra ordningen. Vi krde AGU frst. Kom sen tillbaka till kasern och brjade vrda all materiel, men observerade att vi aldrig fick vning avbryts.

S vi gr paranoida runt p kasern dagen efter, och sen blev vi pltsligt utslngda p soldatprovet. Men fyfan vad det var hrligt att ha gjort! "
250," Jag sger som en kompis sa till mig. Dina befl kommer  ofta sga t er att dricka vatten (speciellt i brjan). Ni kommer tycka att det r skitmycket vatten, men egentligen r det inte tillrckligt mycket "
251, Vafan. D r vi ju p samma! 
252, I got my reddit account in order to interact with subreddits and ask some questions etc. Was a bit of a buzzkill at the moment to realize I couldnt do much 
253, r/absolutgalnapojkar 
254,  
255," Since neither of us have a d100, we use it as one, and anything above 100 counts as a reroll "
256," It started with DnD. I thought itd be polite and buy my own set of dice as not to constantly borrow others.

Then I found a website which happen to sell more odd dice, (d24, d30, d60, d120), and odd shapes of the other dice. Tempted to own a (completely useless) d120, I obviously bought it, and since then  started to collect unconventional dice. "
257," [Thrall on thrall fight (16min mark and forward)](https://youtu.be/k8XHoTCOvUI) 

[Zoey and Rythian do not have a good history with explosions (3:57) (followup 4:47)](https://youtu.be/svS0UbHIHaI)  "
258," I just saw a post on r/europe about the Turkish Lira and how it had been tanking. People were discussing in the comments but I still have no clue as to how and why it dropped.

[(Post from r/europe)](https://www.reddit.com/r/europe/comments/963s6w/turkish_lira_has_sunk_by_over_10_in_just_five_days/?st=JKNWAAT1 sh=65a6aedd) "
259," There is no war in Ba Sing Se

 "
260,  
261," [Boss makes a dollar, I make a dime...](https://goo.gl/images/pkppkc)  "
262, You get more and more of a valid excuse to use back in my day... or when I was your age... etc. 
263, Its a mobility scooter 
264, Shagging the dog 
265," Not Walmart, but Target. Me and some friends and family were in NYC for vacation, and stumbled into Target to get some basic supplies (fruits, soda, snacks etc.) 

Its going to sound stereotypical, but as europeans we were a bit shocked. At the entrance there were permobiles anyone could borrow while you grab your groceries.

Then we had a laugh at lunchables, 10 litres ice cream buckets etc. As youngsters we were standing out a great deal fooling around Target. "
266, Realistic MilSim airsoft 
267, Hello there 
268, Like shit 
269," According to this video there are about 80 324, but it also varies depending on where in NYC you start and where in LA you stop.

Edit: [Source](https://youtu.be/dQw4w9WgXcQ)  "
270," Just like an actual trebuchet, r/TrebuchetMemes took a big swing in its contents for the worse (few weeks ago). There was a big war involving multiple subreddits and luckily enough it was eventualmy returned to its former glory. "
271," The Skyrim sleeping system. Imagine being able to sleep anywhere between 1-24hrs in a single rightclick. And if youre sleeping in a bed you own, you will always wake up feeling Well Rested "
272, r/NoCapes 
273, Why isnt this higher? 
274, Its a setup for an eventual spinoff or sequel series! 
275," 1. As the party walks (anything but an open plain) they hear humans yelling every now and then. Should they stay to find out or investigate further they will find a hunting party. Because good weapons are expensive not everyone from this party can afford one, therefore all the money have been pooled to make/get one/few weapons and the rest have formed a line to drive the animals towards the rangers.

2. Here once stood a smaller village or town, but it eas razed a while ago either by a war or by any other conflict. But because of an ongoing war (or other crisis) refugees have started taking residence here once more.

3. The party notices a shop on the roadside. Upon closer inspection they find out that its inhabited by a mad scientist. Heres a list of some of his inventions:
         a) A swear. The man had an old shortsword lying
around thought that its range was its       shortcoming. So he put it on a long stick to increase its range.
         b) A two sided die. Its a flat wooden construct with a 1 engraved on one side, and a 2 one the other.
         c) A magic crystall which can store magic, and upon activating it will release it. Because of its low quality it cant tolerate anything stronger than a cantrip and they usually break upon use. Its not uncommon for them to break from smaller shocks either, resulting in a small firecracker-esque explosion not even strong enough to harm a bird. However because of the crystals rich potassium and phospate content it can be used as the most excellent fertilizer. This also explains why the scientists garden is completely overgrown. "
276, Lowkey wants it to be an actual subreddit 
277," Reminds me of this time back in the day. My friend was just about to finish capping and I was going around in my 300HP IS-3 looking for some extra damage.

As the cap was finishing I get pinced by a WT-E100 from the front and a Jgeroo from the rear.

Both of them fired and I realised a second later that I was still allve. Apparently one of them bounced, and the other shell never hit because the timer ran out. "
278, You wont be able to leave the continent because you would encounter Emus on the way off 
279, Communist Manifesto by Karl Marx. 
280, Life. 
281," I was once talking to my mum (who was out driving alone) and then she put away her phone, forgetting to hang up. I muted my mic and put on speakers and me and my sister were in for a ride.

Ive played toxic online games with people, but this was in a completely different league. "
282," I will start this with thank God I dont live in Norway.

In Norway they have a brand called Bamse-mums which are comparable to marshmallow bears dipped in chocolate. These bears, are the best and the worst food to happen to me. Why? Because once youve eaten your first, you have about 5 minutes to get rid of the rest before you will have gulped them all down.

The worst part isnt even the addictive part. When I ate my first bag I didnt realize how good they were, and in a really short span they were consumed, and because of their marshmallow like guts, those WILL clog yours.

I once had a bag and opened it in front of my friend, said Whatever you do, dont eat one, ate one for myself, and placed it right it in front of him, with the opening towards him.

He took one, tasted it and within a minute when he had eaten his 5th and realized how addictive they were he threw them in my face and we agreed to bury them.

So yeah, to answer your question. Bamsemums "
283," Ei sa peit
M ikke tildekkes
Fr ej vertckas "
284, Photosynthesis 
285, OP going to prepare a folder 
286, Trained 
287," Never gonna give you up on either a harmonica or a kazoo. Imagine it. Wherever you are, whenever you want, you can whip out this tiny ass instrument and lay down the greatest tunes ever known to human knowledge. "
288, Just wait and see if there is a correspondi h r/TIFU 
289," var_a
var_b
var_c

... "
290, See what bad things happen in baths! Baths are clearly a bad omen! 
291, I knew exactly which clip it was 
292," I dont really know why, but I have a softspot for Mk11 mod 0 with ACOG and canted ironsights.

I like the ability to engage in mid range encounters but also not be helpless in short and long range encounters. "
293, r/recursion 
294, At least they dont waste cellular data... 
295," Depends on the person. Australians are normally upside down, but they do encounter a lot of tourists (who of course are right side up), and therefor they, being upside down are used to people speaking rightside up.

But when we consider Einsteins laws of relativity, we realize that from their perspective theyre right side up, which means to them (and only them) WE are the ones being upside down. Therefor, Australians can understand upside down.

Of course we who arent from Australia have little to no chance of understanding, because how often do you encounter an australian (try to remember when you last saw an upside down person, if you have at all) "
296, Obligatory  r/lostredditors 
297, R/doingredditstuffwrong usully summons a bot or two 
298, Fun fact: In Swedish we say kasta macka which translates into: throwing sandwich 
299, What people miss is that it actually was a party-trick consisting of alcohol and a lighter 
300, What if Deku never got a quirk because All for one took it? 
301, *Gol D. 
302," I could be mistaken, but it seems to stem from a TV-show called Heidi "
303, We must go deeper 
304," Id better be careful with that proposition. Imagine being on a bad spree maning bad decisions and having teams that doesnt help the situation. Thatd be very frustrating especiallu when youre not gaining anything. Itd probably be better to increase the reward of winning (or ever so slightly reduce one to increase the other).

In several cases, its usually better to reward the opposite of the behaviour you want to punish (even though the outcome will be similar) "
305, I love that they also realize that those entries are fake 
306," It happened me today. Me and some peeps were talking and I was going to bring up Yeah so [X ]happened, which funnily enough lead to [Y]. By the time I got to [X], they huh and then immediately went back to their conversation as if I never said something. Smh "
307, I never realised how good of a tip this is until a friend did that to me. 
308, Min kompis och jag gick ver till donkenbjudningar  l ~70kr 
309,  
310,  Cons-tits -ently 
311,  
312," Isnt there actually one sang by the four swords misadventures Links?

Edit: [Found it](https://youtu.be/W1rmZjBmShI)  "
313, META 
314, I am sitting at the dinner table and this legitimately made me laugh out loud. Everybody was staring at me. 
315, The Paradox games does alot of what you just described. Theyre slightly different gameplay-wisd but theyre good games if youre into historic real time strategies. 
316, Endast en dansk skulle kunna ligga bakom detta 
317, NANDESKA? 
318," I remembered when I turned 18 and my bank finally allowed me to use their internet bank. Thing was I had to physically be present at the bank for them to activate it.

This usually isnt a problem because banks here have a norm of being open to 17:00 once a week, for us commoners occupied 8~16.

However this bank was only open mon-fri, 10:00-13:00. "
319," I used a colour inverter, and once the top two rows were inverted, I could see the difference. "
320," I like the gotta catch em all mentality about it. In not crazy about the colours but rather the shapes and sizes of them.

Why use a regular dodecahedron (d12) when you can use a rhombic one? "
321, Im literally hitting play right now 
322, I saw an ad on tv last summer (or the one before) 
323, As we like to call it in Sweden; Norweigan Christmas 
324," This is going to be a long one.

So our party has several murderous psychopaths who I honestly wonder are even close to being good.

After a long playsession were we almost killed ourselves several times without even being in combat our DM presented what he had planned for us.

His plan was as following: 
First we were supposed to speak with some old acquaintances and see if we could get a boat and sail towards the Big Bad Evil Guy (BBEG).

As we went to the harbour, there would be one functioning ship and a shipwreck. If we were to explore the shipwreck we wouldve found an injured girl whod been damaged by magic crystals, to teach us they are bad.

DM then thought we would steal the literally only available ship and sail off to fight the BBEG.

INSTEAD

We made pur way to the har pyr. There, we overdose on Arcana crystals and two of us got arrested and put in rehab.

Everybody ignores the boat and its captain by the way.

We got out of rehab and found ourselves at the top of a hill, with a straight line down to the harbour where the rest of our party. I, the cleric, was on 33/64 hp and the sorcerer was on 1/48.

The sorcerer is lying unconscious in a cart and I realise as soon as I move the cart, it would go rampaging downard. I also dont realise that hes on 1hp. The doctor ordinates sleep will do it.

I jump in the cart. What could possibly go wrong?

One crash site a few hundred meters below, and 50 damage later, the sorcerer is instakilled and we collectively pulled together to pump as much lifeheal into him, desperate to push him back alive.

250hp+ was dished out and we even tried turning him into a vampire hoping some undead might bring him back. After pooping out over 150hp myself I drop down on 0hp and start throwing death saves.

Our bald undead vampire tabaxi bard runs aboard the ship and starts pressing all the buttons. He rolls a critical 1, and DM said: You know what, thats it for this time. Well continue next week. Stood up and told us what he thought wed do.

Tl;dr: Instead of stealing a ship and sailing off fighting the bad guy, our party overdosed on arcana crystals, were put in rehab, resuciated our wizard by turning him into a vampire, and then probably blowing up a ship. "
325," My friends once did an economic union against me on monopoly because I built the first hotel of the game, even if it was on the cheapest possible street. "
326,  
327, Over 100%! 
328, No thats completely right. 
329, f 
330, Not with the UNLIMITED POWER that it will bring me 
331, S 399kr/(kg)^2 ? 
332,  
333," Put my spotify on private mode, listen on it constantly for a few days straight. Eventually you will feel that theres another song youd rather listen to, which will, of course, take the place of the old one in your head. "
334, Rubiks cube and minesweeper 
335," Super cynicalism. I have a hard time believing what anybody says, especially if its a lie. A bieffect of that would probably be me hating most stuff too. "
336, When I realised he was a compulsive liar and probably one of the biggest racists Ive ever met 
337, Swedish  
338, Being bilingual is hard :p 
339," It was in 8th grade and I went to a school with strict ruling. So I had brought an apple to school which I intended to consume as an afternoon snack. 

So our school had this policy that no one is allowed to eat or drink in the hallway, which is fair enough. So we had a somewhat long break, so I take my apple and walk outside and begin consumption.

But this was in the summer and the sun came out, and me being an edgy 14 yr-old went back inside with my half eaten apple to grab my cap and sunglasses. A teacher appeared and presented me with an ultimatum, go back outside and finish the apple, or bin it right here.

And if I uttered a single word of protest she wouldve given me a behaviour warning on the spot. All because of an apple "
340," Emperor Palpatine.

Do it! "
341," 5/10, no disdyakis tricontahedron. "
342, So youre saying that you do not allow your kids to play with the caltrop shaped toys? How else are you supposed to step on them in the middle of the night? 
343," After a little use, its pretty easy to tell whats on top. We still havent got any use of anything larger than the d20, but the d24 + d60 can be used to generate time stamps.

The d120 can be used as a larger percent die. Some die throws use the d100, but we dont have any, so a d120 -20 can be used for instance. "
344," It rolls ever so slightly better, but I like that it has a more apparent topside. And its unconventional. "
345," Aww man, now I want some too "
346," I mean, technically it can be used as a golfball "
347, Or 20d6  
348," Idk. My addiction kicked in and suddenly I own a Hexakis Icosahedron

Edit: Me and my friend talked about it. It could be combined with a d6 to generate a normalised random number generator "
349," One d120, two d60s, one d30, one d24, one d20, two d12 (a normal dodehahedron and a rombic dodecahedron), percent dice,  two d8s (a normal octahedron and a truncated octahedron), two d6 (one normal and a binary), and lastly two d4s (a tetrahedron and a truncated tetrahedron) "
350, I got the binary die for that (0/1) ;) 
351,  
352, German humor is no laughting matter! 
353, I can map my entire party into that chat 
354," Elesia, hill-dwarfen cleric

Her earliest memories are of her growing up with life clerics and there she learned of how to help those in need preserve life, but she never seemed to awaken any magic powers.

But that didnt stop her from traveling the lands and helping those on the brink of death. On her travels she met a devastated man whomd lost his will to live, and was starving himself to death on the street. 

Elesia then took time listening to this depressed mans story, and every time she came back to this town, she would stop by and visit this man.

Eventually she and this man would get engaged, and on the evening of their engagement, a mystic girl appeared in the crowd as time slowed down. This girl somehow altered Elesias soul and since then Elesia have been blessed with the power of magic.

Elesia thereafter joins a rebel army who are revolting against a demonic queen, whilst her soon-to-be husband (Orag) joins a small party, trying to earn money to acconplish their goal of building a hospital.

Orag gets drawn in to this plot to kill the demon queen, but sadly the queen hexes him, enslaving him. Orag being a formidable fighter, sadly berzerks and goes down in a blaze of glory, killing the majority of his party.

Elesia, saddened by Orags departing ups her effort to dethrone this tyrant and joins the elitesquad of the rebel army, along with three veterans and three new recruit, in order to dethrone the queen before she hurts anyone else. "
355, Whats the name of the podcast? Sounds interesting and funny 
356, More like r/NotMyJob 
357, Record everything and upload here 
358," This reminds me of one of our earlier sessions. We had accidentally killed someones daughter whomd wed been tasked to rescue. She had been turned into a giant and noone knew so they just slaughtered her.

As we return to the town to report in, me playing an empathetic character informed him that his daughter wasdead.

When he asked how/why another guy answered; So yeah, we mightve killed her because we did not realize she had been turned into a giant

Smooth. "
359, On the edge 
360, Doesnt suicide equal -2 to deaths or still 1 death and -1 kill? 
361," Whilst were on the unrealistic theme. It reminds me of the three towers (kings?) mission were you had several bossfights. At least one of them would pop his head out, and you had to him then.

Literally unloading bullethell upon his face and he was barely taking damage "
362," And I went plask plask plask, you man were jumping! "
363," My character may have been killing the others during the time, and as we realised, that pretty much everyone were dying, we thought we kill off the others one aswell. It was all of ours first game and no character were agreeing about anything.

So we took this opportunity to start as new "
364, He was badly intoxicated and wanted to wake up and rush off to fight. Plus I think there was some curse in there too 
365," I have a friend who had immense bad luck. He managed to get intoxicated and fall asleep in a house full of prostitutes. Eventually he started to roll for waking up. He kept rolling and rolling to wake up but never succeded. After a while he rolled a critical 1.

Apparently he fell in a coma and had to start rolling death saves. Needless to say he never got to roll a successive death throw, and without any of us knowing, his body was threwn out and rotted away in the gutters. "
366, I just spotted tem and thought they were cute :v 
367, I just thought they seemed quite and liked the additional details 
368,  
369," Wouldnt it be fun if the shouts were shorter sentences or phrases rather than three words put together. And instead of adding words to increase power, the dragonborn instead learned to translate it more precisely and perfected the pronounciation? "
370, I had a math-test were I manage to get an answer to a question. Except my answer was negative but it clearly needed to be positive. So I frantically went through my solution to find the best spot to drop a negative sign 
371," Som jag minns det s handlade det en del om samband. ven om man fr formelblad s kan det vara lnt att kunna t.ex. trigonometriska samband.

En grej jag vet med mig r att man fr se till att vara noga. T.ex. teckna din integral-uppstllning korrekt med dx osv och glm inte + konstant. "
372," Har ntligen slutat dagen efter 3.5h svenska tentamen. Nu ska jag hem, spela lite, och sen dra ut och kra DnD med polarna "
373, Or it could be for ninjas. I like to imagine that it coulde be either or 
374,  
375," We did that once. We played it out as being another party from the same faction, who set out to do what our previous heroes could not. "
376," I was playing a conflict avoiding dwarf by the name Orag who could NOT kill. If I did, who knew what would happen.

Thing was, since this was our groups first game and I was the only one who wasnt a murdering sociopath.

When a battle ensued within our party, when one of our characters were seriously going to slaughter another, I stepped in.

Roll for hit: Natural 20

Roll for damage: 30+

Insta-kill

DM rolls d20 to see my fate; Natural 20

Few moments later and Orag had slaughtered the majority of the party (fighter whod just learned maneuvers) and the two (LUCKY may I add) survivors managed to walk away with pretty much the entire party lying limbless on the ground "
377, B u t C a n H e D o T h i s ?!?! 
378, SASUKEHH!!! 
379, Ooooh. That explains alot. Ive always had stewards in my houses! 
380, This has actually never happened to me no matter how many wives Ive married and houses built :( 
381, But the question is. Did you do it in one cut? 
382, Basically how I described it to my grandparents 
383, I got a text from a guy whilst I was celebrating New Year. Luckily I found the problem quickly and he could easily fix it himself. 
384," Just throwing some thoughts out there

Maybe differentiate between the open areas? I can imagine that closer to the cliffs its more barren, maybe patches of grass, but closer to the cities, I feel that you might wanna dedicate some land towards farming?

The cities have to get their food somehow, and only hunting (fishing for the coastal ones), probably wont cut it, especially for the larger cities.

Also: not everyone lives in cities, maybe add some smaller houses or clusters. So towards the coast you might have a large city, but inland one might find a small setlement living by a busy road?

Otherwise, amazing map! "
385," I dont know, I havent really gotten in to it, but I think it depends a bit on who you are, what language and what you are programming, but generally, a bit I think. "
386," How much does a polar bear weigh?

Enough to break the ice. My names Infernova.... "
387, Ive heard jobs like programming could be worth it. 
388," I dont know. I never dared use it in fear of it breaking. I realised this friday, that my cleric might be able to mend it. "
389," I found a broken dagger (d8 -8) because I rolled a 1 one looting. Several character decelopments and plot points later, its my most prized possesions. "
390," Cool, Ill go ahead and check it out. "
391, Thank you I will definitely try it. 
392, [removed] 
393, A D60 isnt too bad a choice for ammo. 
394, So much better than good ol toxic world of tanks 
395, Twenty one pilots - heathens 
396, Google Gandhi civ meme :p 
397," First things first: I dont see no [serious]

Second thing: Its a meme, which actually originates from a glitch in a civilisation game. It came to because Gandhi was so friendly it caused him to become too friendly, which made him loop around to the top of the aggresive scale, which meant, Nukes Galore! "
