,post
0, Im so sorry youve had a negative experience. Im here to support you if you ever need it. Sending love to you! 
1," No, just scratches on the top of my wrist. "
2," I have been suffering from exam-centered anxiety and panic attacks for a few years now. Perfectionism in conjunction with extremely low self esteem has contributed to this. I spend every night studying for hours, and can expect a breakdown a few times a week during the school term.

The issue is, I know nothing will get better from here. Ill never make it into university, let alone survive the rest of high school. From there, Ill never achieve a job that I want, and be stuck with minimal success and continual stress. The ""best"" part of my life is now almost gone, and  Im already watching my future crumble at my fingertips as my grades steadily decline.

So, what are your opinions on high school anxiety? Is it even valid? Does anything ever get better? Is life useless now? Should I give up? "
3," Im so sorry to hear that. I wish I could be there to give you a warm, comforting hug and let you know that you can get through this. One day at a time. "
4," Hi, Im heading to bed now but please feel free to spill your thoughts to me in a chat. Ill respond when I wake up in a few hours - sorry I cant be there now. Please dont feel obligated though! "
5, Thanks for the love. Sending some to you too! 
6, Please dont go. You deserve to live. Talk to me if you need to. I am here for you. 
7," Yes, definitely. Often, when Im posting genuine comments on r/amiugly (in response to posts), Im met with hatred and replies like: ""youre an attention whore"", ""hes ugly, stop lying"". I really hate it sometimes. "
8, I dont even know whether I should wait a few years. I feel like it should be over soon. 
9," Im already failing in high school - I feel like I have no life or future. Ill never make it into uni. Ill never have a successful career. Ill be left a sobbing, useless mess for the rest of my life - which may not last much longer, at this rate. "
10," I try to write them down. This always helps for me. I jot down whatever Im thinking - digital or pen and notebook, whichever I feel. I make sure to delete the writing afterwards. "
11," I know. Exactly how I feel. If I can barely survive now, Ill never make it. "
12, Thank you! Ill definitely try. 
13," My mental health is already crumbling and Im still in high school. Ill never survive uni, let alone get accepted. My life is already disintegrating, and I hate my grades. Ill never be successful. "
14, ): 
15," I have one more week of spring break left, and I have been relatively productive, getting little assignments done each day, and completing my to do lists. Unfortunately, my school provides no preliminary coursework to study, so I do not know how to prepare for the next term. It feels too overwhelming to review all the previous work  what do you recommend for being productive and prepared for a new school term?

By the way, I am about to enter 10th grade, and I have anxiety and mild depression due to school and exams. "
16," I get a snack and a cold drink, organise my study space and computer, check my to do list and cross off finished items, and take a shower if I need a total refresh. Ill also go outside or read for a while to reset. "
17," Me too. Theyre actually really sweet and supportive, but I feel like Im just a burden that makes everyone sad. "
18," I know exactly how you feel. Even ""fun"" things are dreaded, because they drain me so much. All I do is study, work, and read - my friends wanted me to come to the pool with them but I know how anxious and exhausted I will feel, so I declined. I dont even know what Im doing anymore. "
19," Try to unwind, even though its hard. Relax each muscle, one by one - feel yourself going limp. Im so sorry to hear that you arent doing well - wishing you all the best, sending love. "
20," Your emotions and mental health situation is valid. Dont let others tell you what you are experiencing. You are going through a difficult time currently, but youll make it. I believe in you. "
21," Of course, feel free to message me.  "
22, I hope that helps! 
23," I am on spring break currently, and I have one more week until school commences again. I am filled with anxiety about it, but feeling slightly better now. I printed some organisational papers, made piles of papers to review in preparation for the new term, and started feeling excited to work as hard as I can to achieve much better grades and stay on top of assignments. I hope this feeling lasts, as well as my productivity streak. I hope you had a lovely day, too! Just wanted to write this out to keep myself accountable. "
24," Tidy up my desk, organise my computer desktop, read a few pages of a book, or work on my bullet journal! Its also good to get a snack or some fresh air. "
25, Thank you. Ill try.  
26," I am so scared for university, because I feel like I will never make it. I just wish I could fast forward to being accepted and spending days studying on campus. "
27," Thank you for the love and advice, Ill try! "
28," Please, if you want to vent to someone, Im here. Im going to sleep now, but Ill respond as soon as I wake up. Im happy to talk with you. "
29," Thats amazing! Good luck! Im in Australia too - one more week of holidays. ): Im going into 10th grade, so anxious. "
30," See? Keep holding onto those little things that make you happy, even if its just for a moment. "
31, Thank you! Wishing you all the best as well. Are you on spring break as well? 
32," Im so scared and exhausted as well. Im about to be in 10th grade, and I already am working at capacity. What will I do? I know that things will just get harder. Its so pointless for someone as worthless as me. I should end it all soon, before this happens. "
33," Dont do it. Prolong the date. Keep persevering, one step at a time. Make yourself do something simple - take a bath, clean your room, make a new playlist, draw a dog. Do little things until you feel more clear minded.

What helps me is keeping suicide as a comforting last resort. You know that if things get too unbearable, you can turn to it, but for now you have to keep fighting through the world. You can do it. "
34," This is so important. Its easy to think that saddening music can be cathartic, but in fact its just detrimental and promotes more anxiety/depression. Try to steer clear of it and consciously select more uplifting music that counteracts your mood. Thank you for this reminder! "
35," Surprisingly, I had an okay day today. It could even be classified as good! I was productive; I crossed several assignments off my to do list. I stayed tidy and neat. I downloaded some organisation printouts to prepare for the next term, and I browsed study-related blogs to regain motivation. I am feeling slightly better about returning to school now, and facing another week.

Im planning to go to sleep, but feel free to vent about your day in the comments, whether it be good or bad. Im happy to hear you out, and Ill respond in the morning. Lets all support each other. I believe in you! "
36, 7 - you have a unique but cute appearance. 
37, Wow. I am speechless. Thank you again. 
38, I hope you do too.  
39, This post brought tears to my eyes. I am so sorry that you are feeling alone. You are obviously a kind and caring person who doesnt deserve that. Try to yourself for being nervous around others - youre trying your best! 
40, No problem. I hope you feel better soon  
41, Thats suicidal ideation. I experience this as well. 
42," Im reading. Im here. You are not a failure, everyone makes mistakes. You deserve life and love and happiness and satisfaction. You are trying your best, so forgive yourself. And please, try not to go. We all want and need you here. You have a future. "
43," Haha, pedantic grammar observers unite! "
44, Good luck! I believe in you! 
45, I feel more alone when Im with others most of the time. 
46, Thank you for this. Your support means so much to me. 
47," This is completely relatable for me, every aspect. I love to write and watercolour, but then I start comparing myself and everything shatters. "
48, Thank you for the correction! 
49," Does anyone else feel similarly? I find it so reassuring to know that if one day the world becomes too unbearable for me, I have an escape route. I'll wake up, write a few notes, and finish the act so that its clean-cut and done. This keeps me going every day. I can always uncap a red pen and circle a date on my calendar if need be. Its in the palm of my hands if I ever see my future crumble too irreparably. I wish I wasnt so close to this point though. "
50, Neither will I. Please keep trying though. Well make it together. 
51," Yes, I agree. The only thing that I hate in my life is self-inflicted - my grades and future. Thats why I hate myself so much.  "
52," Wow, thank you for this. Youre going to make me cry. Thank you so much for the sweet message. "
53," ""Fac ob cetera"" could work
""Do (it) for others"" "
54, Sure! Thank you for reaching out. 
55," Youre welcome. If you ever need to talk, Im here. "
56, Aw that sounds so sweet. Thank you. 
57, Im so sorry. I wholeheartedly wish it was better for you. My emotions are volatile and prone to anxiety and depression as well. You deserve better than this. Sending you love and support. 
58, That sounds promising! 
59," To any of my acquaintances, particularly at school, I am so sorry. I know how horrible I am when I enter an anxious or depressive state. When you touch my shoulder gently to ask if I am okay, I jerk away as if it burns my skin. I wish I could be responsive, answer your questions, plaster on a smile and tell you that yes, Im fine. But all I can do is shake and shuffle away like a useless child, trying not to let hot tears splash on the linoleum floor. I wish I could open up to you, tell you not to think of me. Its not your fault that Im like this. You dont need to check on me, its my fault. The last thing I want is to be a burden to another person.

And if you dont care, if you dont even remember the times that I have cried quietly due to a drop in performance or a poor grade, then I am glad. I dont want to be in anyones thoughts when they should be living their own happy life.

Im so sorry. I wish I didnt exist. "
60, Depression is mainly centered around a sense of self-worthlessness for me. 
61," I feel this way about exams, its terrible ): Im so sorry to hear that you are experiencing this. "
62, Thats amazing. Thank you for sharing your story with me. 
63, Aw ): 
64, Thank you so much for this comprehensive message. Ill take your advice into account! 
65, But you did. Be proud of yourself. 
66," Oh, that could be a good idea! "
67, Im glad that youre still alive. 
68," Would it be through messaging? If so, I think you can set up a chat with many people here on Reddit. "
69, Im 16F and have never done any of those things either. Youre not alone. 
70," Im so sorry. I know its hard, but try to ignore them. Theyre just being rude behind the cover of a screen. "
71, Why do you think so? I agree. ): 
72, Thank you for this. I needed it. 
73," Were in the exact same situation. No one thinks anything of it because ""all teenagers are angsty"". It sucks.  "
74," Whenever it feels right! Maybe not the first date, but after a few if the chemistry is there. "
75, Whats the matter? Why dont you like this sub? 
76," I care. Im here for you, even if its just online. I wish I could give you a warm, reassuring hug. "
77," Oh yes, I didnt consider that. "
78," If you think that will help, do so. One step at a time. Youre doing fine, and you can make it. "
79, Sometimes lower subscribers is better because it gets more exposure - it can get lost in a sea of other posts in high subscriber subreddits. 
80, I hope someone feels this way about me someday - this is the loveliest letter. 
81, The trauma of your death will be so overwhelming either way. Please try to keep pushing the date back week by week until you feel that there is something to live for. 
82," A blender is usually for liquids (smoothies etc) whilst food processor is for more tough objects like vegetables and dough. However, they are usually interchangeable! "
83, Okay. Ill try. 
84," Im not sure, but it might be
The kings seek/initiate wars of passionate glory. 
I think that is wrong though, but cupidi can only be genitive. "
85, Every day. 
86," Do you have any context for the second one? Would ""Bella"" most likely pertain to war or beauty? "
87, 1. The leader made many bridges. 
88," Yep, exactly the same way. "
89," You can. One tiny step at a time. Forgive your failures, be kind to yourself. Another step. Youll get there. "
90," Its hard, because we all live busy lives with so many acquaintances. Of course, we want to look out for them all, but the majority slip through the cracks because we would burn out if we had to do that. If you want the support of your friends, be vocal about it! Try to talk to someone you trust. Im sure that they will be happy to help, and apologetic that they didnt see your suffering earlier. "
91," Im so sorry to hear that, but your response was amazing! Heres to multilingual people.  "
92, Ah okay. Thank you! 
93," Youre not hopeless, youre getting there. Be kind to yourself. "
94, I am as well. ): 
95," Im so sorry. I wish it was better for you. If you ever need someone to talk to, dont hesitate to message me. "
96," Okay. Sometimes Im unaware of a whether they are trying to be a troll or not, though, and I wouldnt want to offend anyone. "
97, I just mean that I envision a future with a romantic partner and love sappy romance novels and movies.  
98," Yes, completely. I dont take naps, but every morning I feel sick with stress Im not even sure why. "
99, Thank you. I hope so. 
100," You mean ""being a romantic""? "
101, I know. The last thing I want to do is hurt or drain someone. Thats why I think I should never get into a relationship - Im drained even being by myself. 
102, I agree. It just drains and hurts them. 
103," Thank you, I really needed this.  "
104, Thats amazing! Im so happy for you. 
105, Exactly. ): 
106, I feel like I will also hurt people. Thats why I feel like I should never get involved. 
107, Okay. Thank you! 
108, What do you mean? 
109, Thank you for the reassurance! 
110, Thank you for this. Your story means a lot to me. 
111, Im so sorry to hear about that. ): 
112, Thank you so much for your uplifting message. It has brightened my mood a little! 
113," This is perfectly accurate for me as well. Its so frustrating to see disappointing percentages after nights of hard work and tears, when your whole life is that grade, and the next, and the next. I barely know what to do anymore. I dont think I can survive the next couple of years, and I dont know if I even want to.  "
114," Aww of course! If you ever need to talk again, dont hesitate to message me. "
115, Dont say that. You do deserve to eat. You are evidently a gorgeous human with a kind and caring heart and a conscientious mind. 
116, Isnt slowness often indicative of pain? 
117," Reading! Whether it be novels, the news, or just magazine clippings, this always inspires me. "
118, This is so adorable. You sound perfect for each other. 
119," Thank you, you are too kind to me. I really needed this. "
120, Oh my - what happened? 
121," I know the feeling - youre not alone, keep persevering  "
122," But Id feel so terrible, even if someone did, for some reason, love me. I would only be a burden for them, draining happiness.
 "
123, Thank you for this! Really made my day.  
124," I wish I was more intelligent. Im 16, and I already have no life ahead of me. "
125," I dont have much time to think of anything beyond schoolwork and the stress that comes along with it, but when I do, I often let my mind wander to a perfect, but likely impossible, future. I think I am a romantic, though I dont show that side of myself very often. Im constantly swamped with academic-related tasks and lengthy to-do lists, so thats all people see of me. I am a teenager, and do not want to find someone now - I only know approximately three boys in total, as my school is not co-ed. I barely know how to act around them, even though I dont ""like them"".

But then my thoughts darken. Why would anyone ever choose to love me? I dont think that it will ever happen. If I was someone else, I wouldnt even choose to be friends with me. Besides the fact that I have anxiety, mild depression and suicidal ideation, I am constantly stressed and appear downtrodden all day. Im probably a pain to be around due to my overall gloomy mood (though I can be cheerful at times). I think that I will have little hope for a romantic relationship later in life. This just adds to the many factors that are contributing to my already-crumbling future, as I have posted about before.

Though, now that I think of it, I would be happy to be in a relationship with someone who is suffering mental issues. But maybe this is only because I battle with them myself.

Sorry for this sappy, stupid post. I just wanted to collect my thoughts somewhere. Thank you for reading, if you made it this far. "
126, This is so adorable and sweet. 
127," Hi! Id love to talk every now and then throughout the day. Im Elsa, 16F, and I love reading, writing, ancient history, linguistics (particularly French and Latin focused), and art journaling. If you want to be friends, please feel free to message me! If not, dont feel at all obligated. Have a lovely day. "
128," Youre not alone, I swing from emotion to emotion wildly as well. "
129, This is so sweet and romantic. I wish someone could feel this way about me someday. Im sure that he/she doesnt hate you! 
130," I feel like even if it was a 50% acceptance rate, I wouldnt get in. Its particularly sad because I wish fervently to go somewhere like Oxford or UC Berkeley, but thats impossible. Sorry for ranting to you. "
131," Aw that sucks. Youre not an awful person though, try to be kind to yourself. "
132, Whats on your mind? Im sorry that you feel this way. ): 
133, I feel the exact same way. I really hate myself. ): 
134," Oh my goodness. Im so sorry to hear this story. I really wish I could help more, but I dont even know what to say. I wish I could be there to give you a hug and tell you that youre doing well. Keep persevering. "
135," Completely. I used to be intelligent, happy, and getting perfect grades. Now I am a sobbing wreck in all three departments. "
136," I feel like the messaging is unnecessary. Its a more clunky system, and chats are easier! "
137, You will find somebody! You are clearly sweet and caring. 
138," Yes - maybe making it casual like that will help. If youre feeling nervous, maybe text her in advance letting her know that you want to talk about something on that day! "
139," Youre not awful. You deserve happiness. I know how hard it can get, but you have to keep persevering and try to be kind to yourself. One step at a time. "
140, It depends on how comfortable you are with that person. Do you feel apprehension about approaching them in person? 
141," I want desperately to go to university, but Ill never be accepted. Its useless. "
142," Of course, Ill message you momentarily. "
143," I can tell that you are loveable. You are evidently introspective and conscientious, as you have opened up and thought about your life. You are worthy of someone lovely. "
144, A romantic companion? 
145, I am so sorry to hear this. Whats on your mind? What is making you feel this way? 
146, Exactly. I agree with this completely - I wish the world was not like this. 
147, Thank you for this. 
148, Whats going on in your life that makes it not worth living? 
149, Thank you  
150, Thank you - Ill try! 
151," Yes, exactly. Its so comforting. "
152, This is so strangely calming. I think Im going to set a date soon as well.  
153," Please dont. You deserve life. You are capable of making an amazing future for yourself.
Dont be angry with yourself because you cant go through with it. "
154, Thank you for this. 
155," But isnt everyone suffering? Everyone is stressed, so it seems. And theyre doing fine without therapy. "
156," My parents are making me go to therapy again. Why does this have to happen? Everyone is stressed in high school. Im not special, and I dont deserve a moment of special treatment. Im just an annoying, anxious high school student with low intelligence and no future. Everyone is nervous about exams et cetera. I dont want this, or let alone deserve it. "
157, Im so glad I can help. Sending lots of love  
158, Sounds lovely! 
159, I know ): its always in the back of my mind 
160, Thats amazing! Congratulations! 
161," Not at all. I dont even know who I am when I snap at people, and I feel so disgusting afterwards.  "
162," I feel like you are excusing internally rude behaviour. Dont look down on others. If intelligence is the one factor that dictates your relationships, then work on making others gradually smarter by not ""dumbing yourself down"" for them, and expanding their knowledge in a conscientious way. "
163, That all sounds good. I agree with this person.  
164, Yep. 
165," God, they sound like horrible people to judge you so ruthlessly at a moments notice. Try your best to ignore them, and keep working hard and developing skills. Take your time, and youll get there! "
166, Wow! That is incredible! Im so happy for you. What kind of business is it? 
167," Keep the idea of suicide as the last resort in your mind. This is actually quite comforting for me, as I know its always an option. Once that is accepted, focus on taking it one step at a time, trying to appreciate each small thing in life. One day, hour, and moment at a time. Stay busy, see friends, remain clean and tidy, and be as kind as you can to yourself. "
168," I dont think approaching a girl randomly is the best - I would become uncomfortable. Try to go places where people who are passionate about similar things are, if that makes sense. For example, maybe if you love to read, meet someone in a bookshop. However, most things will work as long as you are friendly and caring, which you seem to be. Take it slowly, but be there for them. "
169," Youre sweet looking! You have a handsome appearance with a friendly, warm smile. "
170, Thank you for the response! 
171," Youre absolutely not a waste of time. You dont need to feel obligated to help anyone - you deserve to be cared for, and you dont need to repay anyone for that. I can tell that you are a lovely person, even though you are suffering right now.

Its quite late here in Australia, so Im going to try to get some sleep, but please message me if you would like to and well talk soon. If not, thats fine - just know Im always here if you need someone.  "
172," Yes, maybe ): "
173, Me too. Im 16 and feel the exact same way. 
174," I know how easy it is to be so harsh with yourself for mistakes and lack of strength, but please try to forgive yourself. You are facing a precipice of adversity due to your mental health, and you are evidently trying your best. Every step is progress, and you were so close. All you have to do is try again next time. Even if it doesnt work, youre getting there. You are a good person. You can make it through this. "
175, Why are you unsubscribing? Sometimes it is good to escape the negativity - you dont want to burden yourself with the pain of others. Whats on your mind? 
176," But youve had times where you are okay. Theoretically, you can then have good times again. Take it one step at a time, and allow yourself to breathe. Try to forgive yourself for shortcomings, and keep progressing until you reach another stretch of happiness.  "
177," I agree that some people may do this with selfish intentions, but the problem is that those people make anyone who comments encouraging messages seem insincere. Things can be misconstrued through text, so try not to write someone off just because theyre attempting to be caring. Many people dont know what to say, but dont want anyone to get hurt or die.

I agree with your overall point though - thank you for sharing this! "
178, You can do it. One step at a time. Breathe. Youll make it. 
179, Please dont. I dont want you to die. You deserve to live. You are a good person who has he ability to create a lovely existence despite the storm you are in now. 
180, Thank you. I hope you do as well. 
181, ): 
182," Youre very attractive! You have a great facial structure, and you look sweet and approachable. "
183, Thank you. I hope youre okay too. 
184, I know exactly what you mean ): 
185," It sounds so nice. Waking up early, making a cup of tea, and sitting down to write some goodbye notes. Just simple and sweet, to let them know I care, and give them and myself some closure. Then clean my room spotless - wipe down the windows and rearrange my books, launder my sheets and remake the bed. Put some flowers in a vase, spray some perfume, leave. Take a bus to the cliffs with whirling winds, climb over the simple wooden fence, and stand on the mossy sandstone slabs looking at the ocean. Then, Id jump, let my body go limp, and end this life. Hit the waves and sink so that Im wiped clean from the world. It sounds so nice. "
186," Out of the blue, I feel rushes of stress and anxiety, and whilst I can sometimes attribute it to a certain cause, there are many times where I am a left worrying about nothing. Its so frustrating. Why am I so anxious? What am I anxious about??

Does this happen to anyone else? "
187, Not so good. Depression is creeping back in along with anxiety. 
188, I know what you mean ): 
189," No - everything right now is academic focused. My dreams include attending an excellent university and achieving a linguistics-related career, but that all seems impossible. "
190, Mine too  
