,post
370, Of course. I hope that it turns out to be a positive one! 
371," Thank you so much - youre so kind. Its the same for you - if you ever need to talk, Im here for you.  "
372, Keep trying. Im sure they still care about you. 
373," I cant explain how much this message means to me. Thank you. Thank you for taking the time to write it.

Im willing to put in the work to get where I want to be in the future - I will definitely try some of the language-related extension ideas that you have provided.

Thank you again, for the encouragement and new perspective. It has made me feel so much better. "
374," Okay, yay.  "
375," I know exactly how you feel. Im so sorry to hear about the job - keep persevering. Youll make it, i believe in you "
376, Thats exactly how I feel. I dont know what to do either. |: 
377," Please dont go. Hold on a little longer. You are an asset to the world, and we need you. "
378," I know its not much, but I can be your friend, even if its only online. I believe in you.  "
379," Im so, so sorry. It hurts to feel forgotten, but youll get through it. I know it doesnt help much, but Im here for you if you ever want to talk. Sending you lots of love  "
380," Yes, I feel exactly this way "
381," Please keep persevering. I know it seems hopeless right now, but there are always other ways. I believe in you. I know that you can make an amazing life for yourself despite your grades. You deserve it. "
382, I relate so much to this ): 
383, This is not your fault. I am so sorry to hear about that situation - just know you did nothing wrong.  
384," I know how that feels - I have anxiety and mild depression as well. But just know, youre not a burden. Im happy to support you and listen to whatever it is you want to say.  "
385," I am so, so sorry to hear about your situation. I wish it was better for you - I wish I could help more, for now, all I can offer is my support. If you want to chat, Im here for you. (16F)  "
386," Im so sorry that you feel this way. Im here for you, sending love and support. If you ever need to chat, let me know.  "
387," Hi, Im here if you need to talk.  "
388,  
389, Im 16  
390, How old are you? 
391, Im here if you want to chat anytime. 
392, You are not a monster. You deserve all the love in the world.  
393," I know. But I assure you, you are so loving and caring - there will be someone for you. You just have to find them.  "
394," If you can, try to find a job. It doesnt have to be amazing, just something to start. Keep saving up until you can get a better job with the experience youve got. You can do it! "
395, You are not ugly. I know that you are not. Dont beat yourself up for how you perceive yourself.  
396, Agreed completely.  
397," This is so sweet and romantic. I know exactly how you feel. I guarantee that you will find an amazing person, just from the personality that I can see you have through this comment. You are obviously caring and conscientious and kind, and someone will adore you and want to spend every day with you. Dont lose hope  "
398, Do you have a job currently? 
399, Its not your fault and you must not be guilty for it. I believe in you.  
400, Thank you so much for this  
401," Dont apologise, its okay. Im sure theres something you want to accomplish. You need to find something that makes you excited to live, even if its just a flower or a genre of book or anything to get you by. Create your perfect life. Whats stopping you? "
402," Im a bit younger than you, but I still relate completely. I cant really offer advice, but just know that Im here for you. Keep trying, keep making changes until your happy. I believe in you. "
403," Please reconsider. You deserve an amazing life. Please, please keep persevering. "
404," Please, please dont kill yourself. I know it seems absolutely hopeless, but you have a whole life in front of you. If you hate your own life so much, start over. Save up, move away, build a life that youd rather have. I believe in you - I have full faith in you. You can do this. You can persevere. Im here if you need to talk. "
405," Youre not alone. I care about you, and Im here for you. Message me if you want to chat or if you feel lonely - youre going to be okay, and I believe in you.  "
406," Yay, keep pushing forward! Youre doing great so far.  "
407," I think you have to accept that these things are part of your life instead of fighting against that and wish it wasnt true. These things have shaped who you are today, even though they were absolutely terrible. Youre caring and intelligent and worthy of an amazing life- youve just got to try to move on. Youre doing well so far  "
408," Please, please dont cut. Your body is beautiful. Just think of everything you can do with it - breathe, hold hands with someone, run. You deserve to take care of yourself. You are strong, and I believe in you. Keep persevering, and be kind to yourself.  "
409," Yeah. If you ever need to talk, Im happy to chat.  "
410, I feel exactly the same way - particularly with the grades and everything. I wish I could just get a clean slate. 
411," Im not sick of you - Im here for you. Im so sorry that you are feeling this way. Youre going to be alright, and I believe in you. Im here if you ever need to talk. "
412, Aww this is so cute!! 
413," So sorry to hear that youre feeling this way. Im happy to talk whenever you need it. Dont feel guilty for not being productive - we all have those days, and depressive thoughts make it very difficult. Sending love your way  "
414," Hey, Im here if you ever want to chat. It is amazing that you are able to open up like that - I hope youre doing okay. Wishing you all the best. "
415, I care about how you feel. I relate to this so much. Hope youre doing okay.  
416," Please stay strong. I know its not much, but Im here if you need to talk to someone. I believe in you. "
417," Its going to be alright. Even though everything seems hopeless, things will turn around for you. Dont worry about the rejection, it happens to everyone - you will be absolutely adored by someone in the future. "
418," Sorry to hear that youre feeling that way. ): If you ever want to talk, Im here  "
419, You deserve to live. You are obviously caring and conscientious and intelligent. You are an asset to the world and would be missed. Please try to keep persevering. 
420," Please keep persevering. I believe in you. You are strong and intelligent and loving, and you can do it. I know its not much, but Im here if you ever want to talk.  "
421," Im so sorry ): I hope you can feel better soon. If you ever need to talk, Im here  "
422, Im so sorry youre feeling this way. I hope it gets better for you soon. Im here for you if you want to talk.  
423," Agreed. My depression does manifest in my expression though - Im bad at hiding my feelings, which is something I hate about myself. When it kicks in, I get quiet and distant, and inside my head is in turmoil.  "
424," I would absolutely love that too. That would be a dream. But for now, we just have to get through it on our own. I believe in you  "
425," Youre not alone. I know its just online, but Id love to be your friend. I believe in you. "
426, Thank you for this  
427," Thats terrible. ): If you really cant stay home, try to make it through the school day - itll be over be for you know it. Then go home and let yourself relax. You deserve it! "
428," Please please dont end your life. You deserve love and happiness. You are an amazing person. I know it doesnt help very much, but Im here for you if you ever want to chat. "
429, Dont say that. You deserve an amazing life of happiness. Are there any changes you could make to improve your life? 
430," Give yourself a day off. Relax, reset, take care. Clean your room, pamper yourself, read a book. Care for your mental health. Im so sorry that youre having a bad day ): "
431," Youre human, and youre allowed to make mistakes. You are not worthless or a failure. I know its not much consolation, but Im here for you.  "
432, You can do it! Stay strong and try your best. You are completely capable. 
433, Its not stupid. Your feelings are valid. Are you doing okay? Im here to talk if you would like to.  
434, Thats terrible. You dont deserve it at all ): I hope that all of your future dreams come true  
435, What are you passionate about? What does your perfect life look like? 
436, Thank you so much. It means a lot to me 
437," Aww ): I know how that feels, but youve got to keep going. You can do it! "
438, Please dont. I believe in you. You can make it through this!! 
439, Thanks  
440," I know its not much, but just know Im here for you and I support you. If you need to talk, Im here. "
441," Really? Wow. Thats encouraging to know, thank you.
I tried the school councillor but she didnt help at all. "
442," Im so sorry. I know it seems hopeless right now, but I have full faith in you. Im here if you ever need to talk.  "
443, I hope youre doing okay. Im here if you ever need to chat  
444," I know. And my peers come over trying to help and I cant even breathe so I just act really cold and dont say anything. I feel so bad, I obviously am being so rude, but i cant help it. It just makes me hate myself more. "
445," Yeah, I relate to that completely. I hope you have an amazing future  "
446," Please dont give up! Hold onto that passion and keep writing, even if it sucks. Youll find yourself again. Dont give up. "
447," Please hold onto that will to live and keep going. I believe in you. Make changes in your life, make yourself happy. You are capable of it.  "
448," You absolutely deserve to post here. Any kind of pain is valid, and were here to help. Sending love your way - message me if you ever need to chat.  "
449," Yay, good luck  "
450," Thank you so much for the advice. Im in Australia actually - we have curriculum based tests, the HSC and IB. I just feel like if they see a bad mark theyll reject me point blank. "
451," Aw thats good. Keep it up, you can do it  "
452," My dreams for the future. Even when they seem impossible, I cant bring myself to kill my self because I want so desperately to go to university and have an amazing job in linguistics. I know it will never happen, but it keeps me going. "
453," Aww, Im sorry. ): but Im here if you ever need to chat more. Wishing you all the best.  "
454, I know exactly how you feel. Its so terrifying - life petrifies me. But well make it though. Keep persevering. I have full faith in you. Sending love  
455," This sounds like a terrible situation. I know it seems like everything in life is working against you, but I have full faith in you. You can get back on track. Keep applying for jobs until you get an okay one. Work as hard as you can, save up, get a better job. When you can, move to the UK and pursue your dream.
Youre not a failure. Youre so strong for getting this far already, and you are obviously very hardworking. You can do this. I believe in you! Sending so much love. 
Dont lose hope yet. "
456, For any specific reason?  
457, Good luck  
458," I was crying while reading this post - I am so, so sorry that you are feeling this way. I wish I could make it better - I wish I could be there and bake you a lovely cake and give you a hug and support. Unfortunate, all I can offer is someone to talk to if you want it. Im here for you. Sending love your way, I hope that you feel it soon.  "
459," I think you should do number 2, if its safe and will make you happier. You can always make changes to improve your life later! "
460," This sounds terrible. Im so sorry that youre feeling this way. I wish I could make it better for you - if it helps at all, Im here if you ever need to chat. Sending love and support your way  "
461, So sorry youre feeling this way. We all believe in you - stay strong and persevere. I have full faith in you. 
462," (16F) University is my impossible dream. I want so desperately to be accepted somewhere excellent, like Oxford University. I want to be able to stroll around a beautiful campus on an overcast day, and to study for hours in an old library, and to excel in my courses, engaged in interesting content. I want to continue learning about linguistics, studying English, French, and Latin as well as etymology and writing.

But I still have another two years of school, and this dream seems absolutely unachievable. How could I get into university? Why would I ever be chosen over another person... a brighter, happier, more promising and intelligent person who has received awards and perfect grades? The answer is, I wouldnt. I spend all my life studying and working, but with no results except anxiety, depression and suicidal ideation. Anything below 100% feels like failure. 

Last week, I received my first C. It feels like someone has torn my heart out with bare hands and left me empty and useless. I know that this is probably trivial in comparison to others lives, but to me, it feels like the world is crumbling. I have absolutely no shot at furthering my education. I dont even deserve to, due to my utter lack of intelligence. I cant even explain how much I hate myself. I have no future.

If you have a few moments and you have gone to university... could you please explain to me what the admission process was like? From my standpoint, it seems like a hopeless, impossible gauntlet for a worthless student like me. I cant imagine ever being admitted, and it crushes me to think about every day. Im so sorry for being unbearably whiny and dramatic. "
463, I relate to this completely ): 
464," I know how youre feeling, and Im so sorry that it has to be like this. If you ever need to talk, Im here. Sending as much love as possible.  "
465, Please dont. I believe in you. 
466," Yes, i relate to this completely. Im not mapping out a detailed plan and circling a date on my calendar, Im just thinking about it and casually considering it. "
467, No problem. Im here if you ever need to talk  
468," Maybe youre not giving yourself enough credit for how amazing you are. Youve obviously gotten her attention, and you deserve that! "
469," Just be yourself - be kind and loving and cheerful. Talk to people, or message them online to start. Just from this, I can see how sweet and caring and interesting you are. Im sure that you will find some good friends soon. Wishing you all the best  "
470," I hope youre doing okay. There is nothing wrong with letting your thoughts out - its good. Youre going to get through this, I have full faith in you. "
471," Dont say she is better than you in every way. Youre probably different, but with your own lovely idiosyncrasies that make you interesting. She wouldnt show interest in you for nothing! "
472," Why do you think she might lose interest in you? You seem like an interesting person who is worth getting to know - dont doubt yourself. Even if she isnt the perfect person for you, there will be others. I believe in you. "
473," You are not pathetic or weak for needing support . That is completely valid and normal. We are all here for you, and youre not a burden at all. If you died, no one would breathe a sigh of relief. Everyone you know would long for you to be back, wondering what they did wrong to make you go. Please keep persevering! "
474," Take a deep breath, its going to be okay. You need to slowly start finding things in life that make it worth living - the cool autumn breeze, your pet, the light shining through windows in the afternoon. Accumulate these little things so that you can start to feel more grounded again. If you need a change of pace, consider a short vacation if you can. I believe in you - you can most definitely do this and make it through. "
475," Me too. ): But we have to keep pushing through until life turns around, because you never know whats coming.  "
476," Someone will love you completely, and you deserve that. You seem introspective and conscientious just from this message, and Im sure that girl saw something in you. Dont lose hope.  "
477, What are you struggling with? 
478, I feel the same way - Im 16. ): 
479," Please, please keep considering. Your children will be irreparably broken, and your husband will miss you too much to bear. Please try to keep persevering.  "
480," Aw, no problem. I hope we both feel better soon  "
481, That sounds great! Keep it up. (: 
482, Thank you so much! I hope that you feel better soon.  
483," Id be happy to send you a message whenever I can - I cant guarantee every day, but we could talk whenever you wanted to. "
484, I know how you feel. ): its terrible when it feels like nothing works to get you out of a rut. 
485," Its going to be okay. 
1. Acne doesnt define you, and you cant really control it, so lets put that aside for now.
2. Im so sorry to hear about your OCD - are you speaking to professionals about it? Im sure youre trying your best. (:
3. Volunteering is a great way to spend your time! Is it making you any happier? "
486," Okay, thats a good start. Could you schedule anything nice in the next few days to look forward to before your doctors appointment?

The lifeline is always a good backup. "
487," Agreed. I think they just want the best because theyre worried that we arent happy, but it just comes across in a horrible way. "
488," Maybe you need a change of pace. Is there any opportunity to go on vacation soon? If not, find a friend whos vivacious and cheerful and just explore the city with them. Maybe their demeanour will inspire you! "
489, Yes exactly. I feel like this invalidates my depression so people think Im fine ): 
490," Im not sure if this will help anyone, but if you need to vent, feel welcome to do so in a comment on this post. I am happy to just listen to whats going on in your life, or give advice if you want it. I am currently experiencing anxiety, mild depression and suicidal ideation.

Youre going to be okay, and I have faith in you. Lets get though this together! "
491," Youre not hopeless. You are so strong for making it so far, and you can continue to persevere. I believe in you fully - you are amazing and capable. Here if you need to talk more "
492, My mum always gets mad at me for being sad or in a bad mood and that makes me feel like sobbing in a tiny ball. I wish people would understand 
493," Im so sorry that you feel this way. I am stricken with fear about the IB (though I may take the HSC, which is equally terrifying). Im just too unintelligent to make it through high school - Im so weak. I think I have to die before Year 11 begins. ): sorry for the vent "
494, Yay good for you! Keep it up! 
495, Thats exactly what I was wondering. I hope it does get easier. 
496," You can do it. Stay strong, and take it one minute at a time. Best of luck!
Message me if you need to vent more. (: "
497, Youre going to do an amazing job. I believe in you! 
498, Best of luck!! 
499," Please try not to harm yourself. Think about all the beautiful aspects of your body, and what it can do. All the organs and systems working together in intricate, complex ways to allow you to live. Take care of yourself. 

In terms of the depression - I am so sorry that youre feeling that way. All you can do is keep going and try to make little positive changes along the way. I believe in you. Lots of love! "
500," Yep, feel that way almost every day. ): "
501," Just keep pushing through. Count down the days, work hard, and give yourself time to relax. Youre so close - think about how youll feel when youre done! "
502, Good for you. Keep up the amazing work!! 
503," Theres nothing you can do now to reverse it, so I think you should just continue being friendly to those people, even if theyre mean to you. Smile at them and move on. Stay close to the friend who remained loyal to you. I believe in you - keep up the good work  "
504, Whats going on in your life that makes you feel this way? 
505, I feel the same way. Its totally exhausting and draining. 
506," Please try to hold on. You can turn your life around, make it new and exciting. Sending you love  "
507, No problem. Im here if you need to talk.  
508, You still ok? 
509," Yes, completely relate to this. I cant stand school anymore - Im not going to make it through the next couple of years. ): "
510," Yes, me too ): "
511, Here for you if you want to talk. Sending you lots of love! 
512, I feel the same way. I am so scared to finish high school because I have no future ): 
513," I feel the same way. Unfortunately, life really sucks sometimes, but youve just got to keep pushing through and persevering until it gets better. If you want to talk, Im here. "
514, So sorry to hear youre feeling this way. Im here if you need to talk  
515," Everyone makes mistakes. What you did was wrong, but you should be forgiven for it. Continuously apologise to her, and just stay quiet until it blows over. I promise that youll get through this. Just be kind and unobtrusive until people forget! "
516, Okay. Keep it up  
517, Me too ): 
518, Try your best to open up to your friend a little to make you feel better. How long until you meet up? 
519, Oh no! Should you go to the doctor soon? 
520," So sorry to hear that youre feeling this way. If it helps at all, you can message me anytime and just talk. Sending you lots of love.  "
521, That sounds like a good plan. And youre welcome - Im happy to talk to you for as long as you need! Is there anything else on your mind you want to vent about? 
522, Thats a good idea. You can do it! 
523," Im so sorry to hear about this situation. Wishing him all the best. If you need to talk, Im here.  "
524," If it will make you feel better, allow yourself a day off to recharge. Your mental health is important! "
525, No problem (: Im here if you ever need to chat more 
526, Thats incredible! I used to play guitar - now I play the clarinet. 
527, Thats amazing! Do you play any instruments? 
528," I havent experienced a situation as severe as yours, but I do have anxiety, depression and suicidal ideation. I think that you should try to get a job. Start with something simple and build up from there. Keep going until you find one you love. Connect with new friends and allow yourself to be social again. Sending lots of love your way, i believe in you! "
529, I think thats pretty normal. Keep distracting yourself until you feel better! 
530, What did your father want you to be? 
531," I think thats what makes a person interesting - so many of my friends just want to follow their parents life paths, but I think its more gratifying to choose your own. "
532," Its alright. Take a deep breath. It sounds like you may just be experiencing anxiety or a panic attack, though Im no expert  "
533," Yes, try to avoid alcohol. Do you like to read? Listen to music? Draw? Just anything to keep your mind occupied. I dont mind continuing to talk to you either. "
534, No problem. Youre welcome to message me if you need anything else. 
535, Okay. Wishing you all the best  
536, You can do it. Just 3 more hours. Is there something fun youd like to do? 
537," Hello - so sorry to hear youre feeling this way. Im a 16 year old girl whos been struggling with anxiety/depression/suicidal ideation for a while now, and what your describing could be actually anxiety, or just stress due to a specific situation. Have you been nervous about something recently? Sending lots of love your way.  "
538," Okay so I kind of involuntarily started fresh. My dads job sent my family back to Australia (where I was born), and this actually kickstarted my anxiety / depression / suicidal ideation because I hate my school. Its different for everyone though. "
539, Keeping up with trends does not make you interesting. You are interesting because you are different! I would much rather be friends with you than the people you are describing. 
540, Thank you for this. 
541," Im so sorry to hear that you are feeling this way. If its any consolation, I believe in you - Im here if you want to talk. Sending lots of love  "
542, I know that you can persevere and make it through.  
543," Thats not true at all. Your mental health is incredibly important, and its not just that you cant take stress. You are going through a lot, but youre doing well so far. "
544," Aw, why? Im sure youll do great! It will be so interesting "
545, Wow thats great! What course are you taking? 
546, Thats so great though. One step at a time (: 
547," Okay, sure.  coming from someone with mild depression, i know how hard it is for you. To beat depression temporarily and avoid procrastination, you have to force yourself to just start. Start planning, start studying, start that essay. Once you get past that, it wont be as difficult. Keep going for as long as you can bear it, and then give yourself a nice break. Walk around, eat, drink. Repeat until the work is done. I believe in you completely!
Is there anything else specific that youre having trouble with rn? "
548, What are some good things about your life right now? 
549, Of course I can. Sorry I was gone for a few minutes. 
550, Im sure you can. Keep persevering and youll make it. 
551, Okay. Take care of yourself  
552, Im so glad. It makes me feel better too.  
553, Whats on your mind now? 
554," Okay. Leave the lifeline as a last resort, but dont dismiss it completely. For now, why dont you try switching up your environment? Go on a walk, take a bus somewhere? "
555, Are you talking to me or the person who posted? Its only 7pm here in Australia. (: 
556," Occupy yourself with something you like, just for the next couple hours. Maybe cleaning, or TV, or a good book. Go outside and enjoy the fresh air. Anything to get your mind off of suicide. "
557," You are not disturbed. I have depression, anxiety, and suicidal ideation as well- you are just going through a difficult time. But you will get though it. Im here if you want to vent to someone. Lots of love  "
