,post
558," Maybe call someone and get them to come over. Try to just have fun with them and let the feelings pass for now. If you dont want to do that, Im here for you. Feel welcome to vent to me, I dont mind. Sending you lots of love and support.  "
559," If its any comfort, know that we are all here for yo. You arent alone in your pain - we can all share the burden. Just take it one step at a time for now. "
560, I know exactly how you feel. I hate when people without depression/anxiety/suicidal ideation try to help and then blame us for the way we feel. 
561," I know it isnt a joke - what youre feeling is very real and valid. I think that you need to get out of your own head. Can you go to a park, or a little forest near you? Just to clear your head and give yourself a break. For me, it really helps to get out of a toxic environment. "
562," To cope in the mornings, I force myself to get up and take a nice shower. I try to clear my mind of thoughts and just enjoy the hot water. Next, I open my blinds and windows and let the fresh air in while I tidy my room. These little things make me feel like I have a grip on life, so maybe theyll help you too. Wishing you all the best  "
563, Youre going to be alright. I believe in you! Would you like tips on dealing with depression or procrastination? 
564, Why do you think that you feel this way? 
565," Thats not the answer. First of all, youre not going to die alone. There will be someone who will absolutely adore you for just being you, and when you find that person, you will be so glad that you did not kill your self. Secondly, I know that depression sucks. Its a dark cloud over my life too. But it can be dealt with, and it can get better. You can do this! "
566, I know exactly how you feel. It really sucks. Just know that you will get through it - I believe in you. 
567, Sending love and support your way  Im here if you want to chat. 
568, Its alright. Whats the matter? Take a deep breath.  
569, Please please dont kill yourself. Im here for you to talk to if you want. Sending you so much love - youll get through this. You can do it. I believe in you. 
570," Im so sorry that you are feeling this way. I cant really offer advice, but if it helps, Im here for you. Please message me if you want to talk. Sending you so much love and support  "
571, Id love to chat  
572," Hey. I feel the exact same way, particularly about the struggles with school and grades. Im so sorry to hear that youre feeling this way - sending you love and support. If you want to chat, Im here for you. Im a 16 year old girl.  "
573," Youre going to be loved. Just the fact that you are conscientious and introspective proves that. Looks honestly do not matter, and Im sure that you are handsome anyway. Dont lose hope. "
574, Id love to chat.  
575," Im a failure at 15 and I dont even know what to do. Just keep persevering, I believe in you. Sending so much love your way.  "
576," Im so sorry to hear that youre feeling this way. If it helps at all, Im here for you. Message me if you ever want to talk. Sending you so much love  "
577, Whats the matter? Im here for you. 
578," Please dont kill yourself. I know that everything  seems pointless and useless right now, but it will get better. Prolong that date. Keep prolonging it until you dont have to anymore because you love your life. I believe in you. "
579, Im so sorry to hear youre feeling this way. Could you make any dramatic changes that might make you feel like you have a promising new life? I believe in you. 
580," Good for you. Keep it up, we all believe in you!! "
581," I hope youre doing okay. You deserve the world - keep persevering through your thoughts and feelings and someday things will turn around for you. If you want to talk, Im here  "
582," Its going to be okay. Do you want to vent to someone? If so, Im here. Sending you so much love and support.  "
583," Its going to be alright. Take a deep breath. If it helps at all, Im here for you. Im happy to talk with you - you can vent whenever you would like to.  Lots of love  "
584," Hmm, maybe. Hope youre doing okay though  "
585," Yes, definitely. A lot of the time, however, the anxiety continues out of the shower. I just hate how Im alone with my thoughts during that time. "
586," Okay, good luck. Feel welcome to message me if you ever need to talk more. "
587, When is your next vacation? Make sure that school is not overwhelming your health. Give yourself at least an hour each day to just unwind and regain control. I believe in you  
588," Im so sorry to hear that you are feeling this way. If it helps at all, Im here if you want to vent to someone. Wishing you all the best.  "
589, Read. Pick up some autobiographies from photographers and read articles online until you feel fired up and ready to pursue your dreams with all of your might. I believe in you- you are amazing.  
590," Yeah, its difficult. Maybe try writing it all out first and get that burden off of your mind. You can still keep some things private, but it may be good to let your loved ones know whats happening generally so that they can better support you.  "
591," Yeah I feel exactly that way. But I guess all we can do it take what we have and make the best of it. You can only control some things in life, and the rest you just have to let go of. Im heading to a lesson right now, but Ill message you later. Stay strong  "
592," Its okay. I know it seems impossible right now, but its very good to just vent as you are doing. This might not help you, but try it if you would like to: grab a pen and write down everything thats bothering you. Just let your mind flow onto the paper. Then go back through and cross off things that you cant control, and make plans on how to work on the other stuff. Youre going to be okay. Youre not dumb or a burden to your family. You are amazing.  "
593, Youre not just a temporary person. Why dont you grab hold of your life and make the most of it? Use your passions and talents and build a future. You can do it 
594," Yes, I am as well. If i told my mum what I think about, shed burst into tears, Im sure. Just know that youre going to be okay and theres nothing wrong with feeling the way that you do. "
595," I feel exactly the same way, but just remember that you will make it though this. I believe in you. Hold onto what you have left of your motivation and push through college. "
596," I feel basically the exact same way. With everything I do I feel like theres no point because Ill be gone soon, hopefully. But yes, I still have the burning wish to do well and go to university and get an excellent job. But all those things just seem so out of reach.  "
597," Well, just start with the little things. Try to appreciate the smallest elements of your life that make you happy, like a sunny day or your pet. Youre going to make it! "
598," I dont know exactly what this is, but I know that 1) its not your fault and 2) you must not beat yourself up about it. You are doing your best and you deserve the world. Stay strong  "
599," I feel exactly the same way. I used to be a perfect student - stressed, but not in a debilitating way. Now I have to rock myself in a ball until I stop crying after studying for hours every night. I can barely function during the school year, and I dont know what Ill do for the next two years.

Was there something In particular that you think caused the dip in your school performance? "
600," Im sure you are loved, even if you dont realise it. What would make you happiest? "
601, Thank you so much again for taking the time out of your day to leave such supportive messages. This means the world to me.  
602," If it helps at all, Id love to be your friend, even though its just online. Im happy to hear you vent. I dont mind at all. If you do want to talk, Im here. 
Lots of love  "
603," What would your perfect life look like, if you could start over? "
604, Definitely lean into the side of yourself that wants to get help. Hold onto that hope to pull yourself out of this and make an amazing life for yourself. You deserve it  
605, Dont kill yourself. You will be missed. Here for you if you want to chat. 
606," I dont really know what to say other than Im here for you. Make a list of what your perfect life would look like, and spend every day trying to work towards that. Sending love  "
607," I agree with the going back to the old me. I cant even remember what it was like to be truly happy. I mean, I laugh from time to time but besides that Im just a depressed, anxious mess. "
608," If it helps at all, Im here to talk. Id love to be your friend, even if its just online. "
609, Im sure you do. You are amazing. sending love  
610," Its going to be okay. Depression is not your fault, and you are more than that. You will make it through this. Is there anything specific going on thats making you feel this way, or is it just general?  "
611," I cant deal with school anymore either, but please stay. Please dont kill yourself. "
612, What would your perfect life look like? 
613, Me too. I feel like Im my happy moments invalidate my depression. Maybe I dont even have it. 
614, I feel the exact same way. Here if you need to talk. ): 
615, Wishing you all the best - I hope youre okay. Suicide isnt the best option - you never know when your dream partner or dream job may come up. Life is unexpected.  
616, Yay! Keep it up!  
617," Me too. Ill die if someone finds it. No one really knows about my suicidal thoughts, depression, and anxiety. "
618, Id love to.  
619, Whats the matter?  
620, Hope youre doing okay. Im here if you need to talk. I feel the same way - the thought of actually killing myself fills me with such anxiety. 
621," Language related subjects are my favourite - latin, french, english. My hobbies are watercolouring and writing articles.  "
622, Hope youre doing okay sending lots of love - im here if you want to talk. 
623, Thank you for this  
624," Im 15 as well, and I am also absolutely miserable. I dont think its necessarily normal, but its not uncommon. Im here for you if you need to talk  "
625, Me too. They dont know I am suicidal and depressed and they just think Im being rude. I hate myself 
626, Thank you for this moving post. It brought me to tears 
627," Sorry to hear that. Just remember, some people suck and its not your fault. Just move on and try your best  "
628," Me too. I cry about everything and care too much about everything, which leaves me burnt out and drained. "
629, Im so sorry to hear this. Sending you as much love as possible  Im here if you need to talk. 
630," Yep, completely. I can be laughing with my family one minute, and the next im swallowed by suicidal ideation and depression and anxiety. I barely know what to do because my moments of happiness make it seem like Im okay, so no one takes notice. "
631," I feel exactly the same. I am in Year 10, and whenever I see the year 12 girls glowing with pride and excitement I feel sick. I know Ill never be like that, Ill be an unintelligent failure all my life. "
632," Im so sorry. You seem like such a kind person, I hate to hear that you are a loner. I would love to be your friend. Dont give up yet. "
633, Yeah same. Just looking into 11th and 12th grade makes me feel sick with stress. 
634, What grade are you in? 
635," Thank you. Ill try. I just feel like the future that I want beyond high school is impossible because of my grades, anxiety and perfectionism. "
636," i know exactly how you feel. its such a debilitating system - every mistake i make feels like a stab in the chest. 
sending you love and support - im here if you would like to talk. "
637, hope youre doing okay. sending you lots of love  im here if you need to talk 
638, im sure that you are so much more than you say. you are amazing and you deserve a lovely life. here to talk if you need me  
639, take a hot shower. enjoy the stream of water and the smell of soap. put on some freshly laundered clothes and clean and cook until your house is nice again. then do something you love. i guarantee that you will feel at least a little better. here to talk if you need it  
640," hope youre doing okay. sending you lots of love  if you need to talk, im here. "
641," wow. this story is jarring, but so moving. I cried a little reading it. thank you for sharing this. "
642, I'm sure people need you. Don't lose hope. 
643," what was your experience with the people around you as you tried to escape rock bottom? I used to be a top student but now I'm nothing, and I'm terrified about the judgements of others now that I have gotten a C in a class. I won't get an award at the end of the year as everyone expects, and every time I think about that I feel sick. "
644," thank you for this story, its very moving. "
645, every now and then I feel a tiny burst of motivation. a tiny glimmer of excitement about the future. it helps me despite my debilitating fear of failure. 
646, wow. thank you for this moving account. 
647," this is very important and effective, I agree. "
648, im so sorry about that. i hope we can both feel better soon ): 
649, thank you. ill try! 
650, thank you. ill try my best! 
651, really? okay 
652," I am a high school student who needs to die. I just received my first C grade and I can feel my future crumbling already. Ill obviously never make it through the next few years, and university / a career seem absolutely unattainable. I have no idea what to do. I hate myself so much, and my evident stupidity. Ill never be anything. I am so swallowed by this anxiety, depression, and self-hatred. I wish that I was as successful and intelligent as my peers. "
653, keep persevering. i believe in you fully! things will change and get better. 
654, so glad youre still here. sending lots of love  
655," im in high school and i want to die. i just received my first C grade and i can feel my future crumbing already. ill never make it through the next few years, and university / a career seem unreachable, impossible. i have no idea what to do. i hate myself so much, and i hate my obvious stupidity. "
656," to put it simply, I am just too terrified to do so. my grades in school, if anywhere short of perfection, make me want to die. this week, I received my first C and I can feel my future crumbling in my palms. I do not know what to do with myself, and my anxiety is heightened with mild depression. I dont know what to do. Ill never make it through high school alive. "
657, this story touched me. hope youre doing okay. 
658, this story really touched me. hope youre doing okay now.  
659," thank you so much for the kind words, they made my day.
I just feel like I don't deserve to live anymore - I got my first C on an in-class essay assignment this week. I dont even know what to do with myself. I am clearly so unintelligent and university seems impossible.  "
660," I know that no one will really see this, but I need to let my thoughts go somewhere. this week, I got a C on an in-class essay assignment. my suicidal thoughts skyrocketed immediately. I have never received a mark so low, and it has sent me into a spiral. 
I have no control of myself anymore. my whole future is ruined, and all the good marks I have received before are useless now. I will never be able to get an academic award at the end of the year. I have no chance of making it into university or getting a career that I want. I hate myself so much, I wish I could just die. I do not deserve to live anymore. I am so angry and disappointed with myself and my obvious lack of intelligence. 
apologies for the extreme negativity everyone. I'm so sorry.  "
661," I hate myself every day because of my grades. Anything below perfection leave me as a disappointed, crying mess. I don't know if I'll survive the workload until Year 12, because I feel like I am working at capacity now. I write down suicidal, anxiety-driven thoughts regularly.  "
662," Writing everything on my mind down definitely helps. I grab a smooth black pen and a notebook and write until my wrist is sore and my mind is somewhat more clear. I hate looking back on all the pages, though; they are filled with anger and anxiety and disappointment. Wishing you all the best if you are also struggling. "
