,post
772," An upvote for making a good measured argument.

Now lets have a look a your points.

Record manufacturing output. This is true. The value of output is higher than ever. Part of a trend which has lasted for well over a hundred years. The weakening of the pound has helped this, but the effects will be balanced out once costs adjust.

New Infrastructure projects. Can you be a bit more specific on this? 

Record Low Levels of Unemployment. The figures have never been fiddled this much before. Any unemployment figures for a long time are not accurate and this only gets worse over time. The figures the government release are worthless.

No sign of exodus. In every single financial business has a plan of how to leave. Not all of them will of course, but to say there are no signs is digging your head in the sand.

The economy has ""kept pace"" this is buzzword that doesn't actually mean anything. The economy has grown that is true.

Of course of countries want deals. They want their goods here. We don't have much clout with the major players to be honest and we are not going to get amazing deals.

The ""CANZUK"" Union. It may be popular here, but it will never be accepted by other countries. They have very strict rules on immigration and aren't going to like being flooded by us.

Due you have any figures for increase in wages and what sectors? I have seen nothing about this. "
773, I used to eat a meat rich diet and that was more than enough protein. My friend gave up up protein shakes once I pointed out how could get 50g very easily. 
774, Have you spoken to many Russian people about this. I have found them well informed about the causes of the rise in the cost of living and Putin is not a man loved by the people. 
775," I don't think they should be ripped off and nor do I want this, but that generation should keep future prosperity in mind when making political decisions. "
776, Seems like the NEC are doing what the people want and ending a classic under the table deal. 
777," Then they should have actually looked where their money was going. 

Most had no clue what was going on, and now want money which isn't there in many cases. "
778," No, peoples pension fund was spent on public services or invested into the economy.

The didn't save it they spent it. "
779, All of those countries were or are under the rule of evil dictators or groups. Nobody is crying out for Gaddafi or Saddam to come back. 
780," The Oxford Dictionary has this; The unlawful use of violence and intimidation, especially against civilians, in the pursuit of political aims.

Not sure if any of your cases falls under this to be honest. "
781," No

How is it a terrorist act, it is an act of war and aggression.

Blowing in up apartment buildings is an act of terrorism.
https://en.wikipedia.org/wiki/Russian_apartment_bombings "
782," Russia has committed more terrorist attacks in my lifetime by far.

The US has more bases in other countries than Russia but so does the UK. This is more due to countries not trusting Russia not to organise a coup.

The US did send troops to Afghanistan and Iraq. Why to fight against and enemy perceived or real. 

Russia is nice country full of cool people but the president is a symbol of evil in the world. "
783, He used journalists and papers like the daily mail instead. 
784," So we leave the EU which is good for according to the telegraph, but we are now seen as unreliable which is bad according to the telegraph.

Brexit will be a black mark on us for years to come. "
785," Lets hope it doesn't happen then.

 "
786, How many rubles is the correct rate for each comment now? 
787, Didn't he protect his mother's jewish doctor during the holocaust or am I mistaken? 
788, Thanks for you information. 
789, Are you not a Trump supporter? 
790, Thanks for you answer. 
791, Thank you for this information. 
792, Do you not think that controlling the start of conversations could be valuable to do? 
793," So you don't consider there to be any Russian ""bots to be operating on here? "
794," Do you think that these Russian ""bots"" don't exist or aren't active in this sub? "
795," Looking through some posts I see people talking about conspiracies, people from both sides of the political divide arguing.

One question is who is Russian ""bot""? I use the word ""bot"" in quote marks because I don't think most of them would be AI, but rather people being paid to post.

Has this sub been hijacked by a government power or am I just being paranoid?
  
(Edit) Thanks for the answers guys. The fact my question is at 0 with 43% upvotes is also for informative. "
796," You are not a centrist leaning left, even my american standards.

Supporting Trump pushes you way out of the centre. 

You seem to be agitating on a sub about conspiracies and trying to divert attention.   "
797," Finding a teacher would be the number one step.

I would look for a chinese tv program. You will pick up natural language common words and when they are used. "
798," Of course a regulation which opens up the markets and allows customer to see what a stockbroker is really doing, scares some people.

With Trump in the whitehouse expect some dodgy bankers to leave the city and hide in New York.

 "
799," The reasons for holding another referendum;

1 ""The will of the people"" This stupid term has been thrown about constantly since the referendum. This is a choice made by the people and at the end of negotiations the people should be able to speak again. If we had voted to stay and the EU changed the goalposts we should have had another referendum.

2 The average leaver will not be happy with what they are getting. There will be lots of this deal they dislike and the should have the choice to balance the benefits in their eyes.

3 If remain had won Farage would have kept piping on for years. This issue will continue to be open for years.

4 Leave know that people have cottoned on to the lies they were sold and are scared about the result. If you are silencing somebody then you are afraid of what they are saying.

5 The choice by brexiteers to devolve into children is awful. ""best of three"" or ""when do we stop"" and other stupid remarks. I am not sure remain would win an referendum, but the issue should be up for debate among the British people, not decided in some backroom. "
800," I don't know Korean, but find a good teacher, practise vocabulary on an app like duolingo and try to hear as much of it as you can from music or tv. "
801, I am an language teacher and watching tv is great for learning languages. 
802," The classic tale of two Englands. One is Big Gav fingering Stacy behind a kebab, the other is calculating the price of everyone's outfit and sipping cider. "
803, I am sure that was the case. 
804, It's all in the game. 
805, I read it was about women being distracted on their phones and driving off with the hose still in the car or some sexist bullshit like that. 
806," I'll bite.

First the Jewish religion would just be a myth. A relic of a bygone age.

Churchill would be viewed as an alcoholic warmonger, threatening the world's piece.

The Americans as a pacifist money loving weaklings.

The last of the slavs of the east would be dead by now and probably viewed as weak deserving to be whipped out by the superior Aryans. "
807, Do you know why people started this? 
808," She shaved a few days before. 

Stubble and penis don't mix. "
809," It will change, when I don't know. "
810, Relieves back pain. 
811, The army tested me. 
812, The drifting towards WW3. 
813," Got drunk and climbed a tree, goodbye phone. "
814," Money or card out before you are asked.

When looking for a fast queue follow men.

Ask the staff about offers, most will tell you what is really good value. "
815," The test done to check people's English are a lottery.

Maybe your nurse or an engineer working on a building, might not know enough English to avoid killing people.  "
816, England is knocking back the tenth pint and looking for a fight. 
817, I would put most leavers in the fruitcake category I am afraid. 
818, Unfortunately the leave side is quite fractured and will end up fighting against itself before long. 
819, Tell that to the EU. 
820, I am not sure anybody who wanted freedom of movement voted leave. 
821, Give it a few more months and a few more giveaways in the negotiations. 
822," Except people voted to end freedom of movement, which is tied to to the single market. "
823, Are you me? 
824," Nothing can be wrapped up quickly. This will take years and years to settle.

The fact that the government and it's party are disagreeing, should tell you a lot about how this will work. The end result will make everyone unhappy.

The brexiteers will still be under the control of the EU ""dirty foreigners"" will still be here. Remainers will be annoyed because we lose our say in the future of the EU. "
825, Do you want to stay in the single market and let the EU have a major influence on your life. 
826, The Pope is also still Catholic in recent news. 
827," The world changed and they have been left behind.

But note this is not a modern thing. Social morals went in the 60s and 70s. Economic morals went in the 80s. These people want a world which is long gone. "
828," What a difference a year makes.

She is now viewed as weak and unsteady.

The single market is a goal of the tories.

The EU has called all the shots and we are powerless to stop them.

The Brexiteers are starting to realize that they were lied to and the tories are not going to do what the people voted for. "
829," I did read a reliable source on the internet about the average ages of different arms of the soviet army in May 1945.

Unfortunately I didn't bookmark it but it said the average age of a rifleman was 45. "
830," Can you like a source to this Merkal stuff please?

Those countries are corrupt and have problems now because of this. "
831, Look at previous threads on here saying it is down and we can't go back. 
832," Since 2008 that graph is not looking good. He did help the rise that started under Yeltsin continue with a stable government, but he should have left in 2008 and not come back. "
833," Lets go through your points.

1 Oh my god the germans are invading Europe again. The army would be European it can't go around forcing people to integrate. The army would exist to make Putin wet his pants.

2 While I don't want us to join the Euro, it is not failing by any standard and with Trump in the white house could become a very important currency. The Euro does benefit Germany over other countries, but it does not fuck over the south.

3 Right now we are being ruled over by the most incompetent, useless and untrustworthy bunch of crooks we have had in a long time. How is this different from a democratic European Parliament?

  "
834," You may be surprised.

It takes the wind out of people's sails who think Brexit is in the bag. It gives us options and freedom, which are never bad. "
835," No that is untrue.

The priority is ensuring our way of life is not subverted by Putin. This is the number one we have to do.

Iraq is nothing like Crimea, we never annexed Iraq, when never sent our troops in disguises and we never shot down passenger airplanes. "
836," I lived in Russia and even they are more upbeat than the average brit.
 "
837," I am a Remainer, but I agree with your point.

If somebody changes the goalposts then any referendum is pretty worthless. "
838," Depends on two things

1 How the negotiations go. If the Eu keep hammering the tories, then support for Brexit will erode.

2 How long the tories can stay in power.     "
839," Theresa May is the number one cause of most peoples problems real or imagined.

How she gets away with it I don't know. "
840," It is harder to promise good things, than bad.

The problem was people tried to silence Farage and UKIP. If you stop someone from speaking it means you are scared of what they are saying.

Brexit seems to be a rebellion into nothingness. People don't like how it works now and will through it all away for something new good or bad. "
841, I am lucky I guess. I am working class and have a thick estuary accent. The point is people are starting to think about their future and what affect they have on it. 
842," The point is remain needs to explain to the manin the street what he will lose.

My brother voted to leave, after 5 minutes talking I persuaded him why he is wrong.

My dad on the other hand voted because he is becoming a daily mail reader. Common sense and reason are lost to him now. "
843," If anyone puts a number on the side of the bus they will be destroyed. Leave will have to come up with new lies, all of the old ones have been proved wrong.

if leavers are dumb rascist you can't change their mind, don't try. Call them what they are and try to seperate them from reasonable people. "
844," Anton Chekov was asked what Russia would look like in a hundred years, he said ""people will drink and steal"".

This problem has always existed in Russia, but it was the same in so many countries which have changed.

Russian people do have a lot of ""Old fashioned"" view, but aren't so different from you or I. The reason modernism doesn't exist in Russia is because Putin has hindered it. "
845," The generation of old people now is a different breed. I am not against everything the tories do, but I am against what this generation wants. "
846," 59% downvoted some people don't want to hear good news.

 "
847," Great post.

My biggest problem on him is his attitude towards Russia. Do you think he can improve in this area? "
848, The special interest are an evil which doesn't seem to be easily slayed. The problem is Brexit will allow these people to change the country and steal a wole load of money from people. 
849," If we leave and it is a great success people will have to shut up.

The problem is leaving will damage the country and people will look to our neighbours and think about what could have been. "
850," His ruthless, but I am not sure about smart.

He became mayor of St Petersburg and then President bacuse people thought he was a Yes man. He didn't get it through guile or intellect.Once he became president he turned on some of his backers and crushed his opponents. He has let the country stagnate and corruption flourish.

On the world stage he has managed to become enemy number 1 for every democratic government. He has gained a few scraps of land for this price.

If he were smarter he would be in a much better position now. "
851, People had to much faith in the man on street. The fight would be dirty on both sides if it happened again.  
852," The DUP for one have a huge undeserved say on what happens. The are people in the government who want a certain future for britian and this is how they are trying to get it.

Look at the tory rebels who fought for a chance to look at the deal at the end.

If we have to leave I want our brightest and best planning our future not the morons we have now. "
853," If something happens that could cause the people change their minds I would support a third referendum.

I just hate hearing ""the will of the people"" when it means nothing, without a second referendum.

 "
854," Leave were bad last time, but another referendum would see them destroyed I feel.

IDS had already gone to the backbenchs and I would love to see Borsi disappear the or to prison. "
855, At the moment the whole negotiating is being down by a week government beholden to special interests. It should really be a coalition effort. With all majoy political parties sending someone. 
856, I think the tide has turned on their way thinking. People look at Trump and others of his ilk and now see what it leads to. 
857," Mob rules strikes again.
 "
858, A second one would give the opinion of people who are aware of the process and the real reults it would incur. 
859," This issue will take a long time to settle down, but if we leave then it will never stop.

People actually now seem to be talking about issues. "
860," I think the tories are screwing the country up for a long time. i don't want us to join the Euro either, but I can't see that happening for a long time. 

I'd rather be a leading member of a big fish than a little minow on the world stage. "
861," The vote was not split evenly by age. Young people heavily favoured staying, old people wanted to leave.

I am not saying kill the elderly, but in a few years the ""Will Of The People"" may be completely different. "
862," If the people vote to leave again then most Remainers will ever leave the country or shut up and wait for a few years, only oopening their mouths to say ""I told you so"". "
863, Execpt noboday voted for what we are now getting. If that idiot Farage is agreeing with me you know the tories are up to no good. 
864, Demographics will tell a different story. 
865," Why is federalisation not in our best interests?
 "
866," According to brexiteers 51% to 49% is enough of a majority to change the country.

If there were another referendum, any lies team leave say will be cut to peices. They can't pretend that it will be free and not painful anymore. "
867," It depends on your view of the EU.

if you view it as an evil organisation bent on world domination and kicking puppies, you will see this.

By leaving we will have no say and the EU will affect more areas of our lives. 

If we stay in we have to be listened to and the voices have to be heard. "
868," I doubt it. Europe has been a hot button topic for years and was ignored, look at the mess we are in now. 

One of the reason the EU is happy we are going, is beacuse we won't be able to block what they want anymore.

If we stay in governments will have to tred very lightly around this issue.

 "
869," I think the opinion polls are organised by the government. The company that do them did have a reputation for being unbiased, but I am not sure that is true now.
 "
870," I wonder if her arguing with the protester who pied Murdoch, was sanctioned by Bejing? "
871," A second referendum would put the issue to bed for a long time.

If leave wins then we go out and negotiate with a strong mandate.

If Remain wins we stay in, but make sure the people are listened to when it comes to Europe.  "
872," I lived in Russia for a while. 

There are three opinions on the him;

1 Most people don't care and are happy being ignorant.

2 A large number of people hate him and want him dead.

3 A small group of people either profit from him or believe the propaganda and thus like him. "
873, What address can I send you twenty rubles to? 
874, Putin is not some all powerful god in Russia. He could lose control very quickly. 
875," The sanctions have had a huge affect on him, don't think that they have not weakened him. "
876," I have actually found something different. Stupidity is equal across all groups, but attitudes are different.

I have met so many working class people who are happy in their ignorance. Most of them know they are uninformed and don't care. Most middle class at least pretend to have an interest in the world.
This means that you can have a discussion  with them at least. "
877," Some polls say yes, some say no. People like Brenda are fools and have no part of this discussion. "
878, I have broke up with a girl for owning a horse. She was showing me photos on her phone. After the millionth horse i knew I was breaking up with her. 
879," Because it looks likely that it will be a Labour Lib coalition in power.

Actually very few people have changed their minds. The country is still split 50/50. Some undiecded have joined the remian camp, but that is it. That means half the country don't wont this to happen and want another vote. "
880," Why is it unlikely ?

The vote could go either way and looking at the polls for the next parliament it looks like we will be having one.
 "
881, It won't be overturned. We will have another referendum and follow that vote. 
882," I am a Remainer, but soft Brexit is a stupid idea.

We gain nothing we don't already have, but lose so much.

Nobody voted for this. Every brexiteer I have spoken to wants a hard Brexit. "
883," You flair says Libertarian. Why not follow this ideology?

 "
884," They voted for something stupid because they could.


I am working class, but I understand why politicians ignore a lot of people. There are huge number of working class people who are thick. They don't understand how life works or the affect of their actions.

Saying that, there huge numbers of stupid middle class people. They barely understand the world, but they integrate and are involved with others which rubs off on them.

Most people on both sides didn't not have a clue what they were voting for. But if Brexit is as bad as I imagine, it will be the folks at the bottom who will pay the price again. "
885, It will be a tax holiday I feel. 
886," Looks like some people are worried about about losing access to tax havens.

Their solution is to make Britain a tax haven. The whole piece seems to be making the case that these poor innocent bankers have their money trapped abroad and just want to bring it back and invest it. The more is there because of a scam 1 trillion pounds stolen from the people of the UK.

I have a better idea. Tax all money going to tax havens at a flat 5% goodbye deficit.

 "
887," People don't want wars or discrimination. 

The reason the far right has made progress around the world is simple: The Great Recession. When times are hard extreme political groups always gain popularity. 

Brexit will cause a backlash no matter what. The country is split down the middle and any choice will cause problems. "
888," Far right leaders never listen, they demand people listen to them. "
889," If somebody is stupid enough to join a far right party, they will find an excuse anyway. "
890," Teresa has proved to better than hanging than anyone thought. This government is completely useless at everything, except at staying in power.

It will collapse, but when I can't tell you when.  "
891," I see the plan as follows;

1 Wait for the government to implode.

2 Smash the tories in election, but still have a hung parliament 

3 Hope that the Lib Dems get enough seats to form a coalition

4 Reverse Brexit as part of the coalition deal.

 "
892," When you have the tories at their worst versus an organisation which is meant to be a fair future minded, the choice can be quite simple.

I don't love everything the EU does, but Brexit has shown them to be organised, pragmatic and willing to listen to the countries they represent

The tories are the opposite. Completely all over the place, dogmatic and willing to ignore the 49% who voted against this. "
893," The reason is because we know what we are getting if we stay, if we leave almost anything could happen.

Trying to predict the next ten years after Brexit is impossible. "
894," I am 5'4"" and shit happens. 

Do you what you want. I used to get annoyed about things like this, but I matured and it doesn't bother me now. If you want to date people who you like, do it. "
895, It takes a long time to create any army out of nowhere. We would have lost before the population will have been mobilized.  
896," There is an argument that they aren't a strong military piece of equipment, but they still have a lot of use in power protection.

In some situations they can be easily knocked out, but not cheaply or by any army. "
897," As much as I love that speech, I feel we are going to need a strong army in the future. "
898," I think we will have to disagree.

I feel it is another back handed way for the government to collect taxes, but I understand you don't feel that way. "
899," 1 Bingbongistan is not a real country.

2 Other countries will not allow us to go around nuking the world. "
900, None of those things involve the government. Name area in which you have to pay the government for an essential service. 
901," More effective?

They have been used once.

You will have two choices end the world or surrender. "
902," There is no choice.

You want a degree you have to pay. You can choose not to go, but you don't get a degree. For a huge amount of professions there is no choice.

It is a tax on people who have gone to university. "
903," I may not like the tories, but I didn't not expect huge cuts in 2010 while a war was being fought in Afghanistan.

They aren't a pro armed forces party. "
904," I see it as a new tax.

It is a tax on higher education framed in a different way. "
905," They don't have aircraft carriers or nuclear weapons. 

These are hugely expensive, but allow our country to have a place on the world stage. If we get rid of them and make our army a force that can defend the British isles then do it. No more death by a million cuts. "
906," The man is being borrowed, which covers the costs. Now if the money is not paid back, it won't disappear a future government will have to pay it back. "
907," How much will you pay back in the end do you think?

If people don't pay it back, we end screwing the next generation and the can will be kicked further down the road. "
908," None for me in real life. 

On the internet I remind people what their politicians have said. You like Trump, what do you think of this stupid thing he said etc. "
909," That is why I never joined. I went and passed the briefing, then the tories cut the army in 2010 and I went elsewhere. "
910," Any more cuts and we should do away with the forces. They are becoming a paper tiger, why waste money if they won''t be able to do anything. "
911, According to some of my old teachers you had to go speak to people at your local government or education to get some money. 
