,post
0, I gave you an upvote at least. 
1," I don't dislike the theory of a false flag in itself, but mass propaganda behind it seems to hurt it, rather then strengthen it.  "
2," Not a great list of people there, to be honest. "
3, Good article. 
4," Shhh. Don't put facts into this only feels.

The fact that every parliament in the world has problems irrespective of voting system is NOT important here.

The fact is that politicians reflect the ""Will of the People"" in the own way and will never change. "
5, Have you lived there? 
6," The rise in the Far right has more to do with economic conditions and the internet than the left.

I never mentioned Joe Rogan, why keep bringing him up.

The reason I called you Far right is because you dislike people insulting Far Right speaker, try to force the conversation away from the issue and think everyone opposed to you is a far left ""SJW"".

I have no problem with people debating each other.

I do have a problem with people trying to downplay what the believe. "
7," The far right did not appear because of the left. They have always existed and always will.

I called him a far idiot and many people he appears with idiots, you had a problem with that. Why?

Is he not far right? or talking with far right people? "
8, Defending Far right idiots and bringing up the left all the time. 
9, You don't sound very centrist.  
10, Intelligent debate from the right again. 
11," You brought up the left as a comparison.

No party really wants the old ignorant voters look at the tories to see what you get.

You see the world as far to much of Left vs Right I think. "
12, Finally some good life lessons being taught in school. 
13," So if the Far Left are bad it is ok that the Far Right are. 

I am no friend of Far left idiots.

The working class have not abandoned Labour, just the old people who can't move with the times.

Defending Far Right idiots is not something from the centre. Nobody who holds liberal, open minded ideas looks at these bunch of muppets and thinks that is a cause worth fighting for. The Far Right breeds loser,s angry failures with nothing going from them, because thses people are easily controlled.

I am not calling for these people to be silenced, just let the spotlight hit them. These people should not be able to pretend it's ""bantz"" or a free speech issue. The Far Right hates any close look as it shows them as the clowns they are.

  "
14," Except the far right are using these connections to ""red pill"" people.

I have clicked on a link that was about a slightly right wing topic and then recommended videos up the ante. 

Now you can see this from other political groups, but not to the same extent. There is a clear propaganda effort in many countries to normalise far right views. "
15," The chart will include a few outliers of course, but it does show how connected the far right are on Social Media. "
16," Far Right guy is connected to other Far Right idiots. 

What a shocker. "
17, Any evidence or facts to back up these statements? 
18, Pick a fight? 
19, Nice tables. 
20," Be quiet. The mantra is ""the system we have now is bad, not stupid voters""

The fact that countries without FPTP are still run by stupid idiots voted in by stupid voters. "
21, I am unbanned cheers. 
22, I have no idea. There was no reason given. 
23," 
You have been banned from participating in r/conspiracy. You can still view and subscribe to r/conspiracy, but you won't be able to post or comment.
If you have a question regarding your ban, you can contact the moderator team for r/conspiracy by replying to this message.
Reminder from the Reddit staff: If you use another account to circumvent this subreddit ban, that will be considered a violation of the Content Policy and can result in your account being suspended from the site as a whole.

 "
24," Watch the polls. If the tories slip ahead, this will go on the back burner again. "
25, Why did you ban me? 
26, I have to agree with you. 
27," Took the words right out my mouth. 

Who wants up to date info. "
28," Translating president? Lol

It is the same word in both languages. "
29," You joke, but it will happen. "
30," /u/setterm comes out of a couple of month deep freeze and finds out TMOR is after him.

https://old.reddit.com/r/conspiracy/comments/91qsux/a_list_that_was_made_over_4_months_ago_that/ Edit Forgot the link

They mainly target people who are well-spoken and who source their comments. These users are the biggest threat to them because they can persuade multiple others users with facts over emotions.


This made me chuckle. "
31," He banned me and didn't give a reason.

Put down the tendies /u/aleister, and spend 5 mins making rubbish up for me to be banned at least. "
32, Rich businessmen talking about a secret payment and covering it up for political purposes. Sounds like a conspiracy. 
33, Crazy storm. Kept me up all night. 
34, He is over 100 years old? 
35, Why are you keen on him dying? 
36," He will soon have an ""accident"" I fear. "
37," No


I will shill for Crash TEAM Racing anytime and place.  "
38," So this guy ""walked away"" from the democrats and now is happy being on Fox News?

 "
39," Where are they ""walking away to""? "
40," Don't you know Labour should commit suicide every time they are not above the tories.

Maybe 40% of the country will support the government no matter what and Labour should not give up what they believe in. "
41," I was loolking at this sub https://www.reddit.com/r/walkaway/
 and I noticed the two mods with full powers.

https://www.reddit.com/user/rsashe1980/posts?sort=top
https://www.reddit.com/user/conspiracythierry/posts?sort=top

Not exactly former Democrats leaving the party, but two hardened trump supporters.

According to their link in the sub it was started by Brandon Straken a failed actor.
https://www.imdb.com/name/nm6808229/

 I have been reading that this has been started as a psyop. Can anybody share some info? "
42," Not sure very mininal is the right word.

But it didn't help them win. "
43," This post has 31% downvotes, so I guess yes. "
44," Told you last poll.

Corbyn can never win and needs to go/s. "
45," Of course they matter. He cannot get almost any votes from the tories at this point. He has to attract the floating vote.

Right now i would not vote for the guy, but he can move on the issues except he personally feels against them. Though it is easier to change one mind than many. "
46," Time for the ""get rid off Stalinist Corbyn comments.""

Look at who is supporting the tories according to this it is the old and the people who think BREXIT is going well(the ignorant). These people will never vote Labour. Ignore them and move on.

Cotbyn needs to sort out his view on Brexit and foreign policy and wait. According to this poll if there was a vote tomorrow only 31% of people would vote tory. "
47," Or we could invest in the country and boost the economy, but that won't happen either. "
48," We have the money for all these things, it just sits in tax havens around the world. "
49," So you think we should let the US pay for troops around the world?

I don't think we can rely on the US to defend the world anymore, it is time we took responsibility for our own defence.  "
50," The EU started as a process wayback in the 50s. It has changed names , but the main idea hasn't changed. "
51," Which countires have the most soft power?

The EU got to where it is with ots of defence spending against the USSR. The countries were bound toghether by an outside threat. "
52," He seems like a cake and eat it sort of fellow. 

He wants to live in a world of peace and harmony, but doesn't want to spend any money getting there.

We can either have influence in the world or not, but we have to pay for it. "
53, You do know what forces we have now? 
54," Why not?
 "
55," Good.

Lets actually have a force capable of doing what is asked of it. "
56," One of those place is very different from the others.
 "
57," When you went to Kazan, was it like that? "
58," Nunes finished his ""investigation"" why is he still asking for information. He knows what he will say before he gets the docs. "
59, In Russia. Trust me the people there know how to drink. 
60, You know where Kazan is? 
61," I dont want to defend the creep, but locally people do want the airport reopened. "
62," Don't use the sun.
 "
63," The daily Tommy idiot post. 

He makes the Far Right look even worse. "
64, Can I distract you as well. It looks like fun. 
65, This has nothing to do with Trump. 
66, I dont understand 
67," For a person who loves conspiracies this is the best part of the investigation.

The groups around the world who will be uncovered like SLC in the UK. "
68," About what?

AMA "
69, Are you glad or is this shitty? 
70," Look through my comments.

See if we past the test. "
71," I spent two years there.

I didn't watch his state speech, but people filled me in. "
72, Israel always seems to be abut more than money to me. 
73, It was the first source I saw. 
74, Mueller is investigating anything he comes across. 
75, This is a group of high level people interferring in other countries politics for money. 
76," A secret group of TPTB by any stretch of the imagination are in cohoots. Lots of bought politicians and greedy idiots.


Edit: A better SS as requested. It seems that a cabal of former connected politicians have come together or been bribed to use there contacts to become involved in Ukraine.

The conspiracy seems to be a lot of these people are the same as before the overthrow several years ago. It seems that democracy there could still be under threat from people in the shadows.

Cheers for the gold. "
77,  
78, You have to live in Russia before you understand it. 
79, Best statesman? 
80, Do you feel the current president is doing much to help these issues? 
81," In your comments I see ""redpill"" Shariablue"" ""pizzagate"". 

How is any of the left wing?

If I look at the_d their comments match yours. "
82," Left leaning?
 "
83, Does Mueller often talk to Trump? 
84," Shame flytape deleted his account he would have liked to have known that there was another user who has the same view on this subject.

 "
85," So why downote this one?
 "
86, There  must have been at least 50 downvotes. 
87, But why would they downvote him being questioned? 
88, Why so many downvotes? 
89," It is.

The post is brigaded up, but the comments are real. "
90," What about before the vote?

 "
91, So Russia aren't part of TPTB? 
92," Of course there is brigading here.

Look at any pro establishment thread. Lots of upvotes, but all the comments destroy its arguments.

Sort by new for the truth. "
93," The calls of beware ww3 always make me laugh.

Russia cannot go to war. The country doesn't have the access to financial markets and an export driven economy. They have an army of conscripts, where anybody who can avoids going. Add to masive corruption in the system. They cannot take on the west.

The idea seems to be let Putin do what he wants or he will get angry and destroy the world. "
94, Maybe most of this sub don't believe Russia. 
95, My gran just had this. 
96, Or from the land of bears and vodka? 
97," Of course they could have won.

Many times in History ""who could have won on paper"" was ignored by the actual events. Look at France 1940 for example. "
98," That answer is not correct.

Germany declared war three times. Against the western allies in 39, agains the soviet union  in summer 41 and finally against the USA in winter 41. 

Each of these may be viewed as a mistake, but you can't lumber them all together as one choice. "
99, How? 
100, Where is the part about losing the civil war? 
101," I remember the Russians at Gettysburg or when they took Vicksburg.

Russians saved the USA in the civil war. "
102," Where is Melania?

I would like to hear everybodies' thoughts "
103,  
104, My life is here. 
105, I think it depends on the system. 
106, They are now and the events mentioned had a direct link to the current situation. 
107, Look at the last remaining monarchies around the world. They evolved into something useful for democracies. 
108, No I am highlight the role a monarch plays in constitutional system. 
109," I am not in favour of autocratic monarchies, but a constitutional monarch seems a good system.  "
110," No I am not painting anything.

Any dictator of the UK would have to remove the monarchy to gain full legal uses of the powers of governments.

Can you answer my questions please? "
111," Yes that is true.

But it gave a framework for a successful change of power. "
112," Who would have taken over in Italy without a king?

Who was Franco's successor?

Cromwell was far more a dictator then any king for a long time. Read up on his rule. "
113, And removed by him in 1944. 
114," First the cam for the nationalist and I went REEEEEE, because I was a Nationalist.

Then everyone was happy. (apart from the alt right) "
115," Look at Mussolini. Removed by the king of Italy.

Look at Spain, where the king brought back democracy.

Look at England where the period without monarchy was a dictatorship.

Want any more examples?  "
116, It would also remove an obstacle to dictatorship. 
117, Which the law counts it as part of the case. 
118," He decided to film a court case.

In the UK it is against the law.

Now he is in prison.  "
119," I don't remember them being found wrong or misleading. 

Do you have a source? "
120, It does seem like a national front reunion in here. 
121,  
122," Very funny.

He can't ask a question without being banned? "
123," I have lived there for a while and you are correct on most of your points.

 "
124," No he is not.

In the last election he ""got"" 56 million votes out of a country of 140 million. The opposing candidates were picked by him. The communist candidate was a millionaire and a former member of Putin's party. There were huge numbers of fixed ballots across Russia.

He is not popular or well liked, but refuses to allow and alternative to himself. "
125, Minis Bay parking is just a cash grab. 
126, What a complete rip off. 
127," Hopefully people will try to be friendly and positive in the future. 

I don't mind losing Gammon as a term if people stay civil. "
128," I never knew that this sub was so well versed in racial connotations of everyday words and the social and political effects of them.

Lets see if this sub can maintain this level of discourse in the future. "
129, I will try to remember the high ground everyone rests upon when the next topic rolls round and people start insulting. 
130," Yes.

Most people are adults.

The Gammons are children though. "
131," Except we all know it is very different from that.

It seems the alt right are whipping people up about this. "
132, Remember we are here to talk about conspiracies. 
133," I find this Sub's attitude to this word funny.

Why are people getting so bent out of shape about this?

I called my manager a few years ago a gammon, mainly because he had a very round pink head. He was not amused, but did not find it racist.

People are complaining about insults, but they need to speak to people in real life. You will hear far worse than this about other groups.

If being called a gammon will change their mind on a who they are going to vote for, they are a simple minded fool and any party should not be trying to get their votes.

Why would you want to be beholden to the simple minded, afraid to take difficult challenges because of the fact your base is thick and can't comprehend issues?
 "
134," For non UK users, the express is a trash newspaper. "
135," Russian nationals have not turned up in court. Their lawyers have.

Why are they doing this?

The short answer is they want to see what Mueller has on them.  "
136," Looking at your downvotes, I can here the sizzle of gammon on this thread. "
137," No 90% of old people have managed to go through life without learning how the world works, To state otherwise is just fantasy. "
138," What people are you talking to?

Is there an enclave of old people who are aware of the world around them and their choices. "
139," Seems a very stupid move.

Rule 1 of EU politics- Always let the tories bicker before everyone else.   "
140," Not the ones I met.

They are nostalgic for times which never existed and have no care for the future. "
141, Have you talked to anyone over the age of 65 about politics? 
142, The fact is the old and the ignorant are dying off around the country. 
143," Of course this is being downvoted. 

My favourites were the locals who rented out rooms on Airbnb, but blamed me for causing housing problems. "
144, The money the paid was spent on them at the time. It went on the police and the NHS and other things they needed. 
145, There are a few native speakers here. 
146," About what?
 "
147," Lets wait and see, the truth shall be revealed. "
148," Of course she lied.

Why should she sit at a table with someone and not talk? "
149," I thought she would have come up with a better lie than that.

Why did Putin want to speak to her? "
150," LOL
 "
151," No

Why was she at that table? "
152," You have not seen this photo?

https://media3.s-nbcnews.com/j/newscms/2017_51/1955941/170405-putin-flynn-dinner-jhc-1700_ae6b4cdd270c7a7f3720c0df3b07f9fb.focal-1000x500.jpg

It refers to the title

 "
153," Of course it has nothing to do with with her ties to Putin.

Of course Trump is leftist opposition.

Of course we can not question this without it becoming a witchhunt.
 "
154, He lied. He was still leaking from it. 
155, It was Nunes who annouced this. Nobody cares what he says. 
156, I'll let the justice department do this one. 
157, Since when is colluding not a problem? 
158, Man it would hard to take those by force. The Americans had trouble in Vietnam with tunnels. They had the best success using tear gas and other non lethal chemicals.  
159," He laughs at Trump, prepare for disagreement on this sub. "
160, What happned to the rest of the cambridge analytica story channel 4 were doing? 
161, Careful of being anti Russia here. An easy way to get downvotes. 
162, Great post. 
163," Good catch.

I have seen this happen on this sub before. "
164," I think you are spot on here.

Russia can in no way hope to beat the US. "
165, You say it like they are two separate things. 
166, Forgive me for trusting the guy. 
167," No you have not.

This dossier was started by the RNC, just like I said. "
168," Do you understand how this works?

They didn't make new reports every week like a group of highschoolers.

The compile the information like a ball of string. "
169," I don't understand, they should have stopped looking for the truth because what? "
170, So he didn't go to Prague then? 
171," The infomation gathering campaign started under the RNC this is a fact and nobody doubts this.

The infomation pointed to collusion and corruption involving Russia. If you want infomation on this, what do you do? 

You get a Russian specialist in. This is were Steele appeared and the reast is history. "
172," The dossier said Cohen was a dodgy guy and he went to Prague to arrange a deal. The relevations last week support this narrative.

Which of course this article did not address. "
173," I read that he did in fact go to Prague last week. The raid was about shady leagl practises linked to the pornstar trump had an affair with.

It seems they are uncovering dodgy real estate deal linking trump, Hannity and the Russians in the middle east. "
174, I though Cohen was arrested the other day and his offices raided? 
175," The dossier had lots of details of corruption on Trump from the beginning, thats why the DNC paid to keep it going. "
176," Another good part from that text.

But unfortunately the truth about atrocities is far worse than that they are lied about and made into propaganda. The truth is that they happen. The fact often adduced as a reason for scepticism  that the same horror stories come up in war after war  merely makes it rather more likely that these stories are true. Evidently they are widespread fantasies, and war provides an opportunity of putting them into practice. Also, although it has ceased to be fashionable to say so, there is little question that what one may roughly call the whites commit far more and worse atrocities than the reds. There is not the slightest doubt, for instance, about the behaviour of the Japanese in China. Nor is there much doubt about the long tale of Fascist outrages during the last ten years in Europe. The volume of testimony is enormous, and a respectable proportion of it comes from the German press and radio. These things really happened, that is the thing to keep ones eye on. They happened even though Lord Halifax said they happened. The raping and butchering in Chinese cities, the tortures in the cellars of the Gestapo, the elderly Jewish professors flung into cesspools, the machine-gunning of refugees along the Spanish roads  they all happened, and they did not happen any the less because the Daily Telegraph has suddenly found out about them when it is five years too late.

  "
177," So the dossier was funded by the RNC first?

 "
178," Wow I lost a lot of brain cells getting through that.


So many lies.

The steele dossier was paid for first by Republicans running against trump. The article dosen't mention this fact, but like to remind readers of its connection to the DNC. "
179, So nobody here dislikes Nazis then? 
180," Next time somebody is wishing Hitler happy birthday, maybe more people will speak up.

https://www.reddit.com/r/conspiracy/comments/8dt983/happy_birthday_hitler/
 "
181, Ignore the dictator running the control into the ground and giving his cronies money. 
182," Another good passage.

I have little direct evidence about the atrocities in the Spanish Civil War. I know that some were committed by the Republicans, and far more (they are still continuing) by the Fascists. But what impressed me then, and has impressed me ever since, is that atrocities are believed in or disbelieved in solely on grounds of political predilection. Everyone believes in the atrocities of the enemy and disbelieves in those of his own side, without ever bothering to examine the evidence. Recently I drew up a table of atrocities during the period between 1918 and the present; there was never a year when atrocities were not occurring somewhere or other, and there was hardly a single case when the Left and the Right believed in the same stories simultaneously. And stranger yet, at any moment the situation can suddenly reverse itself and yesterdays proved-to-the-hilt atrocity story can become a ridiculous lie, merely because the political landscape has changed. "
183, How do you think we can stop people posting anti Semitic or Racist things here as a false flag?  
184, https://www.reddit.com/r/conspiracy/comments/8dt983/happy_birthday_hitler/ 
185, To what? 
186, If it fights and plans with Nato and relies on supplies with them I would through them in together. 
187, So they didn't fight with the Germans and train them then? 
188," I remember learning about the SPLC in school. They were an organisation fighting for civil rights.

Top Minds of Reddit is a sub that laughs and mocks Racist idiots.

Yesterday we had a post about Hitler's birthday and what a good man he was and lots of comments supportting him.

Now if we combine this; a civil rights group, a sub which mocks racists and this sub which devolves into far right propaganda far to often. 

What will we get? "
189, Probably had to spend a lot of money to make it look more modern. 
190," I can sit around laughing at stupid things normally.

When I smoked in the past it had no real affect apart from becoming even lazier. "
191, So a book written by the Nazis? 
192," Yes they were.

They had a lot of freedom to do what they wanted, but they were on the same side.

The Germans used their naval bases, airstrips and had an SS division running around in the north, which was trained by the Finns. The Germans also gave the Finns armoured vehicles, guns and supplies.

The Finns were attacked by the Soviets twiceduring this period, but to say they weren't on the side of the Nazis is strecthing the truth. There seems to be a lot misinformation taught in Finnish schools, some of the comments above indicate the west left Finland isolated  and without help. I guess the volunteers from across Europe did not exist or the planes the Finns flew were not from the west. Or that the French and British didn't have an expeditionary force ready to go until Norway and Sweden said no (quite rightly to, the allies wanted to seize iron mines in Sweden) or that a bombing mission was planned against Baku.

Sorry for the rant. "
193," For all the people who don't know much about history.

The DNC did this during Watergate as well. The Republicans are put into a difficult spot here. The real benefit is discovery, the process where documents have to be given over to the other side. With the stuff already out there it looks like an open shut case. "
194, So Trump did not admit to speaking with Putin about prostitutes?  
195," These memos were written by Comey the ex head of the FBI.

They contain lots of quotes from Trump which paint him in a very bad light. "
196, Fair Enough. 
197, You thnk hate speech shouldn't be reported? 
198," Submisson Statement.

I think every group here will be interested in these memos. There are some gems coming out already.  "
199,  
200," Which subbreddits?
 "
201, What is the problem here? 
202, And maybe two buildings to fight over. 
203," Don't worry, one day you will get her. "
204, If you are a criminal become a candidate and nobody can touch you it seems. 
205," My friends hired a stripper, somebody filmed it.

It got 60000 views on facebook in three days before it was taken down.According to legend it still exists on Pornhub somewhere, but I have not come across it. "
