,post
206," I don't know.

Everyday I wake up happy. "
207," Yard of Ale

A challenge alone to drink and would get most people so drunk they couldn't walk.

https://www.youtube.com/watch?v=N-4iFTVooU0 "
208," Bart the Lover

Too many classic lines to name.

Except one ""Ps I am Gay"" "
209," A shop that sells gaming models.

I might end of with three bags of stuff. "
210, Which one? 
211," It is the start of a new propaganda push.

1No war with Russia

2This action will anyoy the Russians and start a war. Lets not do it avoid the war.

3Use this threat to avoid critism of Russia. "
212," They are both idiots, I give you that. "
213," No that is not true and you know it.

The crying Nazi proved you wrong. "
214, Is that a real question? 
215, People who post Nazi propaganda are the people who will be targeted 
216, Tell me when you get it. 
217, Actually most people in the real world don't like Nazi. 
218," If you have not noticed, there are lots of people who post nazi propaganda on some parts of the internet.

These people may find it hard to work if their future employers are not so fond of the third reich. "
219," They were the bad guys, but also the good guys. Humans are strange like that.

I don't like judge people in the past by what I think today. You have to look at the enviroment they were brought up in and the eviroment around them. "
220," It is not about whataboutism it is about people of a country looking at their history.

Do I want to go back to empires and colonism? No

But I look at history as it happened not through some revisionist lens. If you open a history book, inside somebody will something bad. 

People will look back on us and find our actions unacceptable to their morals and beliefs as well. "
221," You mean companies don't like hiring nazis?

Who would have thought that? "
222, Why did Shills tell us it was used if there was no evidence? 
223," Can the ""will of the people"" change? "
224," Did you read your sentence?
 "
225, Most Romans were pround of the Roman Empire. 
226," Multiculturalism has never worked in any case in History.

When in Rome.

It has failed because many people from other countries have become British, maybe a different flavour, but still British.

I have no problems adding a few extra types of Britishness to diverseness we already have. "
227," 
This is the sort of thread that will get this sub banned. 
 "
228," Well done.

What do you think they will do next? "
229," A journalist who reported on the failure of Russian Mercenaries in Syria has died under mysterious circumstances.

After exposing corruption in Russia he has been killed. His reported phone call was of security officials and police entering his house shortly before he died. "
230,  
231," Lets see what Russia do.

I think they could be bluffing here. "
232," So you have not been to Russia or spoken with ordinary Russians then?

Corruption has been reduced? That will come as a big shock to the Russian people.

The Ukrainian people have no desire to be ruled by puppets from Russia, this is a fact.

If you spent time in Russia I think your view of the country would change a lot. "
233," I have to disagree with you on almost every point.

Have you ever lived in Russia? 

The military is an army of conscripts and most people avoid it if they can, corruption is epidemic and equipment is decades behind the west. 

China has no love of Russia and still look at the far east as an easy conquest and would have no problem with capturing it. Most Russian people I speak to are far more worried about China than the west.

Putin cares only about himself he has no love from the Russian people. Russians are angry at the corruption they see in their everyday life, the polltuion around them and image which is portrayed to the world.

His ""high popularity""? I guess he didn't he cheat in the last election then? I loved the ballon gag the best.https://www.youtube.com/watch?v=-Ayglwqw_fo

The people of Russia don't want to be dragged into a war to prop up a ""strongman"" "
234, Maybe somebody got to them and swore them to secrecy or maybe they went in a circle or maybe they are in  it as well. 
235, Careful of saying bad thing about Putin here. 
236, Who do you listen to? 
237, So Russia is not planning to take any action beyond words here? 
238," So the first person we should look at it the person who made a post about it.

Goons round up anybody who says SHi**s. "
239," Lets listen to the Syrian Mininistry for information rather than anybody from the west.

I can't think of a single reason they would lie or bend the truth.
 "
240, Ma-crone? 
241," To be honest, who was providing the liquid doesn't matter to me. But if you work out the fluid dynamics of it, fill me in. "
242," I guess you are far more sexually liberal than I am. I don't think people would want their sex lives on camera, especially if it involves pissing on Russian Prostitute.   "
243, Just because it was taken when he was a private citizen doesn't mean he can't be blackmailed now. 
244," Why?

If he can be blackmailed with it, it feels like a conspiracy. "
245," This is true.

Look at American Civil War. The south was full of people spreading lies about they are going to take you slaves and destroy the constitution. They cheated the ballots in many states to succeed from the union.  "
246," That a leader of country has been hiding a secret sex tape.

Seems like a conspiracy to me. "
247," There is a fair amount of it in the shops, not sure how many people drink it though. "
248, He is testing the waters and getting the pardons ready. 
249," Of course Russia does things like this.

Why do some people have this view as the Kremlin are peace loving hippies, that just want everyone to be friends? "
250, Have they caught the hacker known as 4chan? 
251," You seem to believe Russia over any other country.

Is there anyway you could be convinced otherwise? "
252," Some new info from the Skripal and the Russian poisoning in Salisbury.

This totally refutes what has been posted here other sources. "
253,  
254, Thanks for the info. 
255," There seems to be a tendency for some people to love bullying dictators, so called strong men. I think these people are trying to cover up for a failing in their lives.
 "
256," Lots of people on here aren't fans of conspiracies, they come on here to spread propaganda and attack the other side.

I don't know why the mods allow it. "
257, Cheers for the answer. 
258, I have read that the french suffere from problems with their guns at this time. Do you have any info about this? 
259, I have been reading up on ironclads and have found them very interesting. Unfortunately almost all of the info out there is about the ACW. I am looking at how a large naval conflict would have happened in the period 1860-1880. 
260," It could be ""food poisoning"", I heard Litvinenko had a dodgy curry which killed him as well.

Trotsky also ate a bad taco.

Russians never kill anybody. /s "
261," Using a weapon that is indiscriminate and hard to treat, sounds cunning and vicious to me. "
262," I feel he is cunning, ruthless and lucky, but he is not a great intellectual mind.
 "
263, I fail to see how he is a genius. 
264," So a person can say something and that is final and any actions afterwards shoud be ignore?

Wikileaks and Assange are connected to the Kremlin and are now just another mouthpiece. "
265," So an article reporting what somebody has stated, cannot be coneecte with the person quoted?

Wikilinks has far too strong connections to the Kremlin for my tastes. The brackets are to reflect the level of discourse you are using. "
266," The atlantic source was a invesitgator, who quit because Russia kept blocking the invesitgation.

The other links use wikileaks and infowars. Stop being a ((((concern troll))))) "
267, Maybe don't use crackpot propaganda sources. 
268, Can link the Newsweek story? 
269, What do you think then? 
270, Nobody has mentioned it to me either. 
271," Not exactly.

He wanted people to care about Putin, the most important person in the world. "
272," And nobody cares about old men suffering in Siberia, people do care about chemical attacks on the streets of Europe. "
273, Not for lack of trying. 
274, That if you cross the Kremlin death will be slow and painful. 
275, I think it was to send a message. 
276, The person quoted in the article eventually resign from the comission over Russian blocking investigations of war crimes.  
277," My money will be that it was a (((((false flag))))) and the UK killed him, because they are scared of every Russian Uber man even old men and a woman.

This is about their normal level of discourse. "
278," It was meant as a show of force like the Polonium tea. They bungled it .

There is no antidote, but never agents were developed for the battlefield to cause disruption and disable soldiers and they are good at this. They are not good for targeted killings it would seem. "
279, I am living in Russia and nobody has told me. 
280, Don't worry will adjust it now. 
281, Source? 
282," Gaddafi was overthrown for a reason. He killed his enemies and repressed his people. There parties and cheering when he died. Libyans aren't sad he is gone.

You could say the same about Syria as well. "
283, Libya and Chad seem like far better results than Syria to be honest. 
284, How has Libya been made worse? 
285," I have been following the normal chatter on here and certain posts have attracted my attention.

Russia has almost won the war, the rebels are defeated and peace is close at hand. This is completely false. https://syria.liveuamap.com/

Syria is a quagmire and Russia is trapped at the moment. They are  pushing back the rebels, but victory is far away and it could drag on for years.

USA to the rescue?

America sends troops in, the Russians pull out and now America is fighting an endless war and spending money.

Russia is free, Trump gets to be anti-Russian, Israel gets to have more protection and influence its' neighbours. Everybody is a winner.( Apart from you, the taxpayer and the civilians just trying to live their lives in peace.)  "
286," Again with the propaganda straight from the Kremlin. 

What has this got to do with conspiracies? "
287," What a coward. He finally gets what he has always wanted, an Republican govenment and control of the economy. Of course this enough to end his career, can't peddle lies forever it seems

Now he is leaving and will sit sobbing while Rage Against the Machine plays in the background. "
288," There are Paid Russians here now and there were some before.

I don't understand the ridiculous part. "
289," So there were users on this very sub posting propaganda and this of course means nothing?

 "
290, Hey I want to come back to the UK one day. 
291," The thing is you will read lots of Historians saying it was impossible or people spouting or sorts of magic statistics.

But wars are not won on hindsight or numbers, they are won on the battlefield and in the political will of leaders.  

Now lets look at how victory was possible. Two main things needed to happen.

1 The British Government needed to surrender.

2 The USSR needed to be vanquished.

If both these things had happened the war would have ended. The US could not have hoped to beat Japan and Landed forces in Germany by itself. The continual defence of Britain and Russia stopped the Germans and allowed the Allies to roll them back.

So where these two things possible?

The short answer is yes.

But lets look at the big answer. In 1940 the German army faced a force which had roughly equal numbers of troops, more gun,  more tanks and a far better strategic situation. It did have a superiority in a couple of factors, in the air and the use of its' panzers as an strategic force. The allies were dug in, had better tanks and in many cases better troops than the Germans. On paper it was impossible for the Germans to win, but they did. They won and spectacularly so. How did they do it? They had a far better plan and reluctant governments  in Belgium and Holland. 

This is a good example of what was possible in WW2.

So lets look at if the British government could have surrendered. The royal navy protected its shore and made Operation Sealion a pipe dream in many ways, but continually pressure around the world did wear the government down. If Britain had fallen Operation Overlord would never had happened, fresh troops would be free to be sent to the east and factories could produce larger numbers of armaments to fight on.

But the second point is where the war would be won or lost. The Germans deployed most men to the east and lost most men killed there. This was the place where they would have to win and gain victory. Operation Barbarossa caused the Red Army 5 million casualties and even the ""endless hordes"" as people sometimes try to paint the Russians as, could not take these losses for ever. The Soviet forces Mobilized 35 million men and lost a seventh in the first six months of the war. 

People will say the war was lost when Moscow was not taken in 1941 and the Germans were doomed to be defeated, but this doesn't hold much water. If the German had repeated this success in 1942 they would have been able to keep fighting much longer. Again the Germans had beaten a force much better on paper. So what happened to stop this? Many things the number of armoured forces on the Eastern Front weakened in 1942, many panzer divisions sat around and didn't take part in offensives. The Russian fought harder and didn't lose as many men on the battlefield or in encirclements. The Germans had to keep so many divisions in the West, which meant they were relying on Axis troops to fill in gaps in the line.

Stalingrad was a big defeat and a great Soviet success, but it again didn't doom the Germans. Production of tanks and the numbers of men on the Eastern front increased after it. In 1943 the Germans again could go on the offensive, but the Russians were prepared and after Kursk pushed the Germans back to Germany.  

The fact is as long German could keep winning victories, they could keep winning the war. 

 "
292, Yes I think we are. 
293," I would love for the government to fall, but the government knows how fragile it is an would't take risks.

They know who did this and how, they are just waiting for the Russians to keep lying easily proven false. "
294," It is hard to say if the government is winning when fighting an insurgency.

Isis has taken a knocking, that is trur, but there are still three other factions which have to be beaten before the end is near. "
295," This party line has appeared recently. Russian on the verge of winning or 99% succesful. 

https://syria.liveuamap.com/

It doesn't seem to hold much water. Assad has a long way to go before he controls Syria. "
296, It means (((((((((((((Soros)))))))))))))) pay Trump to use his basement for (((((((((((((eating Pizza))))))))))))). 
297," We have Berlusconi, the proto Trump. Stupid, despised by many of his people and a friend of Putin.

We have a Facist group which likes Putin, because why not? They look at a land where truth and freedom are restrained as a good thing.

I have to admit that I am confused why the five star movement want anything to do with Russia. It seems they fall into the same anti Eu pro Russia trap many others do. 

They does seem to be a pattern here though. Any govenment which likes Putin is weak, corrupt and filled with idiots. "
298," You prefer a state owned proganda machine rather than western sources?

I can say a smart man is doing something stupid or a a good person is being bad.  To state that a whole nation of 140 million people are barbarians and to say bombing civilians and ignore ISIS is barbaric are tow very different things.

How was Maiden a bad thing?

Why not move to Russia if you prefer it so much? The women are beautiful, the people are smart and welcoming . "
299," She did not call the Russian people Barbarians. She said the actions of the Russian Armed forces were barbaric. A big difference.

The overthrow of puppet president and removal of corruption are a bad thing now?

Now here is a few links for you.

https://www.theguardian.com/media/2017/nov/29/24-hour-putin-people-my-week-watching-kremlin-propaganda-channel-rt-russia-today

http://www.bbc.com/news/world-us-canada-41991683

https://www.nytimes.com/2017/09/13/magazine/rt-sputnik-and-russias-new-theory-of-war.html? "
300, Maybe they had you tagged in RES? 
301, What is wrong with him being a Kurd? 
302, Why are you posting literally propaganda here? There is not a conspiracy just slander and assumptions. 
303," Russia can't steam roll Europe.

They don't have the tanks, the planes, the missiles, the money, the troops.

Russia had four things in large quantities, Nukes, Fossil Fuels, Subterfuge and Corruption. It is not the Soviet Union anymore. "
304," Not sure why you are bein downvoted.

There is nothing wrong with anything in your sentence, it is all correct. "
305," Or Russians who shot down a plane.

Or a dictator who opened fire on protesters.  "
306, I guess they are worried that the Kremlin will try to finish them off. 
307," My theory is that Russian wants discredit the rebel and buttress support for Assad, as a fighter against ISIS. 

They now the attack is happening before hand so try to pin it on the rebels to make them look bad.

How are the rebels getting chemical weapons into an area under siege? "
308," Maybe the Skripals don't want to see any Russian officials?

 "
309," The problem is you have to trust the Kremlin with this narrative.

Or maybe the Russians knew Assad was going to use it and then announced it to world as a false flag. "
310," Russia are the enemy.

If you look at the actions of the president over the last 18 years, there is a clear pattern. It doesn't need propaganda just the facts to see this. "
311," Why should I have a nihilistic view of the world, because I like conspiracies?

I like to search for the truth,  not disbelieve everything. "
312," Anti something can mean the organization or in general in the English language. For example ""I am anti Vegan"", this means I disagree with the ideas behind the group rather than the individuals involved. "
313," Which slur?

Putin?

 "
314," Boris is pushing this to gain power that is true.

He sees an evil, war mongering idiot and knows standing against him will win the support of voters and people around the world. "
315," What a good bait. Caught lots of ""Patriots"" who love Russia more than their own country.

Some mods here do have rather specific tastes about conspiracies. "
316," As long as they follow the sub rules, I think they should be allowed to talk rubbish here as well. "
317, It wasn't slavery then? 
318," Lol

No it doesn't.

Why not join the real world? "
319, You don't believe the Russians pay people to say this is a false flag? 
320, 300 years in the UK doesn't seem so bad. 
321," The cold war never stopped it just had a break. Russia is trying to expend its' power, but can't really force the world to move its' way any more. "
322, Really? 
323, What is your theory then? 
324, I have to agree with you there. 
325," Why do you think the author identifies Russia as a ""convenient scapegoat""? "
326," Why do you like the Kremlin so much?

An honest question. "
327, It is simple for Russia. Stop doing dodgy shit and when some dodgy shit happens they won't be blamed. 
328," Welcome to a conspiracy sub. 

If we can use conjecture and speculate here, where can we? "
329," What is left?

First of all motive. An ex spy and a tratior. He was an enemy of Russia.

Precedence. Radiation poisoning is of the table now, but the Russian Government has record of using drastically powerful weapons to kill it's enemies.

The fact is nerve agents can't be made at the kitchen sink. They need good chemists and a top lab. They also leave a trail which can be followed and are not a good weapon for criminals. 

I don't know why are Pro Kremlin. What are the good things about Putin's actions? "
330," Sorry.

I mean anti Putin. The Russian people are ok. "
331," Would you like to keep something sealed away, that if it leaks will kill you painfully and slowly and use it many years later on an old man. "
332," It seems the officer fired at the same time, but hit the gun. "
333, http://www.fox5dc.com/news/maryland-high-school-students-return-to-class-for-first-time-since-deadly-shooting 
334, http://www.fox5dc.com/news/maryland-high-school-students-return-to-class-for-first-time-since-deadly-shooting 
335," It would cost a huge amount of money to develop and then would cost some of the most powerful people in the world to lose money.

Of course it is being stifled. "
336, The man shot himself. 
337, It was paraphrased from Mein Kampf. 
338, A nerve agent is not something you want to keep around for years. It is unlikely that it is a rogue agent. 
339," Have you lived under the Russian government?

You will understand that they are on another level compared to western government.

The ""Yuan petro"" currency will not challenge the dollar and will probably damage the chinese economy.  "
340," Why do you think Russia didn't do it?
 "
341, Who do you think did it? 
342," Most stories I find do pop out out of nowhere.

Some stories like this have hints or clues before. John Oliver did a show about this last year. "
343," This is true.

The Russian Militiary is strong on paper, but couldn't beat the EU. China's fleet is still a long way of from being able to take on one af the many US fleets floating around the world.

The ""Allies are still far more powerful than the rest of the world at this point. "
344," Pack it up boys we have the facts.

This proves it never could be Russia and it must be Soros or Shillary./s "
345, Where can I get my Sinclair bucks? 
346," People can dislike more than one thing at once.

You can be anti Russian and not trust the government as well. "
347," We don't know it was just bluster. 

The UK government have no reason to blow this up so much without anything behind it.

The is a lot more evidence which will come out about this and the government is playing it cards close to its chest.

There is still no suspect, that has been announced yet for instance or how they were poisoned. "
348," Syria is worse than all those countries.

 "
349," This exactly.

The amount of times a thread will appear and the comments will rip the propaganda apart.

Look at new and you will all sorts of good threads downvoted. "
350," The greek people wanted something and the greek government gave it to them.

Unfortunately the thing they wanted was unsustainable and the government never had the balls to say to the greek people no. It will be like Brexit, sometimes they government has to tell people that what they want can't happen. "
351, Seems quite weak on their part. 
352, I disagree with pretty much everyone of your questions. 
353," https://www.youtube.com/watch?v=KQA2X4yvK_g

This is what he does normally. "
354, Gives them information? 
355, Wasn't GPS Fusion originally hired by the Republicans? 
356," You are missing the best one.

https://en.wikipedia.org/wiki/Gleiwitz_incident

The germans staged a fake attack on a radio station to give a reason for the start of WW2. "
357," You are forgetting that the clock is ticking against them and eventually the people will want to stay.

They already know the three choices they have;

1 Stay in

2 ""Vassal state""

3 No deal

Why is taking them so long when they have no power in negotiations? "
358," I think it will be fudged in the end.

Laws will be moved or ignored.

The EU don't want us to leave, most politicians here don't want to leave and the number of the public who do shrinks everyday. "
359," I don't think it will go that far, but we will have spent a huge amount of money for little. "
360, It was a lot more complicated than that at the moment. It was impossible to declare war on country before it existed and it was not about democracy rather and independence movement. 
361, They have already negotiated  a extra period on top of that and will go for more extensions. 
362," I am in favour of it, but the government should be clear to people about what will happen.
 "
363, They could have started earlier and been serious in discussions. 
364," It seems we will see on of the most unscrupulous events in British Democracy.

I don't support Brexit in any way, but the government seems to be delaying the exit until the majority of people who voted for it are dead and then will cancel it.

It has been two years already and it has not happened and it never will. The government should be honest with Brexiteers and move on with running the country.
 "
365, How does this website have this information?  
366," Iraq was a shitshow I agree.

Libya is what I always find strange. Gaddafi was an awful human being and nobody is sad he is dead. Libya is far better than Syria at the moment.

Why does it always come up in these conversations? "
367, Why did you omit Shillary Clinton's Shill Farms? 
368, I think this is the most likely result. 
369, Or maybe Russia should stop using nerve agents. 
370, Why do you believe Russia over the west here? 
371, Sounds like a conspiracy to me. 
372, The truth will set you free. 
373," I have looked into him, but he didn't invent the term mainstream media. "
374, So you think we should stick with mainstream media? 
375," Can you post a time stamp or tell me the time he said it, I may be a little deaf. "
376, I have to agree with you. 
377, You don't feel it is attached to one political group? 
378," Didn't hear the term mainstream media.

It seems his words have been taken over by certain people in the establishment.  "
379," Who first used it ?

Here is a link, but not final answer.
https://www.phrases.org.uk/bulletin_board/62/messages/110.html "
