,post
380," I am not disagreeing about the fact that most people watch the news.

It just seems the worst term to use to describe it. Why not use a term the better reflects what it is?

What would you call it? "
381, Seems better than what we have now. 
382," When did the term  Mainstream Media appear?

Educate me. "
383," It does not mean anything it was cooked up by some politicans to smear people they didn't like.

It does not mean anything when you think about it. Is mainstream good or bad? "
384," No we can't.

But can you focus on why you disagree with me? "
385, That's why I think Mainstream media is not a good term. It doesn't reflect what is actually going on in the USA. 
386," Why is it stupid, can you elaborate on your point? "
387," That was quick.

What is your problem with my suggestion? "
388," Every time is see MSM I think of this.

https://www.youtube.com/watch?v=XI2gHNKW0cQ
https://www.youtube.com/watch?v=VsrcplYd0i8
https://www.youtube.com/watch?v=KubyuvOgoiI

This is term created and used by a political group to separate and divide people. It makes people seem like they are n the fringes for disagreeing with media companies.

Why not use a term like Corporate Controlled Media?

http://thewei.com/kimi/just-6-companies-control-90-of-the-us-media-and-your-perceptions/

It shows the difference between the people and the elite and doesn't make us look like fringe lunatics.  "
389, Look at Tumblr for five minutes and you will see stuff about it. 
390, It will take time and a lot of noise fromt the public I think. 
391," The far left also have member who seem to be against ""race-mixing"".  "
392," A video by a wargamer exploring the military history of the 1940 Battle of the Netherlands. This video tries to meld history and wargaming to help teach people about history. I found his work interesting and I thought I would share it about and see what other people though about it.

I find this period fascinating and anymore infomartion about this time period would be great. "
393,  
394," Once the final agreement has been worked out or if we are having a hard Brexit.

The people should have all the info on the table and then people can make a real choice and live with whatever result they pick. "
395, I would not expect much action here. This govenment like to keep to many stones uncovered. 
396," In May 1940 in Holland the 6th Air Division (latter 1st Fallshirmjager Division) drop in to capture many key bridges and air fields.

Here is a refight of one of those drops. 

If anyone can critique and give info about this battle. "
397,  
398," In May 1940 in Holland the 6th Air Division (latter 1st Fallshirmjager Division) drop in to capture many key bridges and air fields.

Here is a refight of one of those drops. 

If anyone can give a critique it would be good. "
399, Where? 
400, Time is a circle. 
401, What happnes if they Far Right do this. You could lose your job for being married to somebody of another colour. 
402," I shouldn't have to much of a dig, people still laugh at my pronunciation all the time. "
403, How do you mean? 
404," I don't think he would have won a truly fair election against a real opposition, but that is just speculation.

  "
405, I have had the same experience as you. It seems they have evolved and added a few topics to back up that they are a real person. 
406, You don't think it was a rigged election? 
407," Russians don't love to vote for Putin. If they did, he would not need to fix the election.

Russians have always been willing to go along with the leader's crazy plans and then complain about them. They are smart people, but seem to have a blind spot when it comes to leaders. "
408, Do you believe there are Russians paid by Kremlin on here? 
409," I am not sure it is a translation problem, they don't seem to understand the western mindset.

I disagree with you about more people shouldn't trust the government. Putin would be out tomorrow if the Russian people cared about politics. The only reason we don't have people like him in our country is due the strength of the people. "
410," I have to agree with them, but their pronunciation was pretty bad apart from the boy at the end. "
411," https://www.nytimes.com/2018/02/18/world/europe/russia-troll-factory.html 

This article is a good start.

The only country I have been to where people have no trust in what their government says, is Russia ironically.

They believe nothing and question everything. It may sound great, but what you have is an uninformed zombiefied mass of people.

I don't doubt that other countries are on here, but they seem smarter than the Kremlin trolls, who talk such bollocks, that they are clear to spot.

Cheers for a good post in response. "
412, Keep up the good work. 
413," Why not focus on one problem at a time.

I think a huge cover up is being done right now by the government, but this is not the place.

This about Russians being paid to manipulate information.

Do you think the Kremlin pay people to be on here?  "
414," I don't think you are a Russian employee, but why does you comment seem straight from the Kremlin?

1 ""their"" not us, sounds strange coming from a person from this country.

2 Whataboutism. Forget Russia, look at other countries.  "
415," So you are against power hungry Republican smearing names, distorting the truth, lying and using the government to attack their enemies? "
416," I think there are Kremlin sponsored users here and in many other subs.

I also think here that they are ignored by most users as idiots. "
417, I wonder if they posted here? 
418, Came here to say this. 
419, Just how they should be. 
420," I am wargammer and it is very similar.

I pray that these hobbies never become super ""cool"" "
421," This company have affected election all over the world.

The infomation is being covered up, but in a few years it will slip out. "
422," The solution would have been for them to save for their future and not fritter away money, but that didn't happen. "
423," Does anyone remember the flights out of Afghanistan, when the worst terrorists escaped before the fall of the Taliban?

We have the biggest catch of an organisation conspiring to manipulate people and the UK government is letting the evidence slip away.

Two good links to get background info.

http://bellacaledonia.org.uk/2018/03/20/scl-a-very-british-coup/

http://bellacaledonia.org.uk/2018/03/22/scl-and-the-phantom-contract/

What evidence is being covered up do you think? "
424,  
425," It is not about UK independence, it is about destroying the EU.

That is what he wants to do. "
426," There seems to be two camps here.

1 Is denying it and saying it is not true and it is not a conspiracy.

2 Is happy that a conspiracy has been uncovered and the people who are manipulating the world have taken a defeat.

No guess who calls themselves the real conspiracy theorists and claims that everyone else is brainwashed. "
427, An Ip which was tracked the the Russian security services no less. 
428," Pretty much this.

I have yet to see another country, were drunk people fight as much as ours. "
429," If you are so English, why are you such a big trump fan? "
430, Good video. 
431," It was not that rude don't worry.
 "
432," I just have trouble with autocrats I guess.

I always feel that they band together. "
433," We are an open country where dissadents can spend their lives, without worrying about the governement hassling them. "
434," I was looking, where does it say this? "
435," If troops satrt lining up at the border, I feel we are farm beyond cutting gas. "
436," You mean a thread full of ""this comment was deleted"". 

Ask Histroians is the worst for this. "
437," The EU would be unhappy, but I don't think the Russians are likely to turn it off any time soon. "
438, Has the Italian government been formed yet? 
439," The reason some leaders in eastern Europe are Pro Putin is because they have been blackmailed and manipulated by the Kremlin. 

Did you not watch the Cambridge analyica doc the other day?

The Gas is always blown out of proportion. Russia would go bankrupt with out selling the Gas to Europe. "
440," Just when you think they can't be any stupider, they go and do this. "
441," He seemed the type of politician we needed in the EU, to help us.

This will be the damage, if Brexit happens. The long term affects will ripple for many years and really damage us. "
442, What does that have to do with anything here? 
443, I feel it was still bullshit in the original language too. 
444, Sums up the whole situation quite well I thought. 
445," If some countries say no, it could be to do with having Russian puppets as leaders.

Looking at Poland and Hungary. "
446," This is not even good propaganda.

""Tried to launch a cold war""

What does that even mean? "
447," Hey bots this thread went up in the very early morning in the UK.

Heads up for next time fellas. "
448, I spent more time in Russia than that and I am still not fluent yet. 
449, The previous power sharing deal. 
450," I was looking at this.

It seems this company is involved in emergency services rather than elections.

The SLC (slimey lying cretin) group are where they really do their work. "
451," She must be a super woman.

 I have been studying for a couple of years now. "
452, What has changed from when they made the last deal? 
453, Or they will think of their wallets and make a deal. 
454," The fact is they have left Northern Ireland without and effective government.

They should not be paid until they reach a deal. "
455," They don't work and they wanted a pay rise?

How are these people still around, who elects them? "
456," Russian is bloody difficult, not for the faint hearted. "
457," This old lie.

He is not beloved by Russians. "
458," ""Nice Girl"" Alert.

 "
459," A bit late, but here it is.

I was depressed for about 4 months, every second of every minute of every hour of everday. 

I was annoyed and frustrated and felt my life was slipping away.

Then I changed professions, studied and got a job I love. "
460," I guess it is a blanket protection to stop some people being screwwed over.

Or the government deciding to kick some people out. "
461," Wow

How do you think the government establishes facts? "
462," I feel that Cobryn can't become PM if the people don't trust him on foreign policy.

I like the fact that his open and meets with people who I disagree with, to be honest.

It is a different situation with the Kremlin, they will keep pushing until they feel force back. "
463," Maybe people on here disagree with what you are saying.

It does seem suspicious that a post will be massively upvoted, but all the comments in the post are actually contrasting with what is being said. "
464," I don't understand.

I am allowed to not be happy with Corbyn's response and feel he should do more?

Especially since I don't want the tories to stay in power any longer "
465, https://youtu.be/Igx_hB2XOzE?t=44 
466," Yes.

Watch it and see what he says. "
467," Here is the foreign secretary talking about it.

https://www.youtube.com/watch?v=Igx_hB2XOzE "
468," In a world were Putin has done far more dangerous and awful things. Those comments could applied to most of the countries in the world with no problem.

 "
469, Did you watch the PM's remarks in the house of commons? 
470, Thank you for the information. 
471," So I listen to and believe the government.

What is wrong with that? "
472," I think it will bite Putin on the arse. Some of these groups will eventually turn on Russian and call for war, they always do. "
473," The government has said it was a Russian attack, have they not? "
474," Unless I am mistaken the scientists at a top secret weapons site don't go around talking to members of the public.

They give information to the government which then acts on it. When the PM says the country was attacked by a Russian nerve agent I believe the information is correct. "
475, That is some good news then. 
476," When did I say you were wrong?

Asking for facts is part of good discussion.

But again, when did the British government use nerve agents? "
477," The PM said after analysis from Porton Down informed the government that it was a Russian nerve agent.

The fact is believe what the government is saying here. At Porton Down the best scientist in the world work at identifying chemical and biological compounds and again I trust these people. The fact is the Russian governments childish response has removed and doubt that it was them. "
478," Ok prove me wrong.

When did the UK government use a nerve agent? "
479," Hitchens is one of those people who loves to argue about free speech and how far it goes. I don't mind the philosophical discussion he tries to have, but it seems out of place here. "
480," I don't know the guy personally, but the person who has to brief the PM on chemical attacks.

I know what you are going to say, it could be lies or a false flag. But to be honest I trust the government on this far more that the Russians.  "
481," Wow.

You can't produce facts, so I should shut up? "
482," Not sure about equipped though.

When I spoke to people in the army the mentioned ""borrowing"" equipment from the yanks and signals gear from the danes. "
483, When did we use a nerve agent? 
484," I am, but I don't think his comments go far enough.

Do you think he could have come out and said something stronger? "
485," Absence of evidence.

Why don't they claim none of this happened, it would be more believable at this point. "
486," He says he is not a supporter, but does not say he is a critic.

He uses generalizations instead of saying what actions he disagrees with.

And most importantly he does not say anything about the foreign affairs of Russia. No mention of hacking, political interference, attacking countries, assassinations or supporting dictators around the world.

It all strikes me as being far to weak and this will prove to be an albatross around his neck going forward. "
487," I agree that in the past we have run off to fast into adventurism, but on anything related to Putin we have to come down hard.

The Kremlin love to muddy the waters and distract from the truth. "
488," It was so weak and he could say much more.

If you compare that to other remarks he has made there is a big difference.

I like the guy and probably will vote for him, but he has to realise what sort of world we are in and be ready to defend the country. "
489," Great post. 

 "
490," Can you send me a link where Cobryn personally has a go at Putin.

I am not some right wing tory nut, I looked into this a while ago and Corbyn has always remained silent on Putin. "
491," The scientist at Porton Down have said it was Russia. The facts now say it is Russia and the anymore facts that come out will support the fact it is Russia.

When did attacking actions, which cause harm to British people become overzealous? "
492, Get ready for the comments from the Kremlin. 
493," That is true.

Except there are enemies out there that needed to be defended against. We have a leader ready t drag his country int a war it can never win. There needs to be a balance of course, but I do think we need to increase military spending to stop Russian aggression. "
494, Too true. 
495," I am for real, but we are not sabre rattling yet.

We are taking a strong action against a rogue country, who needs to be told it's action aren't acceptable.

The Russians d have more nuclear weapons, but that won't matter when they start flying. It will be the end of the world as we know it.  "
496," Good remarks.

Hopefully Labour can rise up from this and not get distracted defending Putin. "
497," I think it could be very interesting. 

I watched the Cambridge Analytics guy on there and he said some statements which seemed very hard to be true. Lets see what Zuckerberg says.

Hopefully /r/spez will end up there soon. "
498," It is weird how many people cherry pick the parts of Putin they like, but ignore the whole picture. "
499, I am in the case of the majority here. I think this will cost him the next election. 
500," For many reasons

1 He is an intelligence asset for the government.

2 We have never used nerve agents before, I don't think a 60 year old man in Salisbury is a good premier.

3 He lives in the UK, he could have been arrested or expelled anytime we want.

4 The most important reason we didn't do it is because Russia did. "
501, Russian is not in non travel territory yet. I have lived in Russia with no problems. 
502, Why do you feel it is dangerous? 
503, Your English is good enough don't worry. 
504," What a difference a month makes. Corbyn goes from dodgy commie traitor, to herald of peace. 

I don't want to become a total paranoid, shouting at the shadows, but there seems to be a connection. Putin, this man seems to be a central figure to so many. Not his actions really, but what he seems to represent.

Hitchens here seems to have completely lost the plot. Nato is bad, nobody knows anything abut Russia and Libya is worse than Syria.

I don't think Hitchens is a Russian Agent, he is an arrogant man who likes to be right and here is an argument where he feels he can make himself seem righteous.  "
505," Two jump to mind straight away.

Marinus van der Lubbe.

This Dutch man was a fantasist, who was framed for burning down the reichstag in 1933. He was picked due to his low intelligence and links with communist organisations. The nazis used this to consolidate power and establish a dictatorship.

Leonid Nikolaev

Another patsy this one was a malnourished angry ex communist. Jobless and angry against the world, he was picked to kill one of the most powerful me in the USSR. In 1934 he shot Sergey Kirov head of the communist organisation in Leningrad. 


 "
506," It is annoying that he is destroying Britain's future by keeping the tories in power.

The fact is Cobryn has never said anything bad about Putin. I looked it up last year and there were vague statements, but no real criticism. I don't mind if he meets with groups, who I don't like, but The Kremlin is another matter indeed.

Hopefully they can knock some sense in him soon.   "
507," Have you spoken to Russian people?

They don't watch the news or even know any of this is happening. You seem to think everything the British Government says is lies and have a fondness for dictorships.

What country are you from by the way? English doesn't seem to be your first language. "
508, Good point. 
509, Not enough comments? 
510," It seems to be active by comments, not by upvoting or number of subs. "
511, Why so? 
512," It seems another Russian Exile has been killed. Tensions are already high and I think they will get higher.

http://news.met.police.uk/news/murder-investigation-launched-after-man-found-dead-in-new-malden-298894 "
513, http://news.met.police.uk/news/murder-investigation-launched-after-man-found-dead-in-new-malden-298894 
514," They all know it.

They don't watch the news, most people there don't even know this is going on. "
515," It may not be the best thing, but it seemed something out of the ordinary.  "
516, [removed] 
517,  
518," I guess they had better taste.
 "
519, Excuse me? 
520," Unfortunately it is not true, although it does always seem to come up in topics.

The soviets had just smashed Manchuria, but a landing was out of the question.

The US and UK had completed multiple landings and knew it would be a bloodbath even with all the right equipment and experience.

The USSR had no equipment or experience and they way of fighting would not have worked in a naval landing. 

This idea seems to have come out of Russia and reflects their view of the world.  "
521, Or the daily mail 
522," That term is only used by ""enemies of the people"", don't you know "
523," Old habit, I call the UK there as well.

I one of May's citizens of nowhere I guess. "
524, Yep 
525," Many everyday, I live there.

I was speaking to one when I read you comment and he had no idea abut the whole thing. "
526, I think it would be interesting to compare the two sides at least. 
527, Most Russians I speak to have no idea about this. It isn't even on their radar. 
528," This is a good sign, I was kind of expecting him to ignore it.

 Or say both sides have good spies, but not as a good as someone he knows, which is the best person he has, but not as good as they told him he was and has been the best which is very important for making America great again.

Or something like that. "
529," Much better than I was hoping for, but lets see actions. "
530, They laugh at me as a foolish westerner. 
531," https://lawfareblog.com/prime-minister-mays-use-force-claim-clarifying-law-governs-uks-options-1

This link works. "
532, And what did you think? 
533," Sort of.

It was stronger than I expected and I am glad he said it.

But I still feel he can go back on it. "
534, Do speak a lot with russians? 
535,  
536, I wonder how Putin will react to this. 
537," The clip actually shows him saying it was Russia. 

""We treat that as fact"" "
538, Ofcom will ban them soon don't worry. 
539," They are a joke.

Apparently only 55% of people know how Navalny is. Lol

There is not a single person I have spoken to in Russia who didn't have an opinion on him. "
540, Thanks 
541," RT are not going to say Putin did it, now are they. "
542," They are cool.

There are some things I don't like about them such as Racism and Homophobia, but they are fed propaganda about this.  "
543," Having lived there I can say this isn't true.

You don't find many people who like him. "
544," Try this website.

https://snoopsnoo.com

It looks at a profile in 5 secs. "
545, http://thehill.com/homenews/administration/378083-deputy-tillerson-is-unaware-of-the-reason-for-his-dismissal 
546," I think that they will give the cash back, but things are moving in a bigger direction. "
547," Russian people don't love him, they fear him.

He is the worst leader they have had in a very long time.

He is corrupt, murderous and isolating Russia for very little gain. "
548," No he hadn't.

He found out from twitter. "
549," It turns out the circlejerk was correct.

Cum for everyone. "
550," As much as I don't like the tories, it is not the moment for political shots.

I don't like a lot of the choices they have made, but we have to face this issue straight on. "
551," Of course it was linked.

Tillerson has not gone aboard the Trump Train's destination of servitude to Russia. "
552, Farage and Salmond could lose a few nicker then.     
553, Or Hilary and Obama. 
554," It was up earlier, but with the sub private now, I am not sure. Maybe on an archive. "
555," I am sceptical too.

It does seem conected with comments yesterday about Russia. "
556, So I guess this is not the first time the CIA have been involved in a major way with a political party? 
557," Fair enough making the sub private.

I justed want to see about the nomination of /u/recoveringGrace, I don't remember who nominated him. "
558, What happened to the nomination thread? 
559," They must know how bad it will make them look, espically right before a special election.

They just ended the house intelligence comitee's investigation, which drew some heat of them. But now they replace Tillerson and Trump is silent on the chemical attack.

I do believe they are stupid, but to say this has not been thought about would be crazy.

My money is Trump ordered it to be sped up. "
560, The fun part is Trump is both. 
561," Then why announce it today?

The fact that he critised Putin is definitely why he is gone today. "
562," I guess you don't believe that yesterdays remarks speeded things along.

Tillerson has been treading water since he called Trump an idiot, but being fired straight after critizing Russia seems strange. "
563, But the willllll of the peopleeeeee. 
564," People chatted in the other threads.

I felt it was the wrong time, May was doing something good and he should have backed her on this issue.

Unless he is a secret commie agent of course. "
565," Lets see what trump says.

Edit. Trump says your fired. I guess critizing Putin will lose you the job. "
566," So leaving the EU will cost companies across the EU billions. 

Why are we still wondering, why they are unhappy about this?  "
567, Ancient Civilization is always interesting for me. The are so many clues around the world and infomation to dig into. 
568," True, but reading through it, it does all above board. "
569, The nomination thread all seemed pretty legit and hopefully they will be good. 
570, Just wondering what they think is the most interesting conspiracy at the moment or something they always enjoy reading about. 
571, Can I ask a few questions about the new mods? 
572, What job did Bush Snr have before he was president? 
573, Downvoted for pointing out a clearly Nazi sub. It took 2 secs to look at that sub and realise what it was. 
574, I guess the people from uncensored news came here then. 
575," I joined it after /r/news started hiding the race of terrorists, but it quickly became a haven for Nazis.

I am not talking about right wing people, but people who on the fringes of the right. "
576," Of course the white house won't say anything.

But don't worry tomorrow Trump will come out with something completely opposite. Maybe against Putin or against us. "
577," Putin seems to have misjudged the reaction of this.

I guess he thought it would show how powerful he is, but instead it will put pressure from the west against him. "
578," Most Russian people I speak with think war is miles of. They don't want war and I think will be very angry with Putin once this heats up a bit.

I think it is more aimed at the people at the top, to keep them in line for the election. "
579," The plane that was shot down by Kremlin backed Rebels. Then covered up by the Kremlin.

Those people were only ""Rogue"" when they shoot down the wrong plane. "
580, Russia. 
