,post
191," So I study every day for hours on end with extracurriculars almost every day. Well, she studies every day, has more extracurriculars, and has a job on top of that.

I read a book in French to try to extend my learning. Well, they went on exchange to France for months and will probably come back fluent.

Im in the accelerated math class and suffer extreme anxiety as I try to learn the content, and then end up with mediocre grades. Well, she is in the accelerated class, has perfect grades, and aces hundreds of math competitions.

I play sports and have been chosen for certain specialised programs. Well, they have been noticed by universities and are on a fast track route to an amazing future.

I labour relentlessly over playing the clarinet and learning music theory. Well, they are all playing at a professional level and have been sent on a worldwide tour to showcase their talent.

And these are only a few examples. I really am never enough. Im such a useless idiot. I deserve to die. "
192," I dont think so! You look a little sad in these pictures, but overall your facial structure, eyes, and hair is lovely. "
193, Thank you so much for the advice. 
194," Im so sorry. I wish I could be there to give you a big hug. If you ever need someone to talk to, please feel free to message me.  "
195, Of course! 
196," Me too. All of my friends are so beautiful, and then there is me. "
197, Thank you so much for all of the advice. 
198, Sending you the warmest online hug possible. Lots of love. 
199, Please try to reconsider. We all love you and care about you. We dont want you to go. 
200, Im totally paranoid about that. Eek. 
201," Its gradual, so you dont really notice it yourself. I began to feel more aware of my own body, I suppose, particularly in certain outfits, which made me quite nervous and self-conscious. "
202," You are absolutely handsome and adorable! You look sweet and friendly, with lovely hair and a warm smile. Have some confidence! Love, Elsa (16F) "
203," Youre not a waste of space. You deserve to live. I know that because first of all, you are conscientious and introspective enough to say all of this. Secondly, you have survived to this point despite all these horrible things that are happening to you. You are stronger than you think.

I have to go to sleep now, but please message me if you ever need to talk more. Sending love your way! "
204," ""The Legend of Ashitaka"" by Joe Hisaishi and the New Japan Philharmonic. It somehow grounds me, even though it is quite sad. "
205," I cant stand exams. My instant reaction is to cry out of frustration during tests, which is so frivolous and annoying. It looks like Im just doing it for sympathy, but in reality I cant help it. I end up with shaking hands and a wet test paper and less time to answer the questions. I really hate myself. "
206, Never thought Id see this conversation play out! 
207, Whats on your mind? Please talk to me. 
208, I relate to that statement completely. Im not sure what to do. Just know that you arent alone - sending you a warm hug. 
209," Youre not alone. Im here for you. Try to explain, if you can, why you think that you hate yourself. Im listening, and I care about you.  "
210," If you have any, please leave tips in the comments pertaining to making unbearable days more tolerable when depression, anxiety and suicidal ideation are making you feel hopeless. I know that very few people will see this post or care - but its worth a shot. Thank you for reading! "
211, Whats on your mind? 
212, You look nice! You have a lovely facial structure and good hair. 
213," Please dont commit suicide. And please dont do it by train, because you can hurt others. "
214, Whats on your mind? 
215, Thank you so much for this! 
216, I think you are very attractive. You look kind and welcoming! 
217," Youre not at all odd-looking! You have a good facial structure, nice hair, and the glasses complement you. "
218, Thank you for this. I never would have thought of it like that. 
219, Its good to recognise that you are overthinking. Try to have faith in yourself - Im sure they arent as judgemental as you think. 
220, Thank you for the advice! 
221, Thank you so much for the encouragement. 
222," Thank you. Ill try!
 "
223, Good luck! Try to have fun. 
224," Thank you so much, as always. "
225," I am a person who experiences toxics envious thoughts constantly. I feel so absolutely disappointed in myself for almost wanting others to fail. Even my closest friend, for example - she recently got a job, something that I am too anxious and lacking in self-confidence to do. I felt completely nauseous upon hearing the news, even though I know I should be happy for her. Of course, I still smile and congratulate her, but inside I am crumbling.

Another example is end-of-year academic awards. I performed poorly this year, something that crushes me every day to think about, and I know that I wont get an award. I find myself filled with contempt for the intelligent individuals who are receiving top marks, which also manifests in more self-hatred.

What is wrong with me? Why am I like this? I am a horrible person. "
226, I feel exactly the same way. 
227, Yep ): 
228, Me too 
229," It sounds like youre going well so far. I know, it can be so difficult to get things done with anxious thoughts running through your head, but you need to forgive yourself. Keep trying your best. "
230, Youre very attractive - you should be confident! 
231, Thank you so much. Ill definitely message you if I ever need to talk.  
232, Me too. Whats on your mind? 
233, Thats so good. Im proud of you.  
234, ): this is so true. 
235," For the past few days, I have been completely exhausted. I feel lightheaded and sick constantly, and even the smallest chores make me tired. I dont know whether it is anxiety, PMS, or something else.. What is wrong with me? Why am I so useless? I cant even deal with the tiniest things going wrong. Ill never make it. "
236, Im so sorry to hear that. I wish I could be there to give you a warm hug. 
237," My friend got the job. I feel sick to my stomach - Im so worthless, I could never do that. "
238, Please take care of yourself. I hope that youre doing okay. 
239, Whats on your mind?  
240, Why would I lie? What benefit could it possibly give me? 
241, Why would you say that? 
242," You have nice, clear skin, a great hairstyle, lovely eyes, and an adorable smile. Dont doubt yourself!  "
243," Your hair is a lovely colour, and your glasses look adorable. You have a great smile. Overall, you have a kind and friendly appearance! Most definitely not ugly. "
244," Aw, thats okay! Have a lovely day. "
245," You have a unique look, but that makes you very handsome! Your hair looks nice, and you have clear skin. You look sweet and approachable.  "
246, Im so sorry. What has been happening recently? ): 
247, You look great! You have absolutely nothing to worry about. Have a lovely day! 
248, Im going into 10th grade soon.  
249," I made it through another school term, thank goodness. "
250, Thats definitely progress! Thats amazing! 
251, Youre so pretty and friendly in appearance! Dont doubt yourself.  
252, I know how hard it is to be productive or even get out of bed when youre feeling so stuck. You need to forgive yourself for this. Youre trying your best! 
253, Dont be sorry. You are trying your best. You are a sweet and conscientious person. You are enough. 
254," Im so sorry to hear this - I wish that it was better for you. Yes, I definitely do. Even if theyre subdued, Ive always got those thoughts. "
255, Whats on your mind? 
256, Congratulations. Im so happy for you  
257, Have confidence in yourself - you are handsome! 
258," I am so sorry to hear this. You are evidently an absolutely lovely, caring person with a kind heart, and you dont deserve this treatment. I wish I could be there to hug you and help, but all I can do is say that Im here for you. If you ever need someone to talk to, Im here. "
259, Youre not useless. You are worth it. You deserve a life of love and happiness. 
260, Thats okay! Be confident in yourself. 
261, Thank you! Thats a great idea! 
262, 9  
263," I am 16, and I have never had, or applied to, a job before. I hate myself because of it, particularly due to the fact that the majority of my peers are getting jobs. My friend and I were worried about this, and now I find out that she is going to a job interview this afternoon.

How do people like her do it? She saw what she wanted and just did it. Shes on her way to a job. Shes proactive, while I sit frantically worrying.

The main reason that I havent applied is stress, but more specifically the fact that I cannot comprehend why a company would ever want to hire me.I am not intellectually advanced, or particularly cheerful, or pretty, or experienced at all. I wouldnt even hire myself. How will I ever get a job, let alone a successful career in the future?

Also, whilst I desperately want a job, I am afraid of how it will interfere with my school life. I already spend the remainder of my evening after extracurriculars studying and working, and my weekends are filled with sports, music practice, article writing and even more work. I dont want my grades to decline even more.

Apologies for this lengthy vent. I just needed to write down my coagulated thoughts and try to make sense of them.  "
264," Youre not ugly. You are handsome and friendly-looking! Try not to doubt yourself. 
Love, Elsa (16F) "
265, Completely relate to this. 
266," Because I can see that you are caring and conscientious. You are interacting with others. You are admitting your feelings, even though theyre difficult. You are a sensitive and lovely person. "
267, Its not over. You still have a life in front of you. You deserve love and happiness. 
268, Is there anything I can do to help you? Im so sorry that you are feeling this way. 
269," Hey, whats on your mind? Im here for you if you ever want to talk.  "
270, You're absolutely lovely looking! Don't doubt yourself. 
271,  
272," Youre not useless. You are capable, conscientious and strong. Keep persevering - youre not a disappointment. "
273," You deserve to be here. I know youre struggling right now, but just take it one day at a time. Forgive yourself if you cant get up. Be proud of yourself if you can. Keep going, step by step. Im here if you want to chat  "
274," Make a plan. Make some goals. Set them out set by step, and remind yourself why you need to achieve them. Get rid of toxic relationships, quite things that you dont like. Take it one step at the time. What do you want to change in your life right now?  "
275," Im so sorry to hear this. I hope that youre doing okay. Please know that Im here to support you - if you ever would like someone to chat with, Im here. "
276," Wow, thank you so much for that. I watched it all the way through, and I truly feel so much better. I struggle with the same issues, and your articulate and uplifting video is amazing. Thank you again. "
277, This sounds a bit like hypochondria. ): I hope youre doing okay. 
278, Okay.  
279, I care. Im here for you if you need to talk.  
280," Do not kill yourself. You deserve an amazing, happy life. "
281, Im so sorry youre feeling this way. Do you want to talk? Whats on your mind? 
282," Okay, thanks for letting me know! "
283, Ugh that sounds terrible ): 
284, You should! You are an amazing student. 
285, What do you mean? 
286, Aw. ): Try to use it to motivate you in the future! You can do it! 
287," I know exactly how you feel - my happiness is completely weighted upon my grades as well. Dont be so harsh on yourself though - you obviously are a hardworking, conscientious student who deserves that kindness. "
288," Aww yay! Keep it up, youre doing so well. "
289," Im so sorry that youre feeling this way. If it is any consolation at all, Im here if you want to vent or talk to someone. Sending you lots of love.  "
290," Okay, thank you for the honesty! "
291, Whats on your mind? 
292," Thank you so much, you are very kind. "
293, Thank you so much. 
294," Please, please keep persevering. I know its difficult, but youre going to make it. You deserve a happy life. In a few years, you will be so glad that you decided to keep going. "
295," Thank you so much, as always. You are incredibly supportive. "
296, Thanks for this burst of positivity  
297," Im so sorry that you are feeling this way, and I know exactly what you mean - I have experienced it before. If you ever need someone to talk to if you feel rejected, Im here for you. I believe in you! "
298," I relate to this so much, and I want you to know that you are not alone. Just the fact that you are writing this post shows how caring and conscientious you are - you are obviously a lovely friend. Stay strong, and be kind to yourself.  "
299, I know exactly what youre talking about! 
300," Im so sorry that youve gone through all of this. I cant even imagine the pain you must be feeling now. All I can offer is someone to talk to, if you ever need it - my messages are always open. Sending you warmth and love.  "
301," Hi. I know that it isnt much, but Im here for you and I care about you. If you ever feel lonely and want to chat, dont hesitate to message me. Sending love and support your way  "
302," Im so sorry to hear that. ): But please, be kind to yourself. Be proud of yourself for getting out of bed in the morning, and forgive yourself if you cant. Youre going through a lot right now, and you can use the love.  "
303," For calming down, write out your thoughts whenever you need to, confide in someone else, and go to the bathroom to take deep breaths if you feel yourself start to panic. I know how difficult it can be to struggle with anxiety and panic attacks at school, but youre going to be okay. Stay strong  "
304," Do your homework the day you receive it, write revision notes and summaries regularly, knock out assignments immediately, make flash cards, utilise spare time you have in the day and in class, do homework at lunch if needed, stick to your schedule, have a nice warm drink in a thermos to make class more bearable, wake up early to prevent rushing stress, use a planner, take care of your hygiene, be kind to yourself, sleep well, and be proud of yourself. You deserve an amazing year, and I know that you are capable of it. Sending you the best of luck, and love  "
305," I absolutely hate myself. Even looking back at Reddit posts that I wrote a couple of days ago makes me want to kill myself. Im such a repulsive waste of life - unproductive, worthless, and with a future thats crumbling before it has even begun. And what I hate so vehemently is the fact that Im feeling this way on spring break. How can I possibly survive another semester, let alone 3 more years, of high school?

I want another life so badly. I want to be an individual with a future, bright and shiny, lying ahead of them. I want desperately to be accepted into an incredible university. I want to be intelligent and knowledgeable and interesting. I want to pursue and find success in an amazing career in the realm of linguistics. But it crushes me as I wake up each day to know that none of this will ever happen. I am utterly useless, and unable to get through a day without raging, debilitating thoughts. How could a person that cant even make it through one day possible succeed in life? The answer is, I obviously wont.

And I hate how I feel the need to burden other people with this. I am so whiny, so disgustingly insensitive. I know that I will probably delete this later, but I just needed to say it somewhere. I am so sorry for being alive. Such a worthless human being doesnt deserve to breathe. I cant stand myself. "
306," Take care of yourself today. Do little things to make your day better, even if they seem trivial - brush your teeth well, wear comfortable clothes, take breaks in the bathroom to take a deep breath and relax for a moment. Youre going to make it. I believe in you. "
307, Are you doing okay? Whats on your mind? 
308," Yes, I completely am. ): "
309," Please try not to be so harsh on yourself. Here are a couple things to note:

 You are human, and it is impossible to be productive and hardworking for every minute of every day. Sometimes we just don't have that strength, and that is okay.
 A few missed homework assignments will not ruin your life. I feel similarly when I dont receive the grades I want - my anxieties snowball and become debilitating. But there are always ways around things, and there is no cookie-cutter path in life.

I am so sorry to hear about your family situation. I wish that it was better for you. I know that my words probably wont be of much help, but just know that I am here for you. I believe in you - keep persevering, and please be kind to yourself. Sending love! "
310, I am so sorry that you had to go through that. Just know that it is absolutely not your fault. You deserve better.  
311," thank you for this uplifting story, I really needed it.  "
312, you absolutely do not deserve pain. what is on your mind currently that is making you feel this way? I'm here for you.  
313, I know how you feel ): 
314," i know, it can be so difficult. but its going to make you a stronger and more interesting person. "
315," I know how difficult it is to see other people who look happy. but here are a couple things to remember:
1. they might not actually be so cheerful. some people are better at concealing their emotions.
2. you are capable of being happy. i know its difficult right now, but it will get better. you have control - keep making little changes until youre satisfied. i believe in you! "
316, thats amazing. i hope that life treats you well now  
317," aw, im so glad i could help. if you ever need to chat, i'm here supporting you.  "
318," hey, I know it doesnt seem like it now, but one day youre going to have someone who adores to you, who cares for you and makes you smile. youre going to be okay  "
319," its absolutely okay that you werent as productive or outgoing as you would have liked to be today. you are trying your best. you are fighting through a lot of difficult things right now, so give yourself a break and dont be so harsh. you deserve it. i believe in you  "
320, im so happy for you!! congratulations 
321," as long as youre trying, thats all that counts. you are obviously a strong, hardworking person with drive and determination. I believe in you. keep going despite the tribulations - youre going to make it. message me if you need to talk  "
322, haha thank you  
323, please please reconsider. you deserve a beautiful life. you are a lovely person. you can make changes and get out of this. 
324, whats the matter?  
325," I feel that all the time, youre not alone.  but youll make it through, and youll find someone who adores you and cares deeply about you.  "
326, thank you for this - i really needed it  
327," good luck with your studying. if you need to talk, im here  "
328," the point of life is getting better and changing. even if youre not happy with where youre at now, you can keep tailoring your life until youre satisfied. for now, find comfort in the small things - cups of tea, dew-covered morning grass, warm hugs. you can do it. keep persevering  "
329," its absolutely fine to let out your feelings. its absolutely fine to be unhappy with your writing - all first drafts are a work in progress. dont be so harsh with yourself - you are a lovely, hardworking person. i know you can do it  "
330," hi there - im so sorry that you feel this way. if you ever are in need of someone to talk to, im here  i support you. keep trying your best and persevering. "
331, youre welcome  
332, I love hearing stories like this that arent the typical high school to uni experience. it fills me with hope that there isnt just one neat path. 
333," alright, best of luck - im here if you ever want to chat more. youre not forgettable, just know that.  "
334, every single person makes mistakes. every person has hurt others. what makes you stand out is the fact that you are remorseful - you are obviously sweet and caring and conscious of your actions. you absolutely deserve to live a happy life. 
335," it isnt exactly normal to feel this way in the severity that you do, but youre not alone. youre going to make it through this. were all here to support you.  "
336," please dont say that. its not necessarily going to cycle back - it may get better in ways you cant even imagine now. give yourself more than two weeks. keep prolonging the date, keep looking forward to something that keeps you going. I believe in you! "
337," I feel exactly the same way. just know, youre not alone  "
338," you are not whiny. you deserve to hold on. I am here for you and I believe in you. keep persevering, because you never know when life will change. its going to be okay. dont give up yet. "
339," hi wilbur. I am so sorry to hear that you have suffered so much. you dont deserve it at all - you deserve an amazing life. I know its not much, but I'm here for you if you ever need to chat. I love you and I dont want you to go. stay strong - I believe in you. love, elsa.  "
340," I am absolutely sure that someone will adore you for the person that you are. I can tell that you are sweet, caring, and introspective, which are all lovely qualities. you deserve an amazing, loving relationship, and I can assure you that it will come soon. stay strong  "
341," I am so, so sorry that youre going through this. I wish I could help more, but all I can say is that I'm glad youre still alive. keep persevering. I'm here if you ever need to chat. "
342," I know its not much, but I'm here if you ever need someone to talk to. sending love  "
343, please dont go. people will be hurt - you are a lovely person who deserves an equally lovely life. 
344," you are not worthless. you are an incredibly introspective and conscientious person with a caring heart, and you deserve a lovely life. stay strong. I'm here for you. "
345, my less-than-perfect grades and the impossibility of ever attending an excellent university or obtaining a career that I want. 
346," Go to the bathroom and take care of yourself. Drink water, splash your face, clean the wounds. Take a deep breath. Then just try to make it through the rest of the day, and head home immediately to reset and reassess. Im here for you if you need to talk. "
347, Thank you!! 
348, But think about all the amazing things youll miss out on that you cant even see yet. I believe in you! 
349, Im here if you need support. 
350," Please, please keep persevering. I know its difficult, but youre going to make it. You deserve a happy life. In a few years, you will be so glad that you decided to keep going. "
351," Aw okay. Good luck. Stay safe, take care of yourself. "
352," I can already tell that you are a lovely, caring person, because you are considering organ donation. Please just keep persevering - you are worth it. "
353," Youre not a burden. You deserve an incredible, fulfilling life. Dont lose hope yet.  "
354, Thank you so much for the advice! Im actually not a procrastinator - I get things done right away so that my anxiety doesnt take over. My issue is perfectionism - I never know when to stop working on an essay or studying etc.  
355," God, that sounds terrible. Im so sorry that you had to suffer that - you deserve a better life. I know Im not much help, but Im here for you.  "
356," You deserve an amazing, happy life. For now, focus on the small, good things about life - cups of tea, puppies, a warm sweater, spring, novels, kind people. Youre going to make it, and youre going to be so happy that you didnt kill yourself when you were 17. You are completely capable. If you need to chat, Im here.  "
357," Thank you for taking the time to comment again, it means a lot to me. Thats very reassuring. How did the application process work for you? "
358," I'm so sorry to hear that. Isolation doesnt really bother me, as Im quite introverted anyway and I dont know why anyone would want to be my friend. My largest issue is the stress and anxiety and worthlessness that comes with grades, which I know will just get more difficult. "
359, Maybe you can try some online chats or therapy messaging? Ive heard that there are a few free services like that. 
360," Hi. I wish you didnt have to suffer this situation, you deserve better. However, if youre ever feeling a bit lonely or aimless, Im here to chat. I hope youre doing okay.  "
361," I am in a similar situation. I know it doesnt help much, but Im happy to be your friend, even though its only online. Sending love and support your way.  "
362, I feel the same way. Im so sorry ): 
363, What do you mean? 
364," I've been feeling slightly better about life recently... a little excited for the future, which is rare. The anxiety still lurks in my mind, however - will university be what I hope it is?

I currently hate high school. I know that the stress factor wont disappear in university, but is it any more enjoyable? I want some of the aspects of university so badly - studying for hours in a library, walking through the campus in autumn, attending captivating lectures. But is it worth it to look forward to it so fervently? I feel like I will be disappointed. "
365," Im so sorry that this is happening to you. Sending love - if you ever need to talk, Im here  "
366, You dont either. Sending you love  
367," Please reconsider. You deserve an amazing happy life. I believe in you. I can message you in half an hour, if you would like to talk! "
368," Im so sorry to hear that youre feeling this way. If it helps at all, just know Im here for you and I believe in you. Message me if you ever need to talk. "
369," Yes, absolutely! Out of the blue I feel sudden excitement and anticipation for the future, but then I start thinking again and my mind is filled with depression/anxiety again. "
